[
    {
        "sample_id": "1",
        "generation_method": "llm_generated",
        "language": "es",
        "question": "¿Cuál es el número de la guía que describe el profesorado?",
        "answer": "",
        "ground_truth": "La información se encuentra en la página 1, sección 'Profesorado'.",
        "contexts": [],
        "reference_contexts": [
            "[Curso 2022:2023 - Grado en Ciencia de Datos e Inteligencia Artificial - Sistemas Inteligentes.pdf]\nGuía de Aprendizaje\n1. Datos descriptivos....................................................................................................................................................1 = 2. Profesorado.............................................................................................................................................................1. 1. Datos descriptivos....................................................................................................................................................1 = 3. Competencias y resultados de aprendizaje..............................................................................................................2. 1. Datos descriptivos....................................................................................................................................................1 = 4. Descripción de la asignatura y temario.....................................................................................................................3. 1. Datos descriptivos....................................................................................................................................................1 = 5. Cronograma.............................................................................................................................................................5. 1. Datos descriptivos....................................................................................................................................................1 = 6. Actividades y criterios de evaluación........................................................................................................................8. 1. Datos descriptivos....................................................................................................................................................1 = 7. Recursos didácticos................................................................................................................................................10. 1. Datos descriptivos....................................................................................................................................................1 = 8.Otrainformación......................................................................................................................................................12\nBORRADOR"
        ],
        "source_document": "Sistemas Inteligentes.pdf",
        "chunk_id": "Curso 2022:2023_Grado en Ciencia de Datos e Inteligencia Artificial_Sistemas Inteligentes.pdf_ch_1",
        "question_type": "factual",
        "topic": "profesorado",
        "difficulty": "easy",
        "chunk_metadata": {
            "source": "Sistemas Inteligentes.pdf",
            "chunk_index": 1,
            "course": "Curso 2022:2023",
            "category": "Grado",
            "degree": "Grado en Ciencia de Datos e Inteligencia Artificial"
        }
    },
    {
        "sample_id": "2",
        "generation_method": "llm_generated",
        "language": "es",
        "question": "¿Cuál es la competencia CEIA9 del plan de estudios Master Universitario en Inteligencia Artificial?",
        "answer": "",
        "ground_truth": "La competencia CEIA9 consiste en comprender el mercado, sus hábitos y necesidades de productos o servicios en el ámbito de la Inteligencia Artificial.",
        "contexts": [],
        "reference_contexts": [
            "[Curso 2020:2021 - MU Inteligencia Artificial - Ingneiría Lingüística.pdf]\n3. Conocimientos previos recomendados\n3.1. Asignaturas previas que se recomienda haber cursado El plan de estudios Master Universitario en Inteligencia Artificial no tiene definidas asignaturas previas recomendadas para esta asignatura. 3.2. Otros conocimientos previos recomendados para cursar la asignatura - Procesamiento del lenguaje natural - Inteligencia artificial - Aprendizaje automático - Linguistica computacional 4. Competencias y resultados de aprendizaje 4.1. Competencias CEIA1 - Capacidad de integrar tecnologías y sistemas propios de la Inteligencia Artificial, con carácter generalista, y en contextos más amplios y multidisciplinares CEIA2 - Capacidad de conectar la tecnología puntera en Inteligencia Artificial con las necesidades de los clientes BORRADOR\nCEIA9  -  Comprensión  del  mercado,  sus  hábitos  y  necesidades  de  productos  o  servicios  en  el  ámbito  de  la Inteligencia Artificial.\nCG11 - Integración del conocimiento a partir de disciplinas diferentes, así como el manejo de la complejidad.\nCG12 - Comprensión amplia de las técnicas y métodos aplicables en una especialización concreta, así como de sus límites.\nCG6 - Gestión de la información."
        ],
        "source_document": "Ingneiría Lingüística.pdf",
        "chunk_id": "Curso 2020:2021_MU Inteligencia Artificial_Ingneiría Lingüística.pdf_ch_4",
        "question_type": "factual",
        "topic": "tfm",
        "difficulty": "easy",
        "chunk_metadata": {
            "course": "Curso 2020:2021",
            "source": "Ingneiría Lingüística.pdf",
            "chunk_index": 4,
            "category": "Máster",
            "degree": "MU Inteligencia Artificial"
        }
    },
    {
        "sample_id": "3",
        "generation_method": "llm_generated",
        "language": "es",
        "question": "¿Qué diferencia existen entre el peso de las prácticas grupales y el peso del examen final en la evaluación de esta asignatura?",
        "answer": "",
        "ground_truth": "Las dos prácticas grupales tienen un peso del 30% cada una, mientras que el examen final tiene un peso del 40%.",
        "contexts": [],
        "reference_contexts": [
            "[Curso 2020:2021 - Grado Matemáticas e Informática (MI) - Programacion Declarativa- Logica y Restricciones.pdf]\nPROCESO DE COORDINACIÓN DE LAS ENSEÑANZAS PR/CL/001\nANX-PR/CL/001-01 UÍA DE APRENDIZAJE ASI NATURA 105000132 - Programacion Declarativa: Logica y Restricciones PLAN DE ESTUDIOS 10MI - Grado en Matematicas e Informatica CURSO ACADÉMICO Y SEMESTRE 2020/21 - Segundo semestre BORRADOR"
        ],
        "source_document": "Programacion Declarativa- Logica y Restricciones.pdf",
        "chunk_id": "Curso 2020:2021_Grado Matemáticas e Informática (MI)_Programacion Declarativa- Logica y Restricciones.pdf_ch_0",
        "question_type": "comparative",
        "topic": "plan_de_estudios",
        "difficulty": "medium",
        "chunk_metadata": {
            "category": "Grado",
            "degree": "Grado Matemáticas e Informática (MI)",
            "chunk_index": 0,
            "source": "Programacion Declarativa- Logica y Restricciones.pdf",
            "course": "Curso 2020:2021"
        }
    },
    {
        "sample_id": "4",
        "generation_method": "llm_generated",
        "language": "es",
        "question": "¿Cómo se puede proceder para identificar y localizar los datos requeridos en un trabajo de investigación?",
        "answer": "",
        "ground_truth": "Para realizar un trabajo de investigación, es necesario seguir estos pasos: identificar el problema o pregunta a resolver, buscar y seleccionar las fuentes documentales relevantes, leer y comprender la información contenida en ellas, y finalmente, analizar y evaluar los datos para extraer conclusiones.",
        "contexts": [],
        "reference_contexts": [
            "[Curso 2020:2021 - MU Inteligencia Artificial - Metodos de Simulación.pdf]\n3. Competencias y resultados de aprendizaje\n3.1. Competencias CB7 - Que los estudiantes sepan aplicar los conocimientos adquiridos y su capacidad de resolución de problemas en entornos nuevos o poco conocidos dentro de contextos más amplios (o multidisciplinares) relacionados con su área de estudio CB9  -  Que  los  estudiantes  sepan  comunicar  sus  conclusiones  y  los  conocimientos  y  razones  últimas  que  las sustentan a públicos especializados y no especializados de un modo claro y sin ambigüedades CEIA10  -  Identificación  de  áreas  de  aplicación  en  las  que  se  pueda  utilizar  las  técnicas  y  métodos  de  la Inteligencia Artificial. CEIA3  -  Conocimiento  y  aplicación  de  los  modelos  cuantitativos  que  dan  soporte  a  los  procesos  de  toma  de decisiones en sus distintas variantes: determinístico-estocástico, individual-colectivo o estático-dinámico CG13 - Apreciación de los límites del conocimiento actual y de la aplicación práctica de la tecnología más reciente. CG16 - Capacidad de trabajar de forma independiente en su campo profesional. CG17  -  Habilidades  de  gestión  y  capacidad  de  liderar  un  equipo  que  puede  estar  integrado  por  disciplinas  y niveles distintos. CG19 - Aproximación sistemática a la gestión de riesgos. BORRADOR\nCGI2 - Comprender el procedimiento, valor y límites del método científico en el campo de la Informática, siendo capaz  de  identificar,  localizar  y  obtener  datos  requeridos  en  un  trabajo  de  investigación,  de  diseñar  y  guiar investigaciones  analíticas,  de  modelado  y  experimentales,  así  como  de  evaluar  datos  de  una  manera  crítica  y extraer conclusiones.\nCGI3 - Capacidad para valorar la importancia de las fuentes documentales, manejarlas y buscar la información para el desarrollo de cualquier trabajo de investigación.\nCGI4 - Capacidad de leer y comprender publicaciones dentro de su ámbito de estudio/investigación, así como su catalogación y valor científico."
        ],
        "source_document": "Metodos de Simulación.pdf",
        "chunk_id": "Curso 2020:2021_MU Inteligencia Artificial_Metodos de Simulación.pdf_ch_4",
        "question_type": "procedural",
        "topic": "tfm",
        "difficulty": "hard",
        "chunk_metadata": {
            "category": "Máster",
            "chunk_index": 4,
            "source": "Metodos de Simulación.pdf",
            "degree": "MU Inteligencia Artificial",
            "course": "Curso 2020:2021"
        }
    },
    {
        "sample_id": "5",
        "generation_method": "llm_generated",
        "language": "es",
        "question": "¿Cómo se llevarán a cabo las clases magistrales y las tutorías en este curso?",
        "answer": "",
        "ground_truth": "Las clases magistrales y las tutorías se realizarán de forma telemática a través de la herramienta institucional UPM (Moodle Blackboard Collaborate o Microsoft Teams).",
        "contexts": [],
        "reference_contexts": [
            "[Curso 2020:2021 - MU Inteligencia Artificial - Redes Bayesianas.pdf]\n8. Other information\n8.1. Other information about the subject La asignatura se apoya en la herramienta Moodle para proporcionar información y documentación a los alumnos, así como para la asignación de enunciados y entregas de las prácticas, la realización de los test de la asignatura y la comunicación de las calificaciones de los alumnos. Las  clases  magistrales  y  las  tutorías  individuales  y  en  grupo  se  realizarán  de  forma  telemática  a  través  de  la herramienta institucional UPM (Moodle Blackboard Collaborate o Microsoft Teams), todas ellas, en los horarios establecidos, así como las presentaciones orales por parte de los alumnos. La asignatura se imparte de forma concentrada en 8 semanas lectivas con 4 horas de clase semanales. DRAFT VERSIO"
        ],
        "source_document": "Redes Bayesianas.pdf",
        "chunk_id": "Curso 2020:2021_MU Inteligencia Artificial_Redes Bayesianas.pdf_ch_13",
        "question_type": "procedural",
        "topic": "profesorado",
        "difficulty": "medium",
        "chunk_metadata": {
            "chunk_index": 13,
            "course": "Curso 2020:2021",
            "source": "Redes Bayesianas.pdf",
            "degree": "MU Inteligencia Artificial",
            "category": "Máster"
        }
    },
    {
        "sample_id": "6",
        "generation_method": "llm_generated",
        "language": "es",
        "question": "¿Cómo se evalúa la asignatura en el módulo 16, 2?",
        "answer": "",
        "ground_truth": "Se evalúa mediante la entrega del trabajo individual de la asignatura número 4 con una duración de 03:00 horas.",
        "contexts": [],
        "reference_contexts": [
            "[Curso 2022:2023 - Maser Universitario en Ingenieria Informatica - Análisis Inteligentes de Datos.pdf]\n4.2. Learning outcomes\n 11, Assessment activities = . 12, Face-to-face classroom activities = Module 3: Lecture Duration: 02:00 Lecture. 12, Face-to-face laboratory activities = . 12, Assessment activities = Upload Assignment 3 Group work Continuous assessment Not Presential Duration: 00:00\n13, 1 = Module 4: Lecture. Duration: 02:00 Lecture. 13, 2 = . 14, 1 = Module 4: Lecture Duration: 02:00 Lecture. 14, 2 = . 15, 1 = Module 4: Lecture Duration: 02:00 Lecture. 15, 2 = . 16, 1 = . 16, 2 = Upload/Presentation Assignment 4. Individual work Continuous assessment Presential Duration: 03:00. 17, 1 = . 17, 2 = Global exam: upload all 4 assignments Other assessment Final examination Not Presential Duration: 03:00\nDepending on the programme study plan, total values will be calculated according to the ECTS credit unit as 26/27 hours of student face-to-face contact and independent study time. * The schedule is based on an a priori planning of the subject; it might be modified during the academic year, especially considering the COVID19 evolution. DRAFT VERSIO"
        ],
        "source_document": "Análisis Inteligentes de Datos.pdf",
        "chunk_id": "Curso 2022:2023_Maser Universitario en Ingenieria Informatica_Análisis Inteligentes de Datos.pdf_ch_5",
        "question_type": "procedural",
        "topic": "plan_de_estudios",
        "difficulty": "medium",
        "chunk_metadata": {
            "degree": "Maser Universitario en Ingenieria Informatica",
            "category": "Grado",
            "source": "Análisis Inteligentes de Datos.pdf",
            "course": "Curso 2022:2023",
            "chunk_index": 5
        }
    },
    {
        "sample_id": "7",
        "generation_method": "llm_generated",
        "language": "es",
        "question": "¿Cuántas prácticas grupales hay en la asignatura de Inteligencia Artificial?",
        "answer": "",
        "ground_truth": "La evaluación de la asignatura incluye dos prácticas grupales.",
        "contexts": [],
        "reference_contexts": [
            "[Curso 2023:2024 - Grado en Matemáticas e Informática - Inteligencia Artificial.pdf]\nPROCESO DE COORDINACIÓN DE LAS ENSEÑANZAS PR/CL/001\nANX-PR/CL/001-01 UÍA DE APRENDIZAJE ASI NATURA 105000133 - Inteligencia Artificial PLAN DE ESTUDIOS 10ML - Grado En Matematicas E Informática CURSO ACADÉMICO Y SEMESTRE 2023/24 - Primer semestre BORRADOR"
        ],
        "source_document": "Inteligencia Artificial.pdf",
        "chunk_id": "Curso 2023:2024_Grado en Matemáticas e Informática_Inteligencia Artificial.pdf_ch_0",
        "question_type": "factual",
        "topic": "plan_de_estudios",
        "difficulty": "easy",
        "chunk_metadata": {
            "category": "Grado",
            "source": "Inteligencia Artificial.pdf",
            "degree": "Grado en Matemáticas e Informática",
            "course": "Curso 2023:2024",
            "chunk_index": 0
        }
    },
    {
        "sample_id": "8",
        "generation_method": "llm_generated",
        "language": "es",
        "question": "",
        "answer": "",
        "ground_truth": "out_of_scope",
        "contexts": [],
        "reference_contexts": [],
        "source_document": "N/A",
        "chunk_id": "N/A",
        "question_type": "out_of_scope",
        "topic": "otros",
        "difficulty": "easy",
        "chunk_metadata": {
            "course": "Curso 2021:2022",
            "chunk_index": 0,
            "degree": "Master Universitario en Inteligencia Artificial",
            "category": "Máster",
            "source": "Aprendizaje Automatico.pdf"
        }
    },
    {
        "sample_id": "9",
        "generation_method": "llm_generated",
        "language": "es",
        "question": "¿Cuáles son las principales áreas de aplicación del curso de Recuperación, Extracción e Integración de la Información?",
        "answer": "",
        "ground_truth": "El curso se enfoca principalmente en la biomedicina debido a su complejidad y requisitos específicos.",
        "contexts": [],
        "reference_contexts": [
            "[Curso 2021:2022 - Master Universitario en Ciencia de Datos - Recuperacion, Extracción e Integracion de la Informacion.pdf]\n4. Brief description of the subject and syllabus\n4.1. Brief description of the subject The amount of available data in most scientific areas has grown dramatically during the last few years. However, this increment did not have a parallel impact on the knowledge available for decision-making. There is a need for automated models to manage such data, considering that human beings will never directly use most of it. The course Information Retrieval, Extraction, and Integration focuses on the necessary methods and tools to extract information and models to efficiently retrieve data for further integration. These are critical tasks to provide relevant information  for  decision  making,  whose  complexity  increases  with  the  amount  of  data  available.  As  application areas, we focus mainly on biomedicine due to the complexity and the specific requirements. 4.2. Syllabus 1. Basic concepts 1.1. Introduction 1.2. Data, information and knowledge 1.3. Data types 2. Handling textual data / Information retrieval 2.1. Modern information retrieval 2.2. Information extraction and Text Mining 3. Handling non-textual data 3.1. Introduction and basic descriptors 3.2. Content-based information retrieval 4. Data Integration 4.1. Introduction 4.2. Bias challenges DRAFT VERSIO\n- 4.3. Fairness challenges\n5. Search engines\n- 5.1. Web search engines\n- 5.2. Machine learning-based ranking\nPR/CL/001\nCOORDINATION PROCESS OF\nLEARNIN  ACTIVITIES\n6. Applications in biomedicine\n2. 6.1. Biomedical information systems\n6.2. Biomedical vocabularies 6.3. Standars for clinical interoperability 6.4. Systems for retrieving scientific literature DRAFT VERSIO\nANX-PR/CL/001-01\nLEARNIN   UIDE\nE.T.S. de Ingenieros\nInformaticos Presential Duration: 06:00 Depending on the programme study plan, total values will be calculated according to the ECTS credit unit as 26/27 hours of student face-to-face contact and independent study time. * The schedule is based on an a priori planning of the subject; it might be modified during the academic year, especially considering the COVID19 evolution. DRAFT VERSIO"
        ],
        "source_document": "Recuperacion, Extracción e Integracion de la Informacion.pdf",
        "chunk_id": "Curso 2021:2022_Master Universitario en Ciencia de Datos_Recuperacion, Extracción e Integracion de la Informacion.pdf_ch_4",
        "question_type": "comparative",
        "topic": "otros",
        "difficulty": "hard",
        "chunk_metadata": {
            "source": "Recuperacion, Extracción e Integracion de la Informacion.pdf",
            "degree": "Master Universitario en Ciencia de Datos",
            "category": "Máster",
            "chunk_index": 4,
            "course": "Curso 2021:2022"
        }
    },
    {
        "sample_id": "10",
        "generation_method": "llm_generated",
        "language": "es",
        "question": "¿Cómo se debe identificar y definir eficazmente las metas, objetivos y prioridades de una tarea o proyecto a desempeñar?",
        "answer": "",
        "ground_truth": "Para establecer un plan de acción efectivo es necesario identificar claramente los objetivos y metas establecidas para la tarea o proyecto en cuestión, definir las actividades necesarias para lograrlos, asignar plazos razonables para su realización y determinar los recursos humanos y materiales requeridos.",
        "contexts": [],
        "reference_contexts": [
            "[Curso 2020:2021 - Grado en Tecnologías para la Sociedad de la Información  - Inteligencia Artificial.pdf]\n3. Conocimientos previos recomendados\n3.1. Asignaturas previas que se recomienda haber cursado El plan de estudios Grado en Tecnologias para la Sociedad de la Informacion no tiene definidas asignaturas previas recomendadas para esta asignatura. 3.2. Otros conocimientos previos recomendados para cursar la asignatura - Dado el enfoque de la asignatura y la especificidad de los temas que se abordan, no se definen conocimientos previos recomendados. 4. Competencias y resultados de aprendizaje 4.1. Competencias CBAS01 - Capacidad para la resolución de los problemas matemáticos que puedan plantarse en la ingeniería. Aptitud  para  aplicar  los  conocimientos  sobre:  algebra,  cálculo  diferencial  e  integral  y  métodos  numéricos; estadística y optimización. CBAS03  -  Capacidad  para  comprender  y  dominar  los  conceptos  básicos  de  matemática  discreta,  lógica, algorítmica  y  complejidad  computacional,  y  su  aplicación  para  el  tratamiento  automático  de  la  información  por medio de sistemas computacionales y su aplicación para la resolución de problemas propios de la ingeniería. BORRADOR\nCC01  -  Capacidad  para  diseñar,  desarrollar,  seleccionar  y  evaluar  aplicaciones  y  sistemas  informáticos, asegurando su fiabilidad, seguridad y calidad, conforme a principios éticos y a la legislación y normativa vigente.\nCC06 - Conocimiento y aplicación de los procedimientos algorítmicos básicos de las tecnologías informáticas para diseñar soluciones a problemas, analizando la idoneidad y complejidad de los algoritmos propuestos\nCC15 - Conocimiento y aplicación de los principios fundamentales y técnicas básicas de los sistemas inteligentes y su aplicación práctica ANX-PR/CL/001-01\nUÍA DE APRENDIZAJE\nCT05 -  Organización  y  planificación:  Identificar  y  definir  eficazmente  las  metas,  objetivos  y  prioridades  de  una tarea o proyecto a desempeñar estipulando las actividades, los plazos y los recursos requeridos y controlando los procesos establecidos"
        ],
        "source_document": "Inteligencia Artificial.pdf",
        "chunk_id": "Curso 2020:2021_Grado en Tecnologías para la Sociedad de la Información _Inteligencia Artificial.pdf_ch_4",
        "question_type": "procedural",
        "topic": "tfm",
        "difficulty": "medium",
        "chunk_metadata": {
            "source": "Inteligencia Artificial.pdf",
            "degree": "Grado en Tecnologías para la Sociedad de la Información ",
            "category": "Grado",
            "course": "Curso 2020:2021",
            "chunk_index": 4
        }
    },
    {
        "sample_id": "11",
        "generation_method": "llm_generated",
        "language": "es",
        "question": "Para acceder a los recursos de aprendizaje y mantenerse informado sobre actualizaciones, ¿qué herramienta debe utilizar el estudiante?",
        "answer": "",
        "ground_truth": "Los estudiantes deben utilizar Moodle.",
        "contexts": [],
        "reference_contexts": [
            "[Curso 2021:2022 - Master Universitario en Ciencia de Datos - Aspectos Sociales : Legales : Eticos en la Ciencia de Datos.pdf]\n8. Other information\n8.1. Other information about the subject Language The course is delivered in English. Sustainable Development Goals Whereas no SDG is specifically addressed in the syllabus, the entire course will make the student more aware of the ability of the AI and data science to transform the world. --- we could have also said that this course impacts on every SDG. Tools for blended learning Students are strongly recommended to be familiar with the tools used in this course. Moodle is the tool of choice to make online questionnaires, to deliver tasks, to find learning resources, to stay up to date (news) and eventually to make official tests. Zoom will be the tool of choice to deliver remote lessons. Students are required to have a webcam while making official tests. COVID-19 Some of the lessons in this course can be delivered in different order from the one listed before. Considering the circumstances  the  syllabus'  order  may  be  adapted  to  address  possible  COVID-19-related  circumstances. Evaluating activities (delivery of reports) will be announced in due time. DRAFT VERSIO"
        ],
        "source_document": "Aspectos Sociales : Legales : Eticos en la Ciencia de Datos.pdf",
        "chunk_id": "Curso 2021:2022_Master Universitario en Ciencia de Datos_Aspectos Sociales : Legales : Eticos en la Ciencia de Datos.pdf_ch_7",
        "question_type": "procedural",
        "topic": "tfm",
        "difficulty": "easy",
        "chunk_metadata": {
            "degree": "Master Universitario en Ciencia de Datos",
            "chunk_index": 7,
            "category": "Máster",
            "source": "Aspectos Sociales : Legales : Eticos en la Ciencia de Datos.pdf",
            "course": "Curso 2021:2022"
        }
    },
    {
        "sample_id": "12",
        "generation_method": "llm_generated",
        "language": "es",
        "question": "¿Cuál es la diferencia entre los créditos de la asignatura y el carácter de este curso?",
        "answer": "",
        "ground_truth": "La asignatura tiene un peso del 30% para dos prácticas grupales, mientras que el examen final tiene un peso del 40%. Además, el número de créditos es de 6 ECTS.",
        "contexts": [],
        "reference_contexts": [
            "[Curso 2022:2023 - Grado en Matematicas e Informatica - Inteligencia Artificial.pdf]\n1.1. Datos de la asignatura\nNombre de la asignatura, 1 = 105000133 - Inteligencia Artificial. No de créditos, 1 = 6 ECTS. Carácter, 1 = Obligatoria. Curso, 1 = Tercero curso. Semestre, 1 = Quinto semestre. Período de impartición, 1 = Septiembre-Enero. Idioma de impartición, 1 = Castellano. Titulación, 1 = 10ML - Grado en Matematicas e Informática. Centro responsable de la titulación, 1 = 10 - Escuela Tecnica Superior De Ingenieros Informaticos. Curso académico, 1 = 2022-23"
        ],
        "source_document": "Inteligencia Artificial.pdf",
        "chunk_id": "Curso 2022:2023_Grado en Matematicas e Informatica_Inteligencia Artificial.pdf_ch_2",
        "question_type": "comparative",
        "topic": "plan_de_estudios",
        "difficulty": "hard",
        "chunk_metadata": {
            "source": "Inteligencia Artificial.pdf",
            "course": "Curso 2022:2023",
            "degree": "Grado en Matematicas e Informatica",
            "chunk_index": 2,
            "category": "Grado"
        }
    },
    {
        "sample_id": "13",
        "generation_method": "llm_generated",
        "language": "es",
        "question": "¿Qué tipo de actividades se realizan en el laboratorio durante las sesiones presenciales?",
        "answer": "",
        "ground_truth": "Se menciona que las actividades de evaluación suceden en alguna sesión del curso, pero no especifica qué tipo son.",
        "contexts": [],
        "reference_contexts": [
            "[Curso 2020:2021 - Grado en Ingeneiría Informática - Minería de Datos.pdf]\n6.1. Cronograma de la asignatura *\n\n1, Actividad presencial en aula = Clases teóricas del tema 1 Duración: 02:00 LM: Actividad del tipo Lección Magistral. 1, Actividad presencial en laboratorio = . 1, Tele-enseñanza = Clases teóricas del tema 1 Duración: 02:00 LM: Actividad del tipo Lección Magistral. 1, Actividades de evaluación = . 2, Actividad presencial en aula = Clases teóricas del tema 2.1 Duración: 00:00 LM: Actividad del tipo Lección Magistral. 2, Actividad presencial en laboratorio = . 2, Tele-enseñanza = Clases teóricas del tema 2.1 Duración: 00:00 LM: Actividad del tipo Lección Magistral. 2, Actividades de evaluación = . 3, Actividad presencial en aula = Clases teóricas del tema 2.2 Duración: 02:00 LM: Actividad del tipo Lección Magistral. 3, Actividad presencial en laboratorio = . 3, Tele-enseñanza = Clases teóricas del tema 2.2 Duración: 02:00 LM: Actividad del tipo Lección Magistral. 3, Actividades de evaluación = . 4, Actividad presencial en aula = Clases teóricas del tema 2.3 Duración: 02:00 LM: Actividad del tipo Lección Magistral. 4, Actividad presencial en laboratorio = . 4, Tele-enseñanza = Clases teóricas del tema 2.3 Duración: 02:00 LM: Actividad del tipo Lección Magistral. 4, Actividades de evaluación = . 5, Actividad presencial en aula = Clases teóricas del tema 2.4 Duración: 02:00 LM: Actividad del tipo Lección Magistral. 5, Actividad presencial en laboratorio = . 5, Tele-enseñanza = Clases teóricas del tema 2.4 Duración: 02:00 LM: Actividad del tipo Lección Magistral. 5, Actividades de evaluación = Test 1 ET: Técnica del tipo Prueba Telemática Evaluación continua No presencial Duración: 00:10 BORRADOR. 6, Actividad presencial en aula = Clases teóricas del tema 2.5 Duración:"
        ],
        "source_document": "Minería de Datos.pdf",
        "chunk_id": "Curso 2020:2021_Grado en Ingeneiría Informática_Minería de Datos.pdf_ch_7",
        "question_type": "ambiguous",
        "topic": "otros",
        "difficulty": "hard",
        "chunk_metadata": {
            "source": "Minería de Datos.pdf",
            "course": "Curso 2020:2021",
            "category": "Grado",
            "chunk_index": 7,
            "degree": "Grado en Ingeneiría Informática"
        }
    },
    {
        "sample_id": "14",
        "generation_method": "llm_generated",
        "language": "es",
        "question": "¿Cuántas horas de duración tiene la lección magistral del tema 10?",
        "answer": "",
        "ground_truth": "La lección magistral del tema 10 dura dos horas.",
        "contexts": [],
        "reference_contexts": [
            "[Curso 2024:2025 - Doble Grado en Ingenieria Informática + ADE - Estadística .pdf]\n6.1. Cronograma de la asignatura *\n teóricos tema 5 Duración: 02:00 = del tipo Clase de Problemas Explicación de los contenidos teóricos del tema 10 Duración: 02:00 LM: Actividad del tipo Lección Magistral Resolución de ejercicios del tema 10 Duración: 02:00 PR: Actividad del tipo Clase de Problemas. 11, Explicación del = Examen de las preguntas de. 11,  = Examen de las unidades 1 y 2 con preguntas de desarrollo o de respuesta corta. Estará formado por ejercicios del tipo de los resueltos y propuestos en clase. EX: Técnica del tipo Examen Escrito Evaluación Progresiva Presencial Duración: 02:00"
        ],
        "source_document": "Estadística .pdf",
        "chunk_id": "Curso 2024:2025_Doble Grado en Ingenieria Informática + ADE_Estadística .pdf_ch_9",
        "question_type": "factual",
        "topic": "plan_de_estudios",
        "difficulty": "easy",
        "chunk_metadata": {
            "chunk_index": 9,
            "course": "Curso 2024:2025",
            "degree": "Doble Grado en Ingenieria Informática + ADE",
            "source": "Estadística .pdf",
            "category": "Grado"
        }
    },
    {
        "sample_id": "15",
        "generation_method": "llm_generated",
        "language": "es",
        "question": "¿Cuál de las dos asignaturas que imparte el profesor tiene más créditos?",
        "answer": "",
        "ground_truth": "La asignatura de Probabilidades y Estadística I tiene 6 ECTS, mientras que no se especifica la cantidad de créditos para otra asignatura.",
        "contexts": [],
        "reference_contexts": [
            "[Curso 2021:2022 - Grado en Matematicas e Informatica - Probabilidades y Estadistica I.pdf]\n1.1. Datos de la asignatura\nNombre de la asignatura, 1 = 105000108 - Probabilidades y Estadistica I. No de créditos, 1 = 6 ECTS. Carácter, 1 = Básica. Curso, 1 = Primer curso. Semestre, 1 = Segundo semestre. Período de impartición, 1 = Febrero-Junio. Idioma de impartición, 1 = Castellano. Titulación, 1 = 10ML - Grado en Matematicas e Informática. Centro responsable de la titulación, 1 = 10 - Escuela Tecnica Superior De Ingenieros Informaticos. Curso académico, 1 = 2021-22"
        ],
        "source_document": "Probabilidades y Estadistica I.pdf",
        "chunk_id": "Curso 2021:2022_Grado en Matematicas e Informatica_Probabilidades y Estadistica I.pdf_ch_2",
        "question_type": "comparative",
        "topic": "plan_de_estudios",
        "difficulty": "hard",
        "chunk_metadata": {
            "category": "Grado",
            "source": "Probabilidades y Estadistica I.pdf",
            "course": "Curso 2021:2022",
            "degree": "Grado en Matematicas e Informatica",
            "chunk_index": 2
        }
    },
    {
        "sample_id": "16",
        "generation_method": "llm_generated",
        "language": "es",
        "question": "¿Cuál es el tema a nivel 4.2 en el temario de la asignatura?",
        "answer": "",
        "ground_truth": "Otros arquitecturas",
        "contexts": [],
        "reference_contexts": [
            "[Curso 2021:2022 - Master Universitario en Inteligencia Artificial - Redes de Neuronas Artificiales y Deep Learning.pdf]\n5.2. Temario de la asignatura\n1. Artificial neural networks 1.1. Foundations of artificial neural networks 1.2. Training artificial neural networks 1.3. Deep neural networks 1.4. Software tools for artificial neural networks 2. Deep learning methods 2.1. Performance evaluation 2.2. Normalization and initialization 2.3. Regularization 2.4. Optimization algorithms 3. Deep reinforcement learning 3.1. Foundations of reinforcement learning 3.2. Deep Q-Learning 3.3. Policy gradient 4. Neural network architectures 4.1. Generative adversarial networks 4.2. Other architectures BORRADOR"
        ],
        "source_document": "Redes de Neuronas Artificiales y Deep Learning.pdf",
        "chunk_id": "Curso 2021:2022_Master Universitario en Inteligencia Artificial_Redes de Neuronas Artificiales y Deep Learning.pdf_ch_6",
        "question_type": "factual",
        "topic": "otros",
        "difficulty": "easy",
        "chunk_metadata": {
            "course": "Curso 2021:2022",
            "source": "Redes de Neuronas Artificiales y Deep Learning.pdf",
            "category": "Máster",
            "degree": "Master Universitario en Inteligencia Artificial",
            "chunk_index": 6
        }
    },
    {
        "sample_id": "17",
        "generation_method": "llm_generated",
        "language": "es",
        "question": "¿Cuál es el peso mínimo de la nota individual en el cálculo de la nota final de un bloque?",
        "answer": "",
        "ground_truth": "El peso mínimo de la nota individual es al menos 70%",
        "contexts": [],
        "reference_contexts": [
            "[Curso 2022:2023 - Grado en Ciencia de Datos e Inteligencia Artificial - Logica para Inteligencia Artificial.pdf]\nNOTA DE UN BLOQUE TEMÁTICO\nLa nota de un bloque temático se calcula a partir de la nota individual (NI) y la nota de grupo (NG) del alumno en ese bloque. En general, en el cálculo de la nota final de un bloque (NB) el peso de NI es al menos 70% , y el peso de NG es como mucho 30% .\nLa forma concreta de hacer el cálculo de la nota de un bloque es la siguiente:\n(1), 1 = delta = MAX(0 , 5-NI) / 5. (1), 2 = (distancia entre la nota individual y el aprobado). (2a), 1 = pesoNG = 0.3 * (1-delta). (2a), 2 = (peso de la nota grupal)\n(2b), 1 = pesoNI = 1-pesoNG. (2b), 2 = (peso de la nota individual). (3), 1 = NB = NG*pesoNG + NI*pesoNI. (3), 2 = \nNA = NB1*0.4 + NB2*0.6, con las siguientes condiciones:\nAl  final  del  semestre,  los  alumnos  que  no  hayan  aprobado  la  asignatura  por  evaluación  progresiva  podrán evaluarse  en  la  fecha  oficial  de  la  convocatoria  ordinaria  de todo  el  contenido  de  la  asignatura a  través  de un examen individual (la prueba global ). La nota obtenida en dicho examen corresponderá al 100% de la nota final de la asignatura , es decir, sustituirá toda calificación obtenida hasta el momento."
        ],
        "source_document": "Logica para Inteligencia Artificial.pdf",
        "chunk_id": "Curso 2022:2023_Grado en Ciencia de Datos e Inteligencia Artificial_Logica para Inteligencia Artificial.pdf_ch_18",
        "question_type": "factual",
        "topic": "plan_de_estudios",
        "difficulty": "easy",
        "chunk_metadata": {
            "course": "Curso 2022:2023",
            "category": "Grado",
            "degree": "Grado en Ciencia de Datos e Inteligencia Artificial",
            "chunk_index": 18,
            "source": "Logica para Inteligencia Artificial.pdf"
        }
    },
    {
        "sample_id": "18",
        "generation_method": "llm_generated",
        "language": "es",
        "question": "¿Cuál es el peso en la nota de las unidades 2 y 4 en comparación con la unidad 3?",
        "answer": "",
        "ground_truth": "La unidad 4 tiene un peso en la nota del 35%, mientras que los pesos de la unidad 2 son del 30% y la unidad 3 es también del 35%.",
        "contexts": [],
        "reference_contexts": [
            "[Curso 2023:2024 - Master Universitario en Innovacion Digital - Intelligent Systems.pdf]\n6.1.1. Evaluación (progresiva)\n8, Descripción = Assessment of Unit 2. 8, Modalidad = EX: Técnica del tipo Examen Escrito. 8, Tipo = Presencial. 8, Duración = 02:00. 8, Peso en la nota = 30%. 8, Nota mínima = 2 / 10. 8, Competencias evaluadas = CB10 CG03 CE-CD04 CE-CD08. 16, Descripción = Assessment of Unit 4. 16, Modalidad = EX: Técnica del tipo Examen Escrito. 16, Tipo = Presencial. 16, Duración = 02:00. 16, Peso en la nota = 35%. 16, Nota mínima = 2 / 10. 16, Competencias evaluadas = CG03 CE-CD04 CE-CD08. 17, Descripción = Assessment of Unit 3. 17, Modalidad = TG: Técnica del tipo Trabajo en Grupo. 17, Tipo = No Presencial. 17, Duración = 00:00. 17, Peso en la nota = 35%. 17, Nota mínima = 2 / 10. 17, Competencias evaluadas = CB10 CG03 CE-CD04"
        ],
        "source_document": "Intelligent Systems.pdf",
        "chunk_id": "Curso 2023:2024_Master Universitario en Innovacion Digital_Intelligent Systems.pdf_ch_8",
        "question_type": "comparative",
        "topic": "plan_de_estudios",
        "difficulty": "medium",
        "chunk_metadata": {
            "chunk_index": 8,
            "category": "Máster",
            "source": "Intelligent Systems.pdf",
            "course": "Curso 2023:2024",
            "degree": "Master Universitario en Innovacion Digital"
        }
    },
    {
        "sample_id": "19",
        "generation_method": "llm_generated",
        "language": "es",
        "question": "¿Cuál es el peso de la práctica grupal en la evaluación de la asignatura?",
        "answer": "",
        "ground_truth": "La práctica grupal tiene un peso del 30%.",
        "contexts": [],
        "reference_contexts": [
            "[Curso 2020:2021 - MU Innovación Digital - Open Data And Knowledge Graphs.pdf]\n5.2. Syllabus\n3, Description = SPARQL test. 3, Modality = . 3, Type = No Presential. 3, Duration = 01:00. 3, Weight = 10%. 3, Minimum grade = / 10. 3, Evaluated skills = CE-CD06 CB07. 6, Description = RDF Generation. 6, Modality = . 6, Type = No Presential. 6, Duration = 10:00. 6, Weight = 25%. 6, Minimum grade = / 10. 6, Evaluated skills = CB07 CE-CD06. 8, Description = RDF generation and linking based on existing ontologies and Knowledge Graphs. 8, Modality = . 8, Type = No Presential. 8, Duration = 10:00. 8, Weight = 15%. 8, Minimum grade = / 10. 8, Evaluated skills = CG07 CE-CD06 CB07. 10, Description = Knowledge-Graph based application development. 10, Modality = . 10, Type = No Presential. 10, Duration = 10:00. 10, Weight = 25%. 10, Minimum grade = / 10. 10, Evaluated skills = CB06 CB07 CG07 CE-CD06. 10, Description = Oral presentation. 10, Modality = . 10, Type = No Presential. 10, Duration = 02:00. 10, Weight = 25%. 10, Minimum grade = / 10. 10, Evaluated skills = CB06 CB07 CG03 CG07\n17, Description = Global exam about course contents. 17, Modality = . 17, Type = No Presential. 17, Duration = 02:00. 17, Weight = 100%. 17, Minimum grade = 5 / 10. 17, Evaluated skills = CB06 CB07 CG03 CG07 CE-CD06\n7. Activities and assessment criteria 7.1. Assessment activities 7.1.1. Continuous assessment 7.1.2. Final examination 7.1.3. Referred (re-sit) examination DRAFT VERSIO"
        ],
        "source_document": "Open Data And Knowledge Graphs.pdf",
        "chunk_id": "Curso 2020:2021_MU Innovación Digital_Open Data And Knowledge Graphs.pdf_ch_6",
        "question_type": "factual",
        "topic": "tfm",
        "difficulty": "easy",
        "chunk_metadata": {
            "chunk_index": 6,
            "course": "Curso 2020:2021",
            "source": "Open Data And Knowledge Graphs.pdf",
            "degree": "MU Innovación Digital",
            "category": "Máster"
        }
    },
    {
        "sample_id": "20",
        "generation_method": "llm_generated",
        "language": "es",
        "question": "¿Qué tipo de recursos bibliográficos se ofrecen a través del sitio web de la American Medical Informatics Association?",
        "answer": "",
        "ground_truth": "Los recursos bibliográficos ofrecidos en el sitio web de la American Medical Informatics Association incluyen libros de informática biomédica y revistas.",
        "contexts": [],
        "reference_contexts": [
            "[Curso 2021:2022 - Master Universitario en Biologia Computacional - Manejo de Datos y Conocimientos de la Salud.pdf]\n6.2. Assessment criteria\nPUBmed and its resources (NCBI, for instance=I, Type = Web resource. PUBmed and its resources (NCBI, for instance=I, Notes = Different bibliographic and research databases. Biomedical Informatics books, Type = Bibliography. Biomedical Informatics books, Notes = Available at the website of the American Medical Informatics Association. Journals available through Internet and the UPM network, Type = Bibliography. Journals available through Internet and the UPM network, Notes = papers from the Journal of biomedical informatics, Journal of the American Medical Informatics Association, International Journal of Medical Informatics. All of them available over the Internet. Dispositivos para teleenseñanza (ordenador, tablet, móvil), Type = Equipment. Dispositivos para teleenseñanza (ordenador, tablet, móvil), Notes = For online lecturing and teaching\nPresentations  of  assignment,  online  and  (to  be  decided  according  to  the  pandemia  context)  in  groups  of  2-3 students 7. Teaching resources 7.1. Teaching resources for the subject DRAFT VERSIO\n[Powered by TCPDF (www.tcpdf.org)](http://www.tcpdf.org/)"
        ],
        "source_document": "Manejo de Datos y Conocimientos de la Salud.pdf",
        "chunk_id": "Curso 2021:2022_Master Universitario en Biologia Computacional_Manejo de Datos y Conocimientos de la Salud.pdf_ch_10",
        "question_type": "factual",
        "topic": "otros",
        "difficulty": "medium",
        "chunk_metadata": {
            "course": "Curso 2021:2022",
            "chunk_index": 10,
            "source": "Manejo de Datos y Conocimientos de la Salud.pdf",
            "category": "Máster",
            "degree": "Master Universitario en Biologia Computacional"
        }
    },
    {
        "sample_id": "21",
        "generation_method": "llm_generated",
        "language": "es",
        "question": "¿Cuántas horas de duración tiene la Lección Magistral de ejercicios prácticos del Tema 2?",
        "answer": "",
        "ground_truth": "La Lección Magistral de ejercicios prácticos del Tema 2 tiene una duración de 02:00 horas.",
        "contexts": [],
        "reference_contexts": [
            "[Curso 2022:2023 - Grado en Ciencia de Datos e Inteligencia Artificial - Investigación Operativa.pdf]\n6.1. Cronograma de la asignatura *\n\n9, 1 = de contenidos del Tema 2 Duración: 02:00 LM: Actividad del tipo Lección Magistral de ejercicios prácticos del 2. 9, 2 = Explicación Resolución Tema Duración: 02:00. 9, 3 = . 10, 1 = Explicación de contenidos del Tema 2 Duración: 02:00 PR: Actividad del tipo Clase de Problemas Resolución de ejercicios prácticos del Tema 2 Duración: 02:00 del tipo Clase de Problemas. 10, 2 = PR: Actividad. 10, 3 = . 11, 1 = Resolución de ejercicios prácticos del Tema 2 Duración: 02:00 PR: Actividad del tipo Clase de Problemas Explicación de contenidos del Tema 2 Duración: 02:00 PR: Actividad del tipo Clase de Problemas Explicación de contenidos del Tema 3. 11, 2 = . 11, 3 = BORRADOR. , 1 = Duración: 04:00 del tipo Clase de Problemas. , 2 = 12 PR: Actividad. , 3 = . 13, 1 = Resolución de ejercicios prácticos del Tema 3 Duración: 04:00 del tipo Clase de Problemas. 13, 2 = PR: Actividad. 13, 3 = . 14, 1 = de ejercicios prácticos del 3 Duración: 02:00 PR: Actividad del tipo Clase de Problemas de contenidos del Tema 4 Duración: 02:00 PR: Actividad del tipo Clase de Problemas. 14, 2 = Resolución Tema Explicación. 14, 3 = . 15, 1 = Explicación de contenidos del Tema 4 Duración: 02:00 LM: Actividad del tipo Lección Magistral Resolución de ejercicios prácticos del Tema 4 Duración: 02:00 del tipo Clase de Problemas. 15, 2 = PR: Actividad. 15, 3 = . 16, 1 = . 16, 2 = 17. 16, 3 = Examen Parcial II EX: Técnica del tipo Examen Escrito Evaluación continua Presencial Duración: 03:00"
        ],
        "source_document": "Investigación Operativa.pdf",
        "chunk_id": "Curso 2022:2023_Grado en Ciencia de Datos e Inteligencia Artificial_Investigación Operativa.pdf_ch_9",
        "question_type": "factual",
        "topic": "plan_de_estudios",
        "difficulty": "easy",
        "chunk_metadata": {
            "degree": "Grado en Ciencia de Datos e Inteligencia Artificial",
            "course": "Curso 2022:2023",
            "chunk_index": 9,
            "category": "Grado",
            "source": "Investigación Operativa.pdf"
        }
    },
    {
        "sample_id": "22",
        "generation_method": "llm_generated",
        "language": "es",
        "question": "¿Qué tipo de conocimiento se pretende desarrollar en el área de extracción de información?",
        "answer": "",
        "ground_truth": "El objetivo es adquirir una capacidad para diseñar e implementar sistemas de extracción de datos.",
        "contexts": [],
        "reference_contexts": [
            "[Curso 2023:2024 - Master Universitario en Ciencia de Datos - Information Retrieval, Extraction and Integration.pdf]\nIndex\n* The tutoring schedule is indicative and subject to possible changes. Please check tutoring times with the faculty member in charge. 3. Skills and learning outcomes * 3.1. Skills to be learned CECD01  -  Conocer  los  procesos  de  captura,  extracción,  manipulación  y  conversión  de  datos  en  diferentes entornos. CG06 - Especificación y realización de tareas informáticas complejas, poco definidas o no familiares CG07  -  Aplicación  de  los  últimos  o  más  novedosos  métodos  para  resolver  problemas  que,  posiblemente, involucren a otras disciplinas CG09 - Integración del conocimiento de distintos campos de estudio CG14 - Capacidad de trabajar y comunicarse también en contextos internacionales 3.2. Learning outcomes RA32 - Understand and design information extraction systems RA21 - Conocer cómo se aplican las técnicas de computación científica en algún campo específico de ciencia o ingeniería RA33 - understand and apply information retrieval systems RA34 - Apply AI techniques in real world data scenarios DRAFT VERSIO"
        ],
        "source_document": "Information Retrieval, Extraction and Integration.pdf",
        "chunk_id": "Curso 2023:2024_Master Universitario en Ciencia de Datos_Information Retrieval, Extraction and Integration.pdf_ch_3",
        "question_type": "factual",
        "topic": "tfm",
        "difficulty": "medium",
        "chunk_metadata": {
            "chunk_index": 3,
            "category": "Máster",
            "degree": "Master Universitario en Ciencia de Datos",
            "course": "Curso 2023:2024",
            "source": "Information Retrieval, Extraction and Integration.pdf"
        }
    },
    {
        "sample_id": "23",
        "generation_method": "llm_generated",
        "language": "es",
        "question": "¿Cómo se debe cuestionar la mejora de la Universidad como órgano divulgador de los ODS en el contexto de la ETSIINF?",
        "answer": "",
        "ground_truth": "Se deben analizar los objetivos específicos y las metas concretas que cada titulación pretende alcanzar en la implementación de los ODS, para identificar oportunidades de mejora dentro de la propia realidad de la Universidad. ",
        "contexts": [],
        "reference_contexts": [
            "[Curso 2023:2024 - Doble Grado en Ingenieria Informatica y ADE - Lenguajes Formales, Automatas y Computabilidad.pdf]\n8. Otra información\n8.1. Otra información sobre la asignatura Objetivos de Desarrollo Sostenible en la UPM (ODS) \"Los Objetivos de Desarrollo Sostenible, también conocidos como Objetivos Mundiales, se adoptaron por todos los Estados Miembros en 2015 como un llamado universal para poner fin a la pobreza, proteger el planeta y garantizar que todas las personas gocen de paz y prosperidad para 2030. Los 17 ODS están integrados, ya que reconocen que  las  intervenciones  en  un  área  afectarán  los  resultados  de  otras  y  que  el  desarrollo  debe  equilibrar  la sostenibilidad medio ambiental, económica y social. Siguiendo la promesa de no dejar a nadie atrás, los países se han  comprometido  a  acelerar  el  progreso  para  aquellos  más  atrasados.  Es  por  esto  que  los  ODS  han  sido diseñados para traer al mundo varios \"ceros\" que cambien la vida, lo que incluye pobreza cero, hambre cero, SIDA cero y discriminación cero contra las mujeres y niñas. Todo el mundo es necesario para alcanzar estos objetivos ambiciosos.  Se  necesita  la  creatividad,  el  conocimiento,  la  tecnología  y  los  recursos  financieros  de  toda  la sociedad para conseguir los ODS en cada contexto.\" En  la  UPM  se  tratan  todos  los  ODS  impulsados  por  las Naciones Unidas, si bien es cierto que algunos de ellos están más presentes según las diferentes titulaciones. Por ello, se debe cuestionar la mejora de la Universidad como órgano divulgador de los ODS. Análisis de ODS en la ETSIINF: BORRADOR"
        ],
        "source_document": "Lenguajes Formales, Automatas y Computabilidad.pdf",
        "chunk_id": "Curso 2023:2024_Doble Grado en Ingenieria Informatica y ADE_Lenguajes Formales, Automatas y Computabilidad.pdf_ch_18",
        "question_type": "procedural",
        "topic": "otros",
        "difficulty": "medium",
        "chunk_metadata": {
            "course": "Curso 2023:2024",
            "degree": "Doble Grado en Ingenieria Informatica y ADE",
            "category": "Grado",
            "source": "Lenguajes Formales, Automatas y Computabilidad.pdf",
            "chunk_index": 18
        }
    },
    {
        "sample_id": "24",
        "generation_method": "llm_generated",
        "language": "es",
        "question": "¿Cuál es la competencia que se refiere a elegir y usar los métodos analíticos y de modelización relevantes?",
        "answer": "",
        "ground_truth": "La competencia CG-3/4 se refiere a elegir y usar los métodos analíticos y de modelización relevantes.",
        "contexts": [],
        "reference_contexts": [
            "[Curso 2022:2023 - Grado en Ingeniería Informática - Inteligencia Artificial.pdf]\n2.1. Profesorado implicado en la docencia\n* Las horas de tutoría son orientativas y pueden sufrir modificaciones. Se deberá confirmar los horarios de tutorías con el profesorado. 3. Conocimientos previos recomendados 3.1. Asignaturas previas que se recomienda haber cursado - Probabilidades Y Estadistica Ii - Matematica Discreta Ii 3.2. Otros conocimientos previos recomendados para cursar la asignatura El plan de estudios Grado en Ingenieria Informatica no tiene definidos otros conocimientos previos para esta asignatura. 4. Competencias y resultados de aprendizaje 4.1. Competencias BORRADOR\nCG-5 - Capacidad de gestión de la información.\n- CG-7:10/16/17  -  Capacidad  para  trabajar  dentro  de  un  equipo,  organizando,  planificando,  tomando  decisiones, negociando y resolviendo conflictos, relacionándose, y criticando y haciendo autocrítica\n- Ce 2 - Formalización y especificación de problemas reales cuya solución requiere el uso de la informática.\n- Ce 22 - Capacidad de aplicar sus conocimientos e intuición para diseñar el hardware/software que cumple unos requisitos especificados.\nCe  3/4  -  Capacidad  de  elegir  y  usar  los  métodos  analíticos  y  de  modelización  relevantes,  y  de  describir  una solución de forma abstracta."
        ],
        "source_document": "Inteligencia Artificial.pdf",
        "chunk_id": "Curso 2022:2023_Grado en Ingeniería Informática_Inteligencia Artificial.pdf_ch_4",
        "question_type": "factual",
        "topic": "tfm",
        "difficulty": "medium",
        "chunk_metadata": {
            "category": "Grado",
            "source": "Inteligencia Artificial.pdf",
            "degree": "Grado en Ingeniería Informática",
            "chunk_index": 4,
            "course": "Curso 2022:2023"
        }
    },
    {
        "sample_id": "25",
        "generation_method": "llm_generated",
        "language": "es",
        "question": "¿Qué tipo de técnica es la del trabajo del número 14?",
        "answer": "",
        "ground_truth": "La técnica del trabajo del número 14 es del tipo Presentación en Grupo.",
        "contexts": [],
        "reference_contexts": [
            "[Curso 2020:2021 - Grado en Ingeneiría Informática - Sistemas Inteligentes.pdf]\n6.1.1. Evaluación continua\n\n10, Estudio y revisión bibliográfica, preparación de la práctica = Estudio y revisión bibliográfica, preparación de la práctica. 10, TI: Técnica del tipo Trabajo Individual = TG: Técnica del tipo Trabajo en Grupo. 10, No Presencial = No Presencial. 10, 06:00 = 06:00. 10, % = %. 10, / 10 = / 10. 11, Estudio y revisión bibliográfica, preparación de la práctica = Estudio y revisión bibliográfica, preparación de la práctica. 11, TI: Técnica del tipo Trabajo Individual = TG: Técnica del tipo Trabajo en Grupo. 11, No Presencial = No Presencial. 11, 06:00 = 06:00. 11, % = %. 11, / 10 = / 10. 12, Estudio y revisión bibliográfica, preparación de la práctica = Estudio y revisión bibliográfica, preparación de la práctica. 12, TI: Técnica del tipo Trabajo Individual = TG: Técnica del tipo Trabajo en Grupo. 12, No Presencial = No Presencial. 12, 06:00 = 06:00. 12, % = %. 12, / 10 = / 10. 13, Estudio y revisión bibliográfica, preparación de la práctica = Estudio y revisión bibliográfica, preparación de la práctica. 13, TI: Técnica del tipo Trabajo Individual = TG: Técnica del tipo Trabajo en Grupo. 13, No Presencial = No Presencial. 13, 06:00 = 06:00. 13, % = %. 13, / 10 = / 10. 14, Estudio y revisión bibliográfica, preparación de la práctica = Estudio y revisión bibliográfica, preparación de la práctica. 14, TI: Técnica del tipo Trabajo Individual = PG: Técnica del tipo Presentación en Grupo. 14, No Presencial = Presencial. 14, 06:00 = 07:00. 14, % = 60%. 14, / 10 = 3 / 10. 15, Estudio y revisión bibliográfica, preparación de la práctica = Evaluación teórica."
        ],
        "source_document": "Sistemas Inteligentes.pdf",
        "chunk_id": "Curso 2020:2021_Grado en Ingeneiría Informática_Sistemas Inteligentes.pdf_ch_14",
        "question_type": "factual",
        "topic": "plan_de_estudios",
        "difficulty": "easy",
        "chunk_metadata": {
            "chunk_index": 14,
            "category": "Grado",
            "course": "Curso 2020:2021",
            "source": "Sistemas Inteligentes.pdf",
            "degree": "Grado en Ingeneiría Informática"
        }
    },
    {
        "sample_id": "26",
        "generation_method": "llm_generated",
        "language": "es",
        "question": "¿Qué tipo de evaluación incluye la elaboración de prácticas en el cronograma de la asignatura?",
        "answer": "",
        "ground_truth": "La Evaluación continua No presencial.",
        "contexts": [],
        "reference_contexts": [
            "[Curso 2022:2023 - Grado en Matematicas e Informatica - Programacion Declarativa- Logica y Restricciones.pdf]\n6.1. Cronograma de la asignatura *\n 7, Actividad presencial en aula = 3.3 y 3.4 Duración: 02:00 LM: Actividad del tipo Lección Magistral. 7, Actividad presencial en laboratorio = Clase práctica (opcional) Duración: 01:00 PL: Actividad del tipo Prácticas de Laboratorio. 7, Actividades de evaluación = Elaboración de las prácticas y entrega ET: Técnica del tipo Prueba Telemática Evaluación continua No presencial Duración: 03:00. 8, Actividad presencial en aula = . 8, Actividad presencial en laboratorio = Clase práctica Duración: 02:00 PL: Actividad del tipo Prácticas de Laboratorio. 8, Actividades de evaluación = Elaboración de las prácticas TI: Técnica del tipo Trabajo Individual Evaluación continua No presencial Duración: 03:00. 9, Actividad presencial en aula = 3.5 Duración: 02:00 LM: Actividad del tipo Lección Magistral. 9, Actividad presencial en laboratorio = . 9, Actividades de evaluación = Elaboración de las prácticas TI: Técnica del tipo Trabajo Individual Evaluación continua No presencial"
        ],
        "source_document": "Programacion Declarativa- Logica y Restricciones.pdf",
        "chunk_id": "Curso 2022:2023_Grado en Matematicas e Informatica_Programacion Declarativa- Logica y Restricciones.pdf_ch_7",
        "question_type": "factual",
        "topic": "plan_de_estudios",
        "difficulty": "easy",
        "chunk_metadata": {
            "degree": "Grado en Matematicas e Informatica",
            "source": "Programacion Declarativa- Logica y Restricciones.pdf",
            "course": "Curso 2022:2023",
            "category": "Grado",
            "chunk_index": 7
        }
    },
    {
        "sample_id": "27",
        "generation_method": "llm_generated",
        "language": "es",
        "question": "¿Cuántas horas dura cada sesión de grupos de tutoría en el Unit 4?",
        "answer": "",
        "ground_truth": "La sesion de grupos de tutoría del unitario 4, tiene una duración de 02:00 horas.",
        "contexts": [],
        "reference_contexts": [
            "[Curso 2021:2022 - Master Universitario en Innovacipon Digital itinerario Health - Intelligent Systems.pdf]\n4.2. Syllabus\n 11, Face-to-face classroom activities Face-to-face laboratory activities = Lecture on Unit 4 Duration: 02:00. 11, Distant / On-line = Lecture on Unit 4 Duration: 02:00. 11, Assessment activities = . 12, Face-to-face classroom activities Face-to-face laboratory activities = Lecture on Unit 4 Duration: 02:00 Group tutoring session Duration: 02:00. 12, Distant / On-line = Lecture on Unit 4 Duration: 02:00 Group tutoring session Duration: 02:00. 12, Assessment activities = \n13, 1 = Lecture on Unit 5 Duration: 02:00 Group tutoring session Duration: 02:00. 13, 2 = Lecture on Unit 5 Duration: 02:00 Group tutoring session Duration: 02:00. 13, 3 = . 14, 1 = Lecture on Unit 5 Duration: 02:00 Group tutoring session Duration: 02:00. 14, 2 = Lecture on Unit 5 Duration: 02:00 Group tutoring session Duration: 02:00. 14, 3 = . 15, 1 = Lecture on Unit 5 Duration: 02:00 Group tutoring session Duration: 02:00. 15, 2 = Lecture on Unit 5 Duration: 02:00 Group tutoring session Duration: 02:00. 15, 3 = . 16, 1 = . 16, 2 = VERSIO. 16, 3 = Not Presential Duration: 00:00 Assessment of Unit 5 Continuous assessment Not Presential. 17, 1 = DRAFT. 17, 2 = . 17, 3 = Duration: 00:00 Assessment of Units 1-2-3 Final examination Presential Duration: 02:00 Assessment of Unit 4 Final examination Not Presential Duration: 00:00 Assessment of Unit 5 Final examination Not Presential Duration: 00:00"
        ],
        "source_document": "Intelligent Systems.pdf",
        "chunk_id": "Curso 2021:2022_Master Universitario en Innovacipon Digital itinerario Health_Intelligent Systems.pdf_ch_6",
        "question_type": "factual",
        "topic": "plan_de_estudios",
        "difficulty": "easy",
        "chunk_metadata": {
            "source": "Intelligent Systems.pdf",
            "chunk_index": 6,
            "course": "Curso 2021:2022",
            "degree": "Master Universitario en Innovacipon Digital itinerario Health",
            "category": "Máster"
        }
    },
    {
        "sample_id": "28",
        "generation_method": "llm_generated",
        "language": "es",
        "question": "¿Cuántos créditos tiene la asignatura de Sistemas Inteligentes?",
        "answer": "",
        "ground_truth": "La asignatura se cursa con 4,5 ECTS.",
        "contexts": [],
        "reference_contexts": [
            "[Curso 2020:2021 - MU Innovación Digital - Intelligent Systems.pdf]\nIndex\n1. Description...............................................................................................................................................................1 = 2. Faculty.....................................................................................................................................................................1. 1. Description...............................................................................................................................................................1 = 3. Skills and learning outcomes ...................................................................................................................................2. 1. Description...............................................................................................................................................................1 = 4. Brief description of the subject and syllabus.............................................................................................................3. 1. Description...............................................................................................................................................................1 = 5. Schedule..................................................................................................................................................................5. 1. Description...............................................................................................................................................................1 = 6. Activities and assessment criteria............................................................................................................................7. 1. Description...............................................................................................................................................................1 = 7. Teaching resources..................................................................................................................................................9. 1. Description...............................................................................................................................................................1 = 8. Other information.....................................................................................................................................................9\nLearning guide DRAFT VERSIO\nPR/CL/001\nCOORDINATION PROCESS OF\nLEARNIN  ACTIVITIES\nANX-PR/CL/001-01\nLEARNIN   UIDE\nE.T.S. de Ingenieros\nInformaticos\nName of the subject, 1 = 103000851 - Intelligent Systems. No of credits, 1 = 4.5 ECTS. Type, 1 = Optional. Academic year ot the programme, 1 = First year. Semester of tuition, 1 = Semester 1. Tuition period, 1 = September-January. Tuition languages, 1 = English. Degree programme, 1 = 10AZ - Master Universitario en Innovación Digital. Centre, 1 = 10 - Escuela Tecnica Superior de Ingenieros Informaticos. Academic year, 1 = 2020-21\nAsuncion De Maria Gomez Perez, Office/Room = 2209. Asuncion De Maria Gomez Perez, Email = asunciondemaria.gomez@up m.es. Asuncion De Maria Gomez Perez, Tutoring hours * = Sin horario.. M. Carmen Suarez De Figueroa Baonza, Office/Room = 2201. M. Carmen Suarez De Figueroa Baonza, Email = mdelcarmen.suarezdefiguero a@upm.es. M. Carmen Suarez De Figueroa Baonza, Tutoring hours * = Sin horario.. Martin Molina Gonzalez (Subject coordinator), Office/Room = 2111. Martin Molina Gonzalez (Subject coordinator), Email = martin.molina@upm.es. Martin Molina Gonzalez (Subject coordinator), Tutoring hours * = Sin horario.\n1. Description 1.1. Subject details 2. Faculty 2.1. Faculty members with subject teaching role DRAFT VERSIO"
        ],
        "source_document": "Intelligent Systems.pdf",
        "chunk_id": "Curso 2020:2021_MU Innovación Digital_Intelligent Systems.pdf_ch_1",
        "question_type": "factual",
        "topic": "plan_de_estudios",
        "difficulty": "easy",
        "chunk_metadata": {
            "degree": "MU Innovación Digital",
            "source": "Intelligent Systems.pdf",
            "category": "Máster",
            "chunk_index": 1,
            "course": "Curso 2020:2021"
        }
    },
    {
        "sample_id": "29",
        "generation_method": "llm_generated",
        "language": "es",
        "question": "¿Cuál de los dos temas en el estado del arte tiene un peso más alto en la nota?",
        "answer": "",
        "ground_truth": "El tema 1 y 2 tienen el mismo peso en la nota, que es del 25%.",
        "contexts": [],
        "reference_contexts": [
            "[Curso 2021:2022 - Master Universitario en Inteligencia Artificial - Redes Bayesianas.pdf]\n6.1.1. Evaluación continua\n3, Descripción = Estados del arte (temas 1 y 2). 3, Modalidad = PI: Técnica del tipo Presentación Individual. 3, Tipo = Presencial. 3, Duración = 08:00. 3, Peso en la nota = 25%. 3, Nota mínima = 4 / 10. 3, Competencias evaluadas = CB9 CB10 CG13 CGI2 CGI3 CGI4 CG12. 7, Descripción = Estados del arte (tema 3). 7, Modalidad = PI: Técnica del tipo Presentación Individual. 7, Tipo = Presencial. 7, Duración = 08:00. 7, Peso en la nota = 25%. 7, Nota mínima = 4 / 10. 7, Competencias evaluadas = CG13 CB10 CB9 CGI2 CGI3 CGI4 CG12 CGI1. 8, Descripción = Prueba escrita con preguntas tipo test de la asignatura. 8, Modalidad = EX: Técnica del tipo Examen Escrito. 8, Tipo = Presencial. 8, Duración = 00:30. 8, Peso en la nota = 50%. 8, Nota mínima = 4 / 10. 8, Competencias evaluadas = CB7 CGI2 CEIA4 CG12 CB10 CG13"
        ],
        "source_document": "Redes Bayesianas.pdf",
        "chunk_id": "Curso 2021:2022_Master Universitario en Inteligencia Artificial_Redes Bayesianas.pdf_ch_11",
        "question_type": "comparative",
        "topic": "plan_de_estudios",
        "difficulty": "medium",
        "chunk_metadata": {
            "chunk_index": 11,
            "category": "Máster",
            "source": "Redes Bayesianas.pdf",
            "course": "Curso 2021:2022",
            "degree": "Master Universitario en Inteligencia Artificial"
        }
    },
    {
        "sample_id": "30",
        "generation_method": "llm_generated",
        "language": "es",
        "question": "¿Cómo se evalúa la asignatura en el curso 2021-2022?",
        "answer": "",
        "ground_truth": "La evaluación continua de la asignatura implica tres pruebas, una escrita que cubre los temas 1 a 4 con un peso del 30% y dos prácticas grupales, una para la presentación del trabajo en el tema 5 con un peso del 40% y otra examen escrito presencial para los temas 6 y 7.",
        "contexts": [],
        "reference_contexts": [
            "[Curso 2021:2022 - Doble Grado en Ingenieria Informatica y ADE - Inteligencia Artificial.pdf]\n7.1.1. Evaluación continua\n11, Descripción = Examen Temas 1 a 4. 11, Modalidad = EX: Técnica del tipo Examen Escrito. 11, Tipo = No Presencial. 11, Duración = 02:00. 11, Peso en la nota = 30%. 11, Nota mínima = 0 / 10. 11, Competencias evaluadas = 10II-CE03/04 10II-CE02 10II-CG01/21 10II-CG06. 16, Descripción = Presentación de la práctica (Tema 5). 16, Modalidad = TG: Técnica del tipo Trabajo en Grupo. 16, Tipo = No Presencial. 16, Duración = 02:00. 16, Peso en la nota = 40%. 16, Nota mínima = 1.25 / 10. 16, Competencias evaluadas = 10II-CG01/21 10II-CG06 10II-CE03/04 10II-CE02. 17, Descripción = Examen Temas 6 y 7 (coincidiendo con el examen \"solo prueba final\" de la asignatura). 17, Modalidad = EX: Técnica del tipo Examen Escrito. 17, Tipo = Presencial. 17, Duración = 02:00. 17, Peso en la nota = 30%. 17, Nota mínima = 1.67 / 10. 17, Competencias evaluadas = 10II-CE03/04 10II-CE02 10II-CG01/21 10II-CG06"
        ],
        "source_document": "Inteligencia Artificial.pdf",
        "chunk_id": "Curso 2021:2022_Doble Grado en Ingenieria Informatica y ADE_Inteligencia Artificial.pdf_ch_11",
        "question_type": "procedural",
        "topic": "plan_de_estudios",
        "difficulty": "medium",
        "chunk_metadata": {
            "degree": "Doble Grado en Ingenieria Informatica y ADE",
            "category": "Grado",
            "course": "Curso 2021:2022",
            "chunk_index": 11,
            "source": "Inteligencia Artificial.pdf"
        }
    },
    {
        "sample_id": "31",
        "generation_method": "llm_generated",
        "language": "es",
        "question": "¿Cuál es la situación que puede causar modificaciones al cronograma de la asignatura?",
        "answer": "",
        "ground_truth": "La situación creada por la COVID-19 puede causar modificaciones al cronograma de la asignatura.",
        "contexts": [],
        "reference_contexts": [
            "[Curso 2023:2024 - Grado en Ciencia de Datos e Inteligencia Artificial - Representación del Conocimiento y Prinicipios FIAR en Recursos Semanticos.pdf]\n6.1. Cronograma de la asignatura *\n* El cronograma sigue una planificación teórica de la asignatura y puede sufrir modificaciones durante el curso derivadas de la situación creada por la COVID-19."
        ],
        "source_document": "Representación del Conocimiento y Prinicipios FIAR en Recursos Semanticos.pdf",
        "chunk_id": "Curso 2023:2024_Grado en Ciencia de Datos e Inteligencia Artificial_Representación del Conocimiento y Prinicipios FIAR en Recursos Semanticos.pdf_ch_9",
        "question_type": "factual",
        "topic": "otros",
        "difficulty": "hard",
        "chunk_metadata": {
            "degree": "Grado en Ciencia de Datos e Inteligencia Artificial",
            "category": "Grado",
            "course": "Curso 2023:2024",
            "chunk_index": 9,
            "source": "Representación del Conocimiento y Prinicipios FIAR en Recursos Semanticos.pdf"
        }
    },
    {
        "sample_id": "32",
        "generation_method": "llm_generated",
        "language": "es",
        "question": "¿Qué tipo de aprendizaje se enfoca en la asignatura Web Semántica, Linked Data y Grafos de Conocimientos?",
        "answer": "",
        "ground_truth": "Se enfoca en el aprendizaje de conceptos relacionados con la web semántica y grafos de conocimiento.",
        "contexts": [],
        "reference_contexts": [
            "[Curso 2022:2023 - Grado en Ingeniería Informática - Web Semantica, Linked Data y Grafos de Conocimientos.pdf]\nIndex\n1. Description...............................................................................................................................................................1 = 2. Faculty.....................................................................................................................................................................1. 1. Description...............................................................................................................................................................1 = 3. Prior knowledge recommended to take the subject..................................................................................................2. 1. Description...............................................................................................................................................................1 = 4. Skills and learning outcomes ...................................................................................................................................2. 1. Description...............................................................................................................................................................1 = 5. Brief description of the subject and syllabus.............................................................................................................3. 1. Description...............................................................................................................................................................1 = 6. Schedule..................................................................................................................................................................5. 1. Description...............................................................................................................................................................1 = 7. Activities and assessment criteria............................................................................................................................7. 1. Description...............................................................................................................................................................1 = 8. Teaching resources..................................................................................................................................................8\n9. Other information.....................................................................................................................................................9\nLearning guide DRAFT VERSIO\nPR/CL/001\nCOORDINATION PROCESS OF\nLEARNIN  ACTIVITIES\nANX-PR/CL/001-01\nLEARNIN   UIDE\nName of the subject, 1 = 105000057 - Web Semántica, Linked Data y Grafos de Conocimientos. No of credits, 1 = 3 ECTS. Type, 1 = Optional. Academic year ot the programme, 1 = Fourth year. Semester of tuition, 1 = Semester 7. Tuition period, 1 = September-January. Tuition languages, 1 = English. Degree programme, 1 = 10II - Grado en Ingenieria Informatica. Centre, 1 = 10 - Escuela Tecnica Superior De Ingenieros Informaticos. Academic year, 1 = 2022-23\nOscar Corcho Garcia (Subject coordinator), Office/Room = 2209. Oscar Corcho Garcia (Subject coordinator), Email = oscar.corcho@upm.es. Oscar Corcho Garcia (Subject coordinator), Tutoring hours * = Sin horario.. Raul Garcia Castro, Office/Room = 2110. Raul Garcia Castro, Email = r.garcia@upm.es. Raul Garcia Castro, Tutoring hours * = Sin horario.\n1. Description 1.1. Subject details 2. Faculty 2.1. Faculty members with subject teaching role * The tutoring schedule is indicative and subject to possible changes. Please check tutoring times with the faculty member in charge. DRAFT VERSIO"
        ],
        "source_document": "Web Semantica, Linked Data y Grafos de Conocimientos.pdf",
        "chunk_id": "Curso 2022:2023_Grado en Ingeniería Informática_Web Semantica, Linked Data y Grafos de Conocimientos.pdf_ch_1",
        "question_type": "ambiguous",
        "topic": "otros",
        "difficulty": "medium",
        "chunk_metadata": {
            "course": "Curso 2022:2023",
            "source": "Web Semantica, Linked Data y Grafos de Conocimientos.pdf",
            "category": "Grado",
            "chunk_index": 1,
            "degree": "Grado en Ingeniería Informática"
        }
    },
    {
        "sample_id": "33",
        "generation_method": "llm_generated",
        "language": "es",
        "question": "¿Cómo se evalúa la participación en actividades docentes del curso MU Inteligencia Artificial?",
        "answer": "",
        "ground_truth": "Se evalúa mediante una presentación de un trabajo de clase con un peso del 50% y una calificación mínima de 5/10.",
        "contexts": [],
        "reference_contexts": [
            "[Curso 2020:2021 - MU Inteligencia Artificial - Informática Biomédica.pdf]\n5. Brief description of the subject and syllabus\n 9, Description = Participation in teaching activities, in class and on-line. 9, Modality = Individual work. 9, Type = No Presential. 9, Duration = 00:00. 9, Weight = %. 9, Minimum grade = / 10. 9, Evaluated skills = . 10, Description = Participation in teaching activities, in class and on-line. 10, Modality = Individual work. 10, Type = No Presential. 10, Duration = 00:00. 10, Weight = %. 10, Minimum grade = / 10. 10, Evaluated skills = . 11, Description = Participation in teaching activities, in class and on-line. 11, Modality = Individual work. 11, Type = No Presential. 11, Duration = 00:00. 11, Weight = %. 11, Minimum grade = / 10. 11, Evaluated skills = . 12, Description = Participation in teaching activities, in class and on-line. 12, Modality = Individual work. 12, Type = No Presential. 12, Duration = 00:00. 12, Weight = %. 12, Minimum grade = / 10. 12, Evaluated skills = \n14, Participation in teaching activities, in class and on-line = Participation in teaching activities, in class and on-line. 14, Individual work = Individual work. 14, No Presential = No Presential. 14, 00:00 = 00:00. 14, % = %. 14, / 10 = / 10. 14,  = . 15, Participation in teaching activities, in class and on-line = Presentation of a classwork assignment. 15, Individual work = Individual presentation. 15, No Presential = No Presential. 15, 00:00 = 00:00. 15, % = 50%. 15, / 10 = 5 / 10. 15,  = CGI3 CGI4 CG11 CGI1 CG8 CG9 CEIA2 CEIA9 CG12 CGI5 CEIA1"
        ],
        "source_document": "Informática Biomédica.pdf",
        "chunk_id": "Curso 2020:2021_MU Inteligencia Artificial_Informática Biomédica.pdf_ch_12",
        "question_type": "procedural",
        "topic": "plan_de_estudios",
        "difficulty": "medium",
        "chunk_metadata": {
            "course": "Curso 2020:2021",
            "category": "Máster",
            "degree": "MU Inteligencia Artificial",
            "chunk_index": 12,
            "source": "Informática Biomédica.pdf"
        }
    },
    {
        "sample_id": "34",
        "generation_method": "llm_generated",
        "language": "es",
        "question": "¿Cómo se estructura el plan de estudios del Grado en Ciencia de Datos e Inteligencia Artificial?",
        "answer": "",
        "ground_truth": "El plan de estudios consta de 10 créditos y se divide en cuatro módulos, cada uno con una carga horaria determinada.",
        "contexts": [],
        "reference_contexts": [
            "[Curso 2021:2022 - Grado en Ciencia de Datos e Inteligencia Artificial - Inteligencia Artificial.pdf]\nPROCESO DE COORDINACIÓN DE LAS ENSEÑANZAS PR/CL/001\nANX-PR/CL/001-01 UÍA DE APRENDIZAJE ASI NATURA 105001013 - Inteligencia Artificial PLAN DE ESTUDIOS 10CD - Grado En Ciencia De Datos E Inteligencia Artificial CURSO ACADÉMICO Y SEMESTRE 2021/22 - Primer semestre BORRADOR"
        ],
        "source_document": "Inteligencia Artificial.pdf",
        "chunk_id": "Curso 2021:2022_Grado en Ciencia de Datos e Inteligencia Artificial_Inteligencia Artificial.pdf_ch_0",
        "question_type": "procedural",
        "topic": "plan_de_estudios",
        "difficulty": "medium",
        "chunk_metadata": {
            "chunk_index": 0,
            "degree": "Grado en Ciencia de Datos e Inteligencia Artificial",
            "course": "Curso 2021:2022",
            "source": "Inteligencia Artificial.pdf",
            "category": "Grado"
        }
    },
    {
        "sample_id": "35",
        "generation_method": "llm_generated",
        "language": "es",
        "question": "¿Cuál es la edición del libro Artificial Intelligence: A Modern Approach, de S. Russell y P. Norvig?",
        "answer": "",
        "ground_truth": "La tercera edición del libro Artificial Intelligence: A Modern Approach se publicó en 2009.",
        "contexts": [],
        "reference_contexts": [
            "[Curso 2020:2021 - Grado en Tecnologías para la Sociedad de la Informaicón  - Inteligencia Artificial.pdf]\n8.1. Recursos didácticos de la asignatura\nBibliografía, Tipo = Bibliografía. Bibliografía, Observaciones = S. Russell, P. Norvig (2009) Artificial Intelligence: A Modern Approach, Pearson (3rd edition).<br /> <br /> P.H. Winston (1992) Artificial Intelligence, Pearson (3rd edition).. Recursos web, Tipo = Recursos web. Recursos web, Observaciones = http://www.dia.fi.upm.es/<br /> http://moodle.upm.es/\nBORRADOR"
        ],
        "source_document": "Inteligencia Artificial.pdf",
        "chunk_id": "Curso 2020:2021_Grado en Tecnologías para la Sociedad de la Informaicón _Inteligencia Artificial.pdf_ch_14",
        "question_type": "factual",
        "topic": "tfm",
        "difficulty": "easy",
        "chunk_metadata": {
            "chunk_index": 14,
            "degree": "Grado en Tecnologías para la Sociedad de la Informaicón ",
            "source": "Inteligencia Artificial.pdf",
            "category": "Grado",
            "course": "Curso 2020:2021"
        }
    },
    {
        "sample_id": "36",
        "generation_method": "llm_generated",
        "language": "es",
        "question": "¿Cuántos ECTS tiene la asignatura de Lenguajes Formales, Autómatas y Computabilidad?",
        "answer": "",
        "ground_truth": "La asignatura tiene 6 ECTS.",
        "contexts": [],
        "reference_contexts": [
            "[Curso 2024:2025 - Doble Grado en Ingenieria Informática + ADE - Lenguajes Formales, Automátas y Computabilidad.pdf]\n1.1. Datos de la asignatura\nNombre de la asignatura, 1 = 105000383 - Lenguajes Formales, Autómatas y Computabilidad. No de créditos, 1 = 6 ECTS. Carácter, 1 = Obligatoria. Curso, 1 = Tercero curso. Semestre, 1 = Quinto semestre. Período de impartición, 1 = Septiembre-Enero. Idioma de impartición, 1 = Castellano. Titulación, 1 = 10ID - Doble Grado en Ingenieria Informatica y en ADE. Centro responsable de la titulación, 1 = 10 - Escuela Tecnica Superior De Ingenieros Informaticos. Curso académico, 1 = 2024-25"
        ],
        "source_document": "Lenguajes Formales, Automátas y Computabilidad.pdf",
        "chunk_id": "Curso 2024:2025_Doble Grado en Ingenieria Informática + ADE_Lenguajes Formales, Automátas y Computabilidad.pdf_ch_2",
        "question_type": "factual",
        "topic": "plan_de_estudios",
        "difficulty": "easy",
        "chunk_metadata": {
            "chunk_index": 2,
            "degree": "Doble Grado en Ingenieria Informática + ADE",
            "source": "Lenguajes Formales, Automátas y Computabilidad.pdf",
            "category": "Grado",
            "course": "Curso 2024:2025"
        }
    },
    {
        "sample_id": "37",
        "generation_method": "llm_generated",
        "language": "es",
        "question": "¿Cómo se describe en el texto la capacidad para describir y aplicar los mecanismos de interacción en sociedades artificiales e híbridas?",
        "answer": "",
        "ground_truth": "La capacidad para describir y aplicar los mecanismos de interacción en sociedades artificiales e híbridas se describe como incluir aspectos relacionados con el procesamiento de lenguaje natural, la decisión colectiva, la negociación y la coordinación.",
        "contexts": [],
        "reference_contexts": [
            "[Curso 2024:2025 - Grado en Ciencia de Datos e Inteligencia Artificial - Procesamiento de Lenguaje Natural.pdf]\n3. Competencias y resultados de aprendizaje 3.1. Competencias CB01 - Que los estudiantes hayan demostrado poseer y comprender conocimientos en un área de estudio que parte de la base de la educación secundaria general, y se suele encontrar a un nivel que, si bien se apoya en libros  de  texto  avanzados,  incluye  también  algunos  aspectos  que  implican  conocimientos  procedentes  de  la vanguardia de su campo de estudio CB02 - Que los estudiantes sepan aplicar sus conocimientos a su trabajo o vocación de una forma profesional y posean  las  competencias  que  suelen  demostrarse  por  medio  de  la  elaboración  y  defensa  de  argumentos  y  la resolución de problemas dentro de su área de estudio CB03 - Que los estudiantes tengan la capacidad de reunir e interpretar datos relevantes (normalmente dentro de su área de estudio) para emitir juicios que incluyan una reflexión sobre temas relevantes de índole social, científica o ética CB04  -  Que  los  estudiantes  puedan  transmitir  información,  ideas,  problemas  y  soluciones  a  un  público  tanto especializado como no especializado CB05 - Que los estudiantes hayan desarrollado aquellas habilidades de aprendizaje necesarias para emprender estudios posteriores con un alto grado de autonomía CE14 - Capacidad para describir  las  técnicas  de  adquisición  y  representación  del  conocimiento,  y  modelos  de razonamiento  en  entornos  centralizados  y  distribuidos,  y  utilizarlas  para  desarrollar  sistemas  basados  en  el conocimiento orientados a la resolución de problemas y toma de decisiones que requieran conducta inteligente. CE17 - Capacidad para describir y aplicar los mecanismos de interacción en sociedades es artificiales e híbridas, incluyendo aspectos relacionados con el procesamiento de lenguaje natural, la decisión colectiva, la negociación y la coordinación. CG01 - Capacidad de trabajo  en  equipo,  en  entornos  interdisciplinares  y  complejos,  negociando  y  resolviendo conflictos, diseñando soluciones eficientes, fiables, robustas y responsables. CG02  -  Capacidad  para  organizar  y  planificar  tareas  y  proyectos,  identificando  objetivos,  prioridades,  plazos, BORRADOR\nanalizando sus"
        ],
        "source_document": "Procesamiento de Lenguaje Natural.pdf",
        "chunk_id": "Curso 2024:2025_Grado en Ciencia de Datos e Inteligencia Artificial_Procesamiento de Lenguaje Natural.pdf_ch_42",
        "question_type": "procedural",
        "topic": "profesorado",
        "difficulty": "medium",
        "chunk_metadata": {
            "course": "Curso 2024:2025",
            "chunk_index": 42,
            "degree": "Grado en Ciencia de Datos e Inteligencia Artificial",
            "category": "Grado",
            "source": "Procesamiento de Lenguaje Natural.pdf"
        }
    },
    {
        "sample_id": "38",
        "generation_method": "llm_generated",
        "language": "es",
        "question": "¿Cuántas horas de trabajo presencial y no presencial dedicará el alumno por cada crédito ECTS?",
        "answer": "",
        "ground_truth": "El alumno dedicará dependiendo del plan de estudios, entre 26 y 27 horas de trabajo presencial y no presencial.",
        "contexts": [],
        "reference_contexts": [
            "[Curso 2023:2024 - Grado en Ciencia de Datos e Inteligencia Artificial - Inteligencia Artificial.pdf]\n6.1. Cronograma de la asignatura *\nPara el cálculo de los valores totales, se estima que por cada crédito ECTS el alumno dedicará dependiendo del plan de estudios, entre 26 y 27 horas de trabajo presencial y no presencial. * El cronograma sigue una planificación teórica de la asignatura y puede sufrir modificaciones durante el curso derivadas de la situación creada por la COVID-19. BORRADOR"
        ],
        "source_document": "Inteligencia Artificial.pdf",
        "chunk_id": "Curso 2023:2024_Grado en Ciencia de Datos e Inteligencia Artificial_Inteligencia Artificial.pdf_ch_10",
        "question_type": "factual",
        "topic": "plan_de_estudios",
        "difficulty": "easy",
        "chunk_metadata": {
            "degree": "Grado en Ciencia de Datos e Inteligencia Artificial",
            "chunk_index": 10,
            "category": "Grado",
            "source": "Inteligencia Artificial.pdf",
            "course": "Curso 2023:2024"
        }
    },
    {
        "sample_id": "39",
        "generation_method": "llm_generated",
        "language": "es",
        "question": "¿Cuántos días de duración tiene la actividad en aula \"Análisis de grafos y redes sociales\"?",
        "answer": "",
        "ground_truth": "La actividad \"Análisis de grafos y redes sociales\" dura 2 horas cada una.",
        "contexts": [],
        "reference_contexts": [
            "[Curso 2023:2024 - Grado en Ciencia de Datos e Inteligencia Artificial - Computación Social y Personalizacion.pdf]\n5.1. Cronograma de la asignatura *\n Magistral. 9, Actividad en laboratorio = . 9, Tele-enseñanza = . 9, Actividades de evaluación = . 10, Actividad en aula = Análisis de grafos y redes sociales Duración: 02:00 LM: Actividad del tipo Lección Magistral. 10, Actividad en laboratorio = . 10, Tele-enseñanza = . 10, Actividades de evaluación = . 11, Actividad en aula = Análisis de grafos y redes sociales Duración: 02:00 LM: Actividad del tipo Lección Magistral. 11, Actividad en laboratorio = . 11, Tele-enseñanza = . 11, Actividades de evaluación = . 12, Actividad en aula = Sistemas de recomendación Duración: 02:00 LM: Actividad del tipo Lección Magistral. 12, Actividad en laboratorio = . 12, Tele-enseñanza = . 12, Actividades de evaluación = . 13, Actividad en aula = Sistemas de recomendación Duración: 02:00 LM: Actividad del tipo Lección Magistral. 13, Actividad en laboratorio = . 13, Tele-enseñanza = . 13, Actividades de evaluación = "
        ],
        "source_document": "Computación Social y Personalizacion.pdf",
        "chunk_id": "Curso 2023:2024_Grado en Ciencia de Datos e Inteligencia Artificial_Computación Social y Personalizacion.pdf_ch_8",
        "question_type": "factual",
        "topic": "plan_de_estudios",
        "difficulty": "easy",
        "chunk_metadata": {
            "category": "Grado",
            "degree": "Grado en Ciencia de Datos e Inteligencia Artificial",
            "course": "Curso 2023:2024",
            "chunk_index": 8,
            "source": "Computación Social y Personalizacion.pdf"
        }
    },
    {
        "sample_id": "40",
        "generation_method": "llm_generated",
        "language": "es",
        "question": "¿Cómo se recomiendan los recursos didácticos en la asignatura de Probabilidades y Estadística I?",
        "answer": "",
        "ground_truth": "Los recursos didácticos se deben consultar primero las observaciones para determinar si son bibliografía o no.",
        "contexts": [],
        "reference_contexts": [
            "[Curso 2023:2024 - Grado en Matemáticas e Informática - Probabilidades y Estadistica I.pdf]\n8.1. Recursos didácticos de la asignatura\n\nCalot, G. (1988). Curso de Estadística Descriptiva. Ed. Paraninfo, Tipo = Bibliografía. Calot, G. (1988). Curso de Estadística Descriptiva. Ed. Paraninfo, Observaciones = . Canavos, G.C. (1987). Probabilidad y Estadística. McGraw-Hill, Méjico, Tipo = Bibliografía. Canavos, G.C. (1987). Probabilidad y Estadística. McGraw-Hill, Méjico, Observaciones = . Devore, J.L. (2008). Probabilidad y Estadística para Ingeniería y Ciencias. Cengage Learning., Tipo = Bibliografía. Devore, J.L. (2008). Probabilidad y Estadística para Ingeniería y Ciencias. Cengage Learning., Observaciones = . Fernández Cuesta, C. y Fuentes García, F. (1995). Curso de Estadística Descriptiva. Teoría y Práctica. Ed. Ariel, Tipo = Bibliografía. Fernández Cuesta, C. y Fuentes García, F. (1995). Curso de Estadística Descriptiva. Teoría y Práctica. Ed. Ariel, Observaciones = . Heumaann, C., Shomaker, M., Shalabh. (2016) Introduction to Statistics and Data Analysis. Springer., Tipo = Bibliografía. Heumaann, C., Shomaker, M., Shalabh. (2016) Introduction to Statistics and Data Analysis. Springer., Observaciones = BORRADOR. Meyer, P.L. (1992). Probabilidad y Aplicaciones Estadísticas. Edición revisada. Addison Weley Iberoamericana, Tipo = Bibliografía. Meyer, P.L. (1992). Probabilidad y Aplicaciones Estadísticas. Edición revisada. Addison Weley Iberoamericana, Observaciones = . Milton, J.S. y Arnold, J.C. (1986). Probability and Statistic in the Engineering and Computing Sciences. McGraw-Hill, Tipo = Bibliografía. Milton, J.S. y Arnold, J.C. (1986). Probability and Statistic in the Engineering and Computing Sciences. McGraw-Hill, Observaciones = . Moreno Díaz, A. y Rodríguez Galiano, M. I. (2016) Fundamentos de Estadística y Probabilidad. Ediciones CEF., Tipo = Bibliografía. Moreno Díaz, A. y Rodríguez Galiano, M. I. (2016) Fundamentos de Estadística y Probabilidad. Ediciones"
        ],
        "source_document": "Probabilidades y Estadistica I.pdf",
        "chunk_id": "Curso 2023:2024_Grado en Matemáticas e Informática_Probabilidades y Estadistica I.pdf_ch_25",
        "question_type": "procedural",
        "topic": "otros",
        "difficulty": "medium",
        "chunk_metadata": {
            "chunk_index": 25,
            "course": "Curso 2023:2024",
            "source": "Probabilidades y Estadistica I.pdf",
            "category": "Grado",
            "degree": "Grado en Matemáticas e Informática"
        }
    },
    {
        "sample_id": "41",
        "generation_method": "llm_generated",
        "language": "es",
        "question": "¿Cuáles son las diferencias entre los métodos de demostración y la modelización mediante procedimientos finitos conjuntos y lenguajes infinitos?, ¿cuál es el objetivo principal del aprendizaje de RA59 y RA58?",
        "answer": "",
        "ground_truth": "Las competencias 10II-CE01, 10II-CE02, 10II-CE03/04 y 10II-CE13/18 se enfocan en la comprensión de conceptos fundamentales de la informática, formalización de problemas, elección de métodos analíticos y descripción de soluciones abstractas.",
        "contexts": [],
        "reference_contexts": [
            "[Curso 2024:2025 - Doble Grado en Ingenieria Informática + ADE - Lenguajes Formales, Automátas y Computabilidad.pdf]\n3. Competencias y resultados de aprendizaje\n3.1. Competencias 10II-CE01 - Conocer profundamente los cimientos esenciales y fundacionales de la informática, abarcando tanto conceptos y teorías abstractos como los valores y los principios profesionales, subrayando los aspectos esenciales de la disciplina que permanecen inalterables ante el cambio tecnológico. 10II-CE02 - Formalización y especificación de problemas reales cuya solución requiere el uso de la informática. 10II-CE03/04 - Capacidad de elegir y usar los métodos analíticos y de modelización relevantes, y de describir una solución de forma abstracta. 10II-CE13/18 - Comprender lo que pueden y no pueden conseguir las tecnologías actuales, y las limitaciones de la informática,  que  implica  distinguir  entre  lo  que,  inherentemente,  la  informática  no  es  capaz  de  hacer  y  lo  que puede lograrse a través de la ciencia y la tecnología futuras. 3.2. Resultados del aprendizaje RA59 - Adquirir destreza en la aplicación de los diferentes métodos de demostración. RA58 - Modelar mediante procedimientos finitos conjuntos y lenguajes infinitos. RA60 - Distinguir y reconocer las distintas clases de lenguajes y sus autómatas asociados según la jerarquía de Chomsky. RA61  -  Conocer  modelos  de  cómputo  universales  así  como  los  límites  de  lo  que  puede  o  no  ser  computado mediante un algoritmo. BORRADOR"
        ],
        "source_document": "Lenguajes Formales, Automátas y Computabilidad.pdf",
        "chunk_id": "Curso 2024:2025_Doble Grado en Ingenieria Informática + ADE_Lenguajes Formales, Automátas y Computabilidad.pdf_ch_4",
        "question_type": "comparative",
        "topic": "tfm",
        "difficulty": "hard",
        "chunk_metadata": {
            "degree": "Doble Grado en Ingenieria Informática + ADE",
            "course": "Curso 2024:2025",
            "source": "Lenguajes Formales, Automátas y Computabilidad.pdf",
            "chunk_index": 4,
            "category": "Grado"
        }
    },
    {
        "sample_id": "42",
        "generation_method": "llm_generated",
        "language": "es",
        "question": "",
        "answer": "",
        "ground_truth": "La evaluación progresiva del curso incluye un examen escrito y exposiciones orales.",
        "contexts": [],
        "reference_contexts": [
            "[Curso 2023:2024 - Grado en Ciencia de Datos e Inteligencia Artificial - Web Semantica, Linked Data y Grafos de Conocimiento.pdf]\n7.1.1. Evaluación (progresiva)\n\n5, Descripción = Test sobre RDF y SPARQL. 5, Modalidad = EX: Técnica del tipo Examen Escrito. 5, Tipo = No Presencial. 5, Duración = 00:30. 5, Peso en la nota = 15%. 5, Nota mínima = 5 / 10. 5, Competencias evaluadas = CE11 CE14. 8, Descripción = Prueba sobre librerías RDF(S). 8, Modalidad = EP: Técnica del tipo Examen de Prácticas. 8, Tipo = Presencial. 8, Duración = 00:30. 8, Peso en la nota = 15%. 8, Nota mínima = 5 / 10. 8, Competencias evaluadas = CE11 CE14. 12, Descripción = Creación y publicación de datos a partir de fuentes de datos heterogéneas / Creation and publication of Linked Data and knowledge graphs from heterogeneous data sources. 12, Modalidad = TG: Técnica del tipo Trabajo en Grupo. 12, Tipo = No Presencial. 12, Duración = 16:00. 12, Peso en la nota = 30%. 12, Nota mínima = 5 / 10. 12, Competencias evaluadas = CB01 CB02 CB03 CB05 CG01 CG02 CG04 CG06 CG07 CE11. 15, Descripción = Creación y publicación de datos a partir de fuentes de datos heterogéneas (II) / Creation and publication of Linked Data and knowledge graphs from heterogeneous data sources (II). 15, Modalidad = TG: Técnica del tipo Trabajo en Grupo. 15, Tipo = No Presencial. 15, Duración = 15:00. 15, Peso en la nota = 30%. 15, Nota mínima = 5 / 10. 15, Competencias evaluadas = CB01 CB02 CB03 CB05 CG01 CG02 CG04 CG06 CG07 CE11 CE14. 15, Descripción = Test escrito y Exposición oral. 15, Modalidad = PG: Técnica del tipo Presentación en Grupo. 15, Tipo = Presencial. 15, Duración = 02:00. 15, Peso en la nota = 10%. 15, Nota mínima"
        ],
        "source_document": "Web Semantica, Linked Data y Grafos de Conocimiento.pdf",
        "chunk_id": "Curso 2023:2024_Grado en Ciencia de Datos e Inteligencia Artificial_Web Semantica, Linked Data y Grafos de Conocimiento.pdf_ch_12",
        "question_type": "factual",
        "topic": "plan_de_estudios",
        "difficulty": "easy",
        "chunk_metadata": {
            "course": "Curso 2023:2024",
            "category": "Grado",
            "degree": "Grado en Ciencia de Datos e Inteligencia Artificial",
            "source": "Web Semantica, Linked Data y Grafos de Conocimiento.pdf",
            "chunk_index": 12
        }
    },
    {
        "sample_id": "43",
        "generation_method": "llm_generated",
        "language": "es",
        "question": "",
        "answer": "",
        "ground_truth": "out_of_scope",
        "contexts": [],
        "reference_contexts": [],
        "source_document": "N/A",
        "chunk_id": "N/A",
        "question_type": "",
        "topic": "otros",
        "difficulty": "easy",
        "chunk_metadata": {
            "category": "Máster",
            "degree": "MU Inteligencia Artificial",
            "course": "Curso 2020:2021",
            "source": "Redes Bayesianas.pdf",
            "chunk_index": 8
        }
    },
    {
        "sample_id": "44",
        "generation_method": "llm_generated",
        "language": "es",
        "question": "",
        "answer": "",
        "ground_truth": "",
        "contexts": [],
        "reference_contexts": [
            "[Curso 2021:2022 - Doble Grado en Ingenieria Informatica y ADE - Inteligencia Artificial.pdf]\n4.2. Resultados del aprendizaje\nRA278 - Diseñar y construir  sistemas  informáticos  capaces  de  resolver  problemas  para  los  que  no  se  conoce solución RA277 - Aplicar técnicas de inferencia RA279 - Aplicar técnicas para representar conocimiento 5. Descripción de la asignatura y temario 5.1. Descripción de la asignatura La  inteligencia  artificial  es  una  rama  de  la  informática  que  estudia  técnicas  para  simular  el  comportamiento inteligente en un computador. En esta asignatura se estudian lenguajes formales de representación de diferentes tipos  de  conocimiento  así  como  sus  modelos  específicos  de  razonamiento  para  afrontar  problemas  reales. Asimismo, se representan diferentes técnicas de búsqueda y se introducen las redes de neuronas artificiales con el algoritmo de retroprogramación del gradiente c0mo técnica principal de aprendizaje para este tipo de sistemas inteligentes. 5.2. Temario de la asignatura 1. Introducción a la Inteligencia Artificial 2. Sistemas de Producción 3. Relaciones Taxonómicas y N-Arias BORRADOR\n4. Grafos del Conocimiento\n5. Técnicas de Búsqueda\n3. 5.1. Búsqueda Ciega\n4. 5.2. Búsqueda Informada\n5. 5.3. Satisfacción de Restricciones\n6. 5.4. ABúsqueda con adversarios\n7. 5.5. Búsqueda en Espacio de Estados\n6. Modelos de Razonamiento Aproximado\n- 6.1. Razonamiento con Incertidumbre\n- 6.2. Razonamiento con Imprecisión: Lógica Borrosa\n7. Redes de Neurons Artificiales\n- 7.1. Modelos de Redes de Neuronas\n- 7.2. Aprendizaje\nBORRADOR"
        ],
        "source_document": "Inteligencia Artificial.pdf",
        "chunk_id": "Curso 2021:2022_Doble Grado en Ingenieria Informatica y ADE_Inteligencia Artificial.pdf_ch_5",
        "question_type": "factual",
        "topic": "tfm",
        "difficulty": "medium",
        "chunk_metadata": {
            "chunk_index": 5,
            "course": "Curso 2021:2022",
            "degree": "Doble Grado en Ingenieria Informatica y ADE",
            "source": "Inteligencia Artificial.pdf",
            "category": "Grado"
        }
    },
    {
        "sample_id": "45",
        "generation_method": "llm_generated",
        "language": "es",
        "question": "La evaluación final del Master Universitario en Inteligencia Artificial tiene un peso de cuánto por ciento en la nota?",
        "answer": "",
        "ground_truth": "La evaluación final del Master Universitario en Inteligencia Artificial tiene un peso del 50% en la nota.",
        "contexts": [],
        "reference_contexts": [
            "[Curso 2021:2022 - Master Universitario en Inteligencia Artificial - Modelos de Razonamiento.pdf]\n6.1.2. Evaluación sólo prueba final\n17, Descripción = Examen escrito. 17, Modalidad = EX: Técnica del tipo Examen Escrito. 17, Tipo = Presencial. 17, Duración = 02:00. 17, Peso en la nota = 50%. 17, Nota mínima = 5 / 10. 17, Competencias evaluadas = CGI1 CEIA1. 17, Descripción = Trabajo práctico. 17, Modalidad = TG: Técnica del tipo Trabajo en Grupo. 17, Tipo = No Presencial. 17, Duración = 00:00. 17, Peso en la nota = 50%. 17, Nota mínima = 5 / 10. 17, Competencias evaluadas = CB9 CG13 CG18 CGI4 CB10 CGI3\nBORRADOR"
        ],
        "source_document": "Modelos de Razonamiento.pdf",
        "chunk_id": "Curso 2021:2022_Master Universitario en Inteligencia Artificial_Modelos de Razonamiento.pdf_ch_12",
        "question_type": "factual",
        "topic": "plan_de_estudios",
        "difficulty": "easy",
        "chunk_metadata": {
            "course": "Curso 2021:2022",
            "category": "Máster",
            "degree": "Master Universitario en Inteligencia Artificial",
            "source": "Modelos de Razonamiento.pdf",
            "chunk_index": 12
        }
    },
    {
        "sample_id": "46",
        "generation_method": "llm_generated",
        "language": "es",
        "question": "¿Cómo se podría describir la evaluación continua en este curso de Matemática e Informática?",
        "answer": "",
        "ground_truth": "La evaluación continua se lleva a cabo mediante prácticas y un examen que evalúa las habilidades adquiridas durante el curso.",
        "contexts": [],
        "reference_contexts": [
            "[Curso 2020:2021 - Grado en Matemática e Informática (ML) - Programacion Declarativa- Logica y Restricciones.pdf]\n7.1.1. Evaluación continua\n prácticas = Examen Eval. Continua. 16, TG: Técnica del tipo Trabajo en Grupo = EP: Técnica del tipo Examen de Prácticas. 16, No Presencial = No Presencial. 16, 03:00 = 01:00. 16, % = 50%. 16, 5 / 10 = 5 / 10. 16,  = CE08 CE30"
        ],
        "source_document": "Programacion Declarativa- Logica y Restricciones.pdf",
        "chunk_id": "Curso 2020:2021_Grado en Matemática e Informática (ML)_Programacion Declarativa- Logica y Restricciones.pdf_ch_16",
        "question_type": "ambiguous",
        "topic": "otros",
        "difficulty": "hard",
        "chunk_metadata": {
            "degree": "Grado en Matemática e Informática (ML)",
            "course": "Curso 2020:2021",
            "category": "Grado",
            "source": "Programacion Declarativa- Logica y Restricciones.pdf",
            "chunk_index": 16
        }
    },
    {
        "sample_id": "47",
        "generation_method": "llm_generated",
        "language": "es",
        "question": "¿Cómo se evalúa la asignatura en caso de que el estudiante decida realizar solo una prueba final?",
        "answer": "",
        "ground_truth": "La evaluación consistirá en las dos exposiciones orales, los trabajos escritos individuales y el examen de tipo test.",
        "contexts": [],
        "reference_contexts": [
            "[Curso 2020:2021 - Grado en Ingeneiría Informática - Minería de Datos.pdf]\n7.1.2. Evaluación sólo prueba final\nSi no se superan los mínimos previamente mencionados en alguna de las tres partes, deberá presentarse de nuevo a esa(s) parte(s) en Julio.  Si,  en  cambio,  todas  superan  los  mínimos  establecidos,  pero  la  nota  final  no resulta un aprobado (mayor o igual que 5 sobre 10), el alumno tendrá que presentarse en Julio a cualquiera de las partes (una, dos o las tres), lo que él decida, teniendo en cuenta que para aprobar la nota final ha de ser mayor o igual a 5 sobre 10.\nPara  la  convocatoria  extraordinaria  de  Julio  las  evaluaciones  serán  análogas  (dos  exposiciones  orales  y  sus respectivos trabajos escritos realizados de forma individual, junto con el examen de tipo test). Si el estudiante decide realizar sólo una prueba final, se efectuará en la fecha de examen final fijada por jefatura de estudios y consistirá (como en la evaluación continua) en las dos exposiciones orales y sus respectivos trabajos escritos realizados de forma individual, y en el examen de tipo test, evaluándose con los mismos pesos que en la evaluación continua. La solicitud para hacer sólo una prueba final se tiene que realizar por email al coordinador de la asignatura antes de la primera prueba. No podrá haber dos alumnos que utilicen los mismos datos y con el mismo objetivo. Está terminantemente prohibido copiar o dejar copiar. Su detección implicará el suspenso inmediato y la repetición de los trabajos con datos diferentes. Los derechos y deberes de los estudiantes universitarios están desarrollados en los Estatutos de la Universidad Politécnica  de  Madrid  (BOCM  de  15  de  noviembre  de  2010)  y  en  el  Estatuto  del  Estudiante  Universitario  (RD 1791/2010 de 30 de diciembre). BORRADOR"
        ],
        "source_document": "Minería de Datos.pdf",
        "chunk_id": "Curso 2020:2021_Grado en Ingeneiría Informática_Minería de Datos.pdf_ch_14",
        "question_type": "factual",
        "topic": "plan_de_estudios",
        "difficulty": "hard",
        "chunk_metadata": {
            "category": "Grado",
            "source": "Minería de Datos.pdf",
            "course": "Curso 2020:2021",
            "chunk_index": 14,
            "degree": "Grado en Ingeneiría Informática"
        }
    },
    {
        "sample_id": "48",
        "generation_method": "llm_generated",
        "language": "es",
        "question": "¿Cuál es el tipo de evaluación que se realiza en las prácticas de clase y laboratorio?",
        "answer": "",
        "ground_truth": "La evaluación continua no presencial incluye ejercicios de clase, elaboración de prácticas y trabajo individual.",
        "contexts": [],
        "reference_contexts": [
            "[Curso 2021:2022 - Grado en Matematicas e Informatica -  Programacion Declarativa- Logica y Restricciones ML.pdf]\n6.1. Cronograma de la asignatura *\n\n1, Actividad presencial en aula = 1.1 y 1.2 Duración: 02:00 LM: Actividad del tipo Lección Magistral. 1, Actividad presencial en laboratorio = . 1, Actividades de evaluación = Ejercicios de clase TI: Técnica del tipo Trabajo Individual Evaluación continua No presencial Duración: 02:00. 2, Actividad presencial en aula = 2.1 y 2.2 Duración: 02:00 LM: Actividad del tipo Lección Magistral. 2, Actividad presencial en laboratorio = . 2, Actividades de evaluación = Elaboración de las prácticas TI: Técnica del tipo Trabajo Individual Evaluación continua No presencial Duración: 02:00. 3, Actividad presencial en aula = 2.3 Duración: 02:00 LM: Actividad del tipo Lección Magistral. 3, Actividad presencial en laboratorio = BORRADOR. 3, Actividades de evaluación = Elaboración de las prácticas TI: Técnica del tipo Trabajo Individual Evaluación continua No presencial Duración: 02:00. 4, Actividad presencial en aula = 2.4 Duración: 02:00 LM: Actividad del tipo Lección Magistral. 4, Actividad presencial en laboratorio = . 4, Actividades de evaluación = Elaboración de las prácticas TI: Técnica del tipo Trabajo Individual Evaluación continua No presencial Duración: 02:00. 5, Actividad presencial en aula = . 5, Actividad presencial en laboratorio = Clase practica Duración: 03:00 PL: Actividad del tipo Prácticas de Laboratorio. 5, Actividades de evaluación = Elaboración de las prácticas TI: Técnica del tipo Trabajo Individual Evaluación continua No presencial Duración: 02:00. 6, Actividad presencial en aula = 3.1 y 3.2 Duración: 02:00 LM: Actividad del tipo Lección Magistral. 6, Actividad presencial en laboratorio = Clase práctica (opcional) Duración: 01:00 PL: Actividad del tipo Prácticas de Laboratorio. 6, Actividades de evaluación = Elaboración de las prácticas TI: Técnica del tipo Trabajo Individual Evaluación continua No presencial Duración: 03:00."
        ],
        "source_document": " Programacion Declarativa- Logica y Restricciones ML.pdf",
        "chunk_id": "Curso 2021:2022_Grado en Matematicas e Informatica_ Programacion Declarativa- Logica y Restricciones ML.pdf_ch_6",
        "question_type": "comparative",
        "topic": "plan_de_estudios",
        "difficulty": "medium",
        "chunk_metadata": {
            "category": "Grado",
            "chunk_index": 6,
            "course": "Curso 2021:2022",
            "degree": "Grado en Matematicas e Informatica",
            "source": " Programacion Declarativa- Logica y Restricciones ML.pdf"
        }
    },
    {
        "sample_id": "49",
        "generation_method": "llm_generated",
        "language": "es",
        "question": "¿Qué ocurre si un alumno no entrega el trabajo escrito a tiempo?",
        "answer": "",
        "ground_truth": "El estudiante obtendría una nota máxima de 4,0 sobre 10 en la calificación final, dependiendo del resto de actividades evaluables realizadas.",
        "contexts": [],
        "reference_contexts": [
            "[Curso 2021:2022 - Master Universitario en Inteligencia Artificial - Computacion Evolutiva.pdf]\n7.1.3. Evaluación convocatoria extraordinaria\n3. Cumplidos estos requisitos (necesarios pero no suficientes), la calificación final de la asignatura se calculará en función de las calificaciones obtenidas en cada una de las actividades evaluables, ponderadas por los pesos indicados en cada actividad. Es necesario tener una calificación final igual o superior a 5,0 para aprobar.\n2. examen escrito). 7.2. Criterios de evaluación Para  poder  superar  la  asignatura  mediante  la  modalidad  de  evaluación  continua  será  necesario  cumplir  los requisitos siguientes: 1. Asistir regularmente a clase (actividad presencial en aula) o a las sesiones online síncronas planificadas: lecciones magistrales y exposiciones realizadas por los alumnos. 2. Redactar un trabajo escrito propuesto por el(los) alumno(s) o el profesor que permita profundizar en algún tema relacionado con los contenidos de la asignatura. Se valorará especialmente que el contenido resulte innovador o suponga un estado del arte en el tema del trabajo. En caso de no entregar el trabajo escrito en la fecha indicada en la plataforma de tele-enseñanza Moodle de la asignatura, el alumno o alumnos involucrados en la realización del mismo obtendrán una nota  máxima de 4,0 sobre 10 (suspenso), en función del resto de actividades evaluables realizadas, en la calificación final. BORRADOR\nLa evaluación en la convocatoria extraordinaria (y sólo prueba final) de la asignatura constará de la realización de  forma  individual  del  trabajo  escrito  al  que  se  hace  referencia  en  las  \"Actividades  de  Evaluación\"  para  su calificación  por  parte  del  profesor  (con  un  peso  en  la  calificación  que  será  en  este  caso  del  30%),  así  como  la realización de una prueba escrita (examen) (70%) relacionada con los tres temas de los que consta la asignatura. Es  imprescindible  la  entrega  del  trabajo  escrito  de  forma  individualizada  para  realizar  la  prueba  escrita.  Para ello, se enviará al profesor de la asignatura el trabajo escrito  con una semana de antelación a la fecha del examen. En caso contrario, el alumno no será evaluado."
        ],
        "source_document": "Computacion Evolutiva.pdf",
        "chunk_id": "Curso 2021:2022_Master Universitario en Inteligencia Artificial_Computacion Evolutiva.pdf_ch_15",
        "question_type": "ambiguous",
        "topic": "plan_de_estudios",
        "difficulty": "hard",
        "chunk_metadata": {
            "source": "Computacion Evolutiva.pdf",
            "degree": "Master Universitario en Inteligencia Artificial",
            "category": "Máster",
            "course": "Curso 2021:2022",
            "chunk_index": 15
        }
    },
    {
        "sample_id": "50",
        "generation_method": "llm_generated",
        "language": "es",
        "question": "¿En qué año se desarrollaron los primeros dispositivos sintéticos?",
        "answer": "",
        "ground_truth": "Los primeros dispositivos sintéticos fueron desarrollados en el año 2000.",
        "contexts": [],
        "reference_contexts": [
            "[Curso 2022:2023 - Master Universitario en Inteligencia Artificial - Biología programable- Computacion con ADN e Ingenieria de Biocircuitos.pdf]\n2.2. Research assistants\n3.2. Learning outcomes RA90 - Comprender co?mo se pueden disen?ar e implementar bioalgoritmos que emplean mole?culas de ADN como sustrato (memoria). RA91 - Disen?ar circuitos lo?gicos biomoleculares sinte?ticos operando : (1) con ADN/ARN o (2) con protei?nas RA92 - Comprender co?mo las ce?lulas procesan informacio?n codificada en biomole?culas y toman decisiones. RA4 - Valorar la importancia de las fuentes documentales y seleccionar aquéllas que sean más interesantes para publicar sus trabajos RA3 - Abordar los aspectos formales del proyecto inicial de una investigación RA2 - Establecer un debate fundamentado sobre el conocimiento científico y las bases de la investigación * The Learning Guides should reflect the Skills and Learning Outcomes in the same way as indicated in the Degree Verification Memory. For this reason, they have not been translated into English and appear in Spanish. 4. Brief description of the subject and syllabus 4.1. Brief description of the subject In  this  course  we  will  study  the  basic  concepts  and  topics  of  Biomolecular  Computing,  Synthetic  Biology  and Programmable Biology. DRAFT VERSIO\nWhat is Synthetic Biology? It is the engineering of biology: the application of the engineering principles in biology to  design  and  build  biological  systems.This  field  considers  biology  as  a  technology  that  can  be  programmed  to manufacture new synthetic biological devices and systems. This field was born in 2000 in MIT Artificial Intelligence Lab where engineers, computer scientists, and physicists started to work jointly with biologists. Engineers asked this question: can we combine natural living hardware components (mainly genes) to build new synthetic biological systems? Can we design and write genetic programs in DNA (the software) to be run in a cellular processor (the hardware)? The answer was yes. The biotechnology and genetic engineering tools were already available. The first synthetic  devices  were  developed  in  2000:  a  genetic  memory  (Gardner,  Cantor,  &  Collins,  2000),  an  oscillatory genetic  circuit  (Elowitz  et  al.  2000)  and  several  genetic  Boolean  logic  gates  (Hasty,  McMillen,  &  Collins,  2002; Weiss et al., 2003)."
        ],
        "source_document": "Biología programable- Computacion con ADN e Ingenieria de Biocircuitos.pdf",
        "chunk_id": "Curso 2022:2023_Master Universitario en Inteligencia Artificial_Biología programable- Computacion con ADN e Ingenieria de Biocircuitos.pdf_ch_3",
        "question_type": "factual",
        "topic": "otros",
        "difficulty": "easy",
        "chunk_metadata": {
            "course": "Curso 2022:2023",
            "source": "Biología programable- Computacion con ADN e Ingenieria de Biocircuitos.pdf",
            "category": "Máster",
            "degree": "Master Universitario en Inteligencia Artificial",
            "chunk_index": 3
        }
    },
    {
        "sample_id": "51",
        "generation_method": "llm_generated",
        "language": "es",
        "question": "¿Cómo se compara la duración del examen final en el curso 2021:2022 para estudiantes del Grado en Matemáticas e Informática con respecto a otras modalidades de evaluación?",
        "answer": "",
        "ground_truth": "La duración del examen final es igual a 02:00 horas, lo que no se indica explícitamente para otras modalidades de evaluación.",
        "contexts": [],
        "reference_contexts": [
            "[Curso 2021:2022 - Grado en Matematicas e Informatica -  Programacion Declarativa- Logica y Restricciones.pdf]\n7.1.2. Evaluación sólo prueba final\n17, Descripción = Examen Eval. Ordinaria. 17, Modalidad = EX: Técnica del tipo Examen Escrito. 17, Tipo = Presencial. 17, Duración = 02:00. 17, Peso en la nota = 100%. 17, Nota mínima = 5 / 10. 17, Competencias evaluadas = CE08 CE30\nBORRADOR"
        ],
        "source_document": " Programacion Declarativa- Logica y Restricciones.pdf",
        "chunk_id": "Curso 2021:2022_Grado en Matematicas e Informatica_ Programacion Declarativa- Logica y Restricciones.pdf_ch_14",
        "question_type": "comparative",
        "topic": "plan_de_estudios",
        "difficulty": "hard",
        "chunk_metadata": {
            "course": "Curso 2021:2022",
            "source": " Programacion Declarativa- Logica y Restricciones.pdf",
            "category": "Grado",
            "degree": "Grado en Matematicas e Informatica",
            "chunk_index": 14
        }
    },
    {
        "sample_id": "52",
        "generation_method": "llm_generated",
        "language": "es",
        "question": "¿Qué es un autómata finito?",
        "answer": "",
        "ground_truth": "Un autómata finito es un tipo de máquina que puede reconocer lenguajes formales.",
        "contexts": [],
        "reference_contexts": [
            "[Curso 2022:2023 - Grado en Matematicas e Informatica - Lenguajes Formales, Automatas y Computabilidad.pdf]\n4.2. Temario de la asignatura\n1. Tema 1: Lenguajes formales\n- 1.1. Alfabetos. Palabra.\n- 1.2. Operaciones con palabras.\n- 1.3. Definición formal de lenguaje.\n- 1.4. Operaciones con lenguajes.\n- 1.5. Expresiones regulares.\n2. Tema 2: Gramáticas formales\n- 2.1. Definición.\n- 2.2. Tipos de gramáticas.\n- 2.3. Gramáticas tipo 0.\n- 2.4. Gramáticas independientes del contexto.\n- 2.5. Gramáticas regulares.\n3. Tema 3: Autómatas finitos (AF)\n- 3.1. Definición.\n- 3.2. Ejemplos.\n- 3.3. Autómatas conexos.\n- 3.4. Minimización de AF.\n- 3.5. Autómatas finito no deterministas (AFND).\n4. Tema 4: Lenguajes Regulares y Autómatas\n- 4.1. Relaciones entre Lenguajes regulares, Expresiones regulares, Autómatas finitos y Gramáticas lineales.\n- 4.2. Teorema de síntesis.\n- 4.3. Teorema de análisis.\n- 4.4. Ecuaciones características.\n- 4.5. Derivadas de expresiones regulares.\n5. Tema 5: Autómatas a Pila (AP)\n- 5.1. Definición funcionamiento, configuraciones y lenguajes aceptados.\n- 5.2. Autómata a Pila Determinista.\nBORRADOR\nANX-PR/CL/001-01\nUÍA DE APRENDIZAJE\n- 5.3. Equivalencia de aceptación de lenguajes por vaciado y por estados finales.\n- 5.4. Lenguajes aceptados por AP y lenguajes generados por una Gramática de tipo 2: Equivalencia.\n6. Tema 6: Computabilidad 6.1. Introducción: Alan Turing y los problemas indecidibles. 6.2. Máquina de Turing. Definición y ejemplos de diseño. 6.3. Máquina de Turing Universal. Definición y funcionamiento. 7. Tema 7: Ejercicios y problemas 7.1. Resolución de ejercicios y problemas. BORRADOR"
        ],
        "source_document": "Lenguajes Formales, Automatas y Computabilidad.pdf",
        "chunk_id": "Curso 2022:2023_Grado en Matematicas e Informatica_Lenguajes Formales, Automatas y Computabilidad.pdf_ch_6",
        "question_type": "factual",
        "topic": "otros",
        "difficulty": "easy",
        "chunk_metadata": {
            "course": "Curso 2022:2023",
            "chunk_index": 6,
            "degree": "Grado en Matematicas e Informatica",
            "source": "Lenguajes Formales, Automatas y Computabilidad.pdf",
            "category": "Grado"
        }
    },
    {
        "sample_id": "53",
        "generation_method": "llm_generated",
        "language": "es",
        "question": "¿Cuál es la principal diferencia entre las dos prácticas grupales y el examen final en la evaluación de esta asignatura?",
        "answer": "",
        "ground_truth": "Las prácticas grupales tienen un peso del 30% cada una, mientras que el examen final tiene un peso del 40%.",
        "contexts": [],
        "reference_contexts": [
            "[Curso 2022:2023 - Grado en Ciencia de Datos e Inteligencia Artificial - Logica para Inteligencia Artificial.pdf]\n8.1. Otra información sobre la asignatura\nBORRADOR"
        ],
        "source_document": "Logica para Inteligencia Artificial.pdf",
        "chunk_id": "Curso 2022:2023_Grado en Ciencia de Datos e Inteligencia Artificial_Logica para Inteligencia Artificial.pdf_ch_24",
        "question_type": "comparative",
        "topic": "tfm",
        "difficulty": "medium",
        "chunk_metadata": {
            "category": "Grado",
            "chunk_index": 24,
            "degree": "Grado en Ciencia de Datos e Inteligencia Artificial",
            "source": "Logica para Inteligencia Artificial.pdf",
            "course": "Curso 2022:2023"
        }
    },
    {
        "sample_id": "54",
        "generation_method": "llm_generated",
        "language": "es",
        "question": "Qué tipo de conocimientos se encuentran en la vanguardia del campo de estudio?",
        "answer": "",
        "ground_truth": "Los estudiantes deben haber demostrado poseer y comprender los conocimientos más avanzados en su área de estudio, que incluyen algunos aspectos procedentes de la vanguardia de su campo de estudio.",
        "contexts": [],
        "reference_contexts": [
            "[Curso 2024:2025 - Grado en Ciencia de Datos e Inteligencia Artificial - Procesamiento de Lenguaje Natural.pdf]\n3. Competencias y resultados de aprendizaje 3.1. Competencias CB01 - Que los estudiantes hayan demostrado poseer y comprender conocimientos en un área de estudio que parte de la base de la educación secundaria general, y se suele encontrar a un nivel que, si bien se apoya en libros  de  texto  avanzados,  incluye  también  algunos  aspectos  que  implican  conocimientos  procedentes  de  la vanguardia de su campo de estudio CB02 - Que los estudiantes sepan aplicar sus conocimientos a su trabajo o vocación de una forma profesional y posean  las  competencias  que  suelen  demostrarse  por  medio  de  la  elaboración  y  defensa  de  argumentos  y  la resolución de problemas dentro de su área de estudio CB03 - Que los estudiantes tengan la capacidad de reunir e interpretar datos relevantes (normalmente dentro de su área de estudio) para emitir juicios que incluyan una reflexión sobre temas relevantes de índole social, científica o ética CB04  -  Que  los  estudiantes  puedan  transmitir  información,  ideas,  problemas  y  soluciones  a  un  público  tanto especializado como no especializado CB05 - Que los estudiantes hayan desarrollado aquellas habilidades de aprendizaje necesarias para emprender estudios posteriores con un alto grado de autonomía CE14 - Capacidad para describir  las  técnicas  de  adquisición  y  representación  del  conocimiento,  y  modelos  de razonamiento  en  entornos  centralizados  y  distribuidos,  y  utilizarlas  para  desarrollar  sistemas  basados  en  el conocimiento orientados a la resolución de problemas y toma de decisiones que requieran conducta inteligente. CE17 - Capacidad para describir y aplicar los mecanismos de interacción en sociedades es artificiales e híbridas, incluyendo aspectos relacionados con el procesamiento de lenguaje natural, la decisión colectiva, la negociación y la coordinación. CG01 - Capacidad de trabajo  en  equipo,  en  entornos  interdisciplinares  y  complejos,  negociando  y  resolviendo conflictos, diseñando soluciones eficientes, fiables, robustas y responsables. CG02  -  Capacidad  para  organizar  y  planificar  tareas  y  proyectos,  identificando  objetivos,  prioridades,  plazos, BORRADOR\nde recursos"
        ],
        "source_document": "Procesamiento de Lenguaje Natural.pdf",
        "chunk_id": "Curso 2024:2025_Grado en Ciencia de Datos e Inteligencia Artificial_Procesamiento de Lenguaje Natural.pdf_ch_98",
        "question_type": "factual",
        "topic": "plan_de_estudios",
        "difficulty": "medium",
        "chunk_metadata": {
            "category": "Grado",
            "course": "Curso 2024:2025",
            "chunk_index": 98,
            "degree": "Grado en Ciencia de Datos e Inteligencia Artificial",
            "source": "Procesamiento de Lenguaje Natural.pdf"
        }
    },
    {
        "sample_id": "55",
        "generation_method": "llm_generated",
        "language": "es",
        "question": "La duración del examen final es de cuántos minutos?",
        "answer": "",
        "ground_truth": "El examen final dura 02:00 horas.",
        "contexts": [],
        "reference_contexts": [
            "[Curso 2020:2021 - Doble grado Ingeniería Informática y ADE - Programación Declarativa, Lógica y Restricciones.pdf]\n7.1.2. Evaluación sólo prueba final\n17, Descripción = Examen Eval. Ordinaria. 17, Modalidad = EX: Técnica del tipo Examen Escrito. 17, Tipo = Presencial. 17, Duración = 02:00. 17, Peso en la nota = 100%. 17, Nota mínima = 5 / 10. 17, Competencias evaluadas = 10II-CE02 10II-CE24 10II-CE08\nBORRADOR"
        ],
        "source_document": "Programación Declarativa, Lógica y Restricciones.pdf",
        "chunk_id": "Curso 2020:2021_Doble grado Ingeniería Informática y ADE_Programación Declarativa, Lógica y Restricciones.pdf_ch_17",
        "question_type": "factual",
        "topic": "tfm",
        "difficulty": "easy",
        "chunk_metadata": {
            "course": "Curso 2020:2021",
            "source": "Programación Declarativa, Lógica y Restricciones.pdf",
            "category": "Grado",
            "degree": "Doble grado Ingeniería Informática y ADE",
            "chunk_index": 17
        }
    },
    {
        "sample_id": "56",
        "generation_method": "llm_generated",
        "language": "es",
        "question": "¿Qué conocimientos previos se recomiendan para cursar la asignatura?",
        "answer": "",
        "ground_truth": "Conocimientos previos recomendados son técnicas de representación del conocimiento, tecnologías web y modelado de bases de datos.",
        "contexts": [],
        "reference_contexts": [
            "[Curso 2023:2024 - Master Universitario en Ingenieria Informatica - Datos Abiertos y Grafos de Conocimiento.pdf]\n3. Conocimientos previos recomendados\n3.1. Asignaturas previas que se recomienda haber cursado El plan de estudios Master Universitario en Ingenieria Informatica no tiene definidas asignaturas previas recomendadas para esta asignatura. 3.2. Otros conocimientos previos recomendados para cursar la asignatura - Basic knowledge about knowledge representation techniques - Basic knowledge about Web technologies - Basic knowledge about database modelling 4. Competencias y resultados de aprendizaje 4.1. Competencias CE12 - Capacidad para aplicar métodos matemáticos, estadísticos y de inteligencia artificial para modelar, diseñar y desarrollar aplicaciones, servicios, sistemas inteligentes y sistemas basados en el conocimiento. CG8 - Comprensión amplia de las técnicas y métodos aplicables en una especialización concreta, así como de sus límites CG9 - Apreciación de los límites del conocimiento actual y de la aplicación práctica de la tecnología más reciente BORRADOR"
        ],
        "source_document": "Datos Abiertos y Grafos de Conocimiento.pdf",
        "chunk_id": "Curso 2023:2024_Master Universitario en Ingenieria Informatica_Datos Abiertos y Grafos de Conocimiento.pdf_ch_4",
        "question_type": "factual",
        "topic": "plan_de_estudios",
        "difficulty": "easy",
        "chunk_metadata": {
            "source": "Datos Abiertos y Grafos de Conocimiento.pdf",
            "chunk_index": 4,
            "degree": "Master Universitario en Ingenieria Informatica",
            "course": "Curso 2023:2024",
            "category": "Máster"
        }
    },
    {
        "sample_id": "57",
        "generation_method": "llm_generated",
        "language": "es",
        "question": "¿Cuáles son las competencias y resultados de aprendizaje del Master Universitario en Inteligencia Artificial?",
        "answer": "",
        "ground_truth": "Aprendizaje autodirigido o autónomo, aplicación de conocimientos en entornos nuevos, comunicación de conclusiones a públicos especializados y no especializados, interpretación de modelos de clasificación supervisada y no supervisada, comprensión de técnicas y métodos aplicables en la especialización, apreciación de los límites del conocimiento actual, capacidad de trabajar y comunicarse en contextos internacionales y adquisición de conocimientos científicos avanzados.",
        "contexts": [],
        "reference_contexts": [
            "[Curso 2023:2024 - Master Universitario en Inteligencia Artificial - Redes Bayesianas.pdf]\n3. Competencias y resultados de aprendizaje\n3.1. Competencias CB10 - Que los estudiantes posean las habilidades de aprendizaje que les permitan continuar estudiando de un modo que habrá de ser en gran medida autodirigido o autónomo. CB7 - Que los estudiantes sepan aplicar los conocimientos adquiridos y su capacidad de resolución de problemas en entornos nuevos o poco conocidos dentro de contextos más amplios (o multidisciplinares) relacionados con su área de estudio CB9  -  Que  los  estudiantes  sepan  comunicar  sus  conclusiones  y  los  conocimientos  y  razones  últimas  que  las sustentan a públicos especializados y no especializados de un modo claro y sin ambigüedades CEIA4 - Capacidad de interpretar los modelos de clasificación supervisada y no supervisada obtenidos al aplicar las técnicas de Aprendizaje Automático para un conjunto de datos. CG12 - Comprensión amplia de las técnicas y métodos aplicables en una especialización concreta, así como de sus límites. CG13 - Apreciación de los límites del conocimiento actual y de la aplicación práctica de la tecnología más reciente. CG18 - Capacidad de trabajar y comunicarse también en contextos internacionales CGI1 - Adquirir conocimientos científicos avanzados del campo de la informática que le permitan generar nuevas ideas dentro de una línea de investigación. BORRADOR\nCGI2 - Comprender el procedimiento, valor y límites del método científico en el campo de la Informática, siendo capaz  de  identificar,  localizar  y  obtener  datos  requeridos  en  un  trabajo  de  investigación,  de  diseñar  y  guiar investigaciones  analíticas,  de  modelado  y  experimentales,  así  como  de  evaluar  datos  de  una  manera  crítica  y extraer conclusiones.\nCGI3 - Capacidad para valorar la importancia de las fuentes documentales, manejarlas y buscar la información para el desarrollo de cualquier trabajo de investigación.\nCGI4 - Capacidad de leer y comprender publicaciones dentro de su ámbito de estudio/investigación, así como su catalogación y valor científico."
        ],
        "source_document": "Redes Bayesianas.pdf",
        "chunk_id": "Curso 2023:2024_Master Universitario en Inteligencia Artificial_Redes Bayesianas.pdf_ch_4",
        "question_type": "factual",
        "topic": "plan_de_estudios",
        "difficulty": "easy",
        "chunk_metadata": {
            "course": "Curso 2023:2024",
            "degree": "Master Universitario en Inteligencia Artificial",
            "chunk_index": 4,
            "source": "Redes Bayesianas.pdf",
            "category": "Máster"
        }
    },
    {
        "sample_id": "58",
        "generation_method": "llm_generated",
        "language": "es",
        "question": "¿Cuántas horas dura la actividad de Realización de la parte 2ª Práctica?",
        "answer": "",
        "ground_truth": "La duración de la actividad de Realización de la parte 2ª Práctica es de 2.5 horas.",
        "contexts": [],
        "reference_contexts": [
            "[Curso 2021:2022 - Master Universitario en Ingenieria Informstica - Mineria de Modelos para la Toma de Decisiones.pdf]\n5.1. Cronograma de la asignatura *\n\n1, Actividad presencial en aula = Explicación del Tema 1, (2.0 h) Duración: 02:00 LM: Actividad del tipo Lección Magistral. 1, Actividad presencial en laboratorio = Realización parte 1ª Práctica (2.5 h) Duración: 02:30 AC: Actividad del tipo Acciones Cooperativas. 1, Actividades de evaluación = . 2, Actividad presencial en aula = Explicación del Tema 2, (2.0 h) Duración: 02:00 LM: Actividad del tipo Lección Magistral. 2, Actividad presencial en laboratorio = Realización parte 1ª Práctica (25 h) Duración: 02:30 AC: Actividad del tipo Acciones Cooperativas. 2, Actividades de evaluación = . 3, Actividad presencial en aula = Explicación del Tema 3, (2.0 h) Duración: 02:00 LM: Actividad del tipo Lección Magistral. 3, Actividad presencial en laboratorio = Realización parte 2ª Práctica (2.5 h) Duración: 02:30 AC: Actividad del tipo Acciones Cooperativas BORRADOR. 3, Actividades de evaluación = . 4, Actividad presencial en aula = Explicación del Tema 3, (2.0 h) Duración: 02:00 LM: Actividad del tipo Lección Magistral. 4, Actividad presencial en laboratorio = Realización parte 2ª Práctica (2.5 h) Duración: 02:30 AC: Actividad del tipo Acciones Cooperativas. 4, Actividades de evaluación = . 5, Actividad presencial en aula = Explicación del Tema 4, (2.0 h) Duración: 02:00 LM: Actividad del tipo Lección Magistral. 5, Actividad presencial en laboratorio = Realización parte 2ª Práctica (1.5 h) Duración: 01:30 AC: Actividad del tipo Acciones Cooperativas. 5, Actividades de evaluación = . 6, Actividad presencial en aula = Explicación del Tema 4, (2.0 h) Duración: 02:00 AC: Actividad del tipo Acciones Cooperativas. 6, Actividad presencial en laboratorio = Realización parte 3ª Práctica (25 h) Duración: 02:30 AC:"
        ],
        "source_document": "Mineria de Modelos para la Toma de Decisiones.pdf",
        "chunk_id": "Curso 2021:2022_Master Universitario en Ingenieria Informstica_Mineria de Modelos para la Toma de Decisiones.pdf_ch_7",
        "question_type": "factual",
        "topic": "plan_de_estudios",
        "difficulty": "easy",
        "chunk_metadata": {
            "source": "Mineria de Modelos para la Toma de Decisiones.pdf",
            "chunk_index": 7,
            "course": "Curso 2021:2022",
            "degree": "Master Universitario en Ingenieria Informstica",
            "category": "Máster"
        }
    },
    {
        "sample_id": "59",
        "generation_method": "llm_generated",
        "language": "es",
        "question": "Cuántas prácticas grupales se evalúan en la asignatura Redes Bayesianas del Master Universitario en Inteligencia Artificial?",
        "answer": "",
        "ground_truth": "La asignatura se evalúa mediante dos prácticas grupales con peso del 30% cada una y un examen final del 40%.",
        "contexts": [],
        "reference_contexts": [
            "[Curso 2023:2024 - Master Universitario en Inteligencia Artificial - Redes Bayesianas.pdf]\nPROCESO DE COORDINACIÓN DE LAS ENSEÑANZAS PR/CL/001\nANX-PR/CL/001-01 UÍA DE APRENDIZAJE ASI NATURA 103000359 - Redes Bayesianas PLAN DE ESTUDIOS 10AJ - Master Universitario En Inteligencia Artificial CURSO ACADÉMICO Y SEMESTRE 2023/24 - Primer semestre BORRADOR"
        ],
        "source_document": "Redes Bayesianas.pdf",
        "chunk_id": "Curso 2023:2024_Master Universitario en Inteligencia Artificial_Redes Bayesianas.pdf_ch_0",
        "question_type": "factual",
        "topic": "plan_de_estudios",
        "difficulty": "easy",
        "chunk_metadata": {
            "course": "Curso 2023:2024",
            "category": "Máster",
            "chunk_index": 0,
            "degree": "Master Universitario en Inteligencia Artificial",
            "source": "Redes Bayesianas.pdf"
        }
    },
    {
        "sample_id": "60",
        "generation_method": "llm_generated",
        "language": "es",
        "question": "Describe el procedimiento para la evaluación continua del curso 2020-2021, específicamente en cuanto a la nota mínima y las competencias evaluadas.",
        "answer": "",
        "ground_truth": "La evaluación continua tiene una nota mínima de 4/10 y evalúa las competencias 10II-CE03/04, 10II-CE13/18, 10II-CE02 y 10II-CE01.",
        "contexts": [],
        "reference_contexts": [
            "[Curso 2020:2021 - Doble grado Ingeniería Informática y ADE - Lenguajes Formales Autómatas y Computabilidad.pdf]\n6.1.1. Evaluación continua\n Nota mínima = 4 / 10. 17, Competencias evaluadas = 10II-CE03/04 10II-CE13/18 10II-CE02 10II-CE01. 17, Descripción = Recuperación EVAL2. 17, Modalidad = EX: Técnica del tipo Examen Escrito. 17, Tipo = Presencial. 17, Duración = 01:00. 17, Peso en la nota = %. 17, Nota mínima = 4 / 10. 17, Competencias evaluadas = 10II-CE13/18 10II-CE02 10II-CE03/04 10II-CE01\nBORRADOR"
        ],
        "source_document": "Lenguajes Formales Autómatas y Computabilidad.pdf",
        "chunk_id": "Curso 2020:2021_Doble grado Ingeniería Informática y ADE_Lenguajes Formales Autómatas y Computabilidad.pdf_ch_13",
        "question_type": "procedural",
        "topic": "plan_de_estudios",
        "difficulty": "medium",
        "chunk_metadata": {
            "category": "Grado",
            "course": "Curso 2020:2021",
            "degree": "Doble grado Ingeniería Informática y ADE",
            "chunk_index": 13,
            "source": "Lenguajes Formales Autómatas y Computabilidad.pdf"
        }
    },
    {
        "sample_id": "61",
        "generation_method": "llm_generated",
        "language": "es",
        "question": "¿Cuánto dura la actividad de explicación del Tema 1: Metaheurísticas?",
        "answer": "",
        "ground_truth": "La actividad de explicación del Tema 1: Metaheurísticas dura 03:00 horas.",
        "contexts": [],
        "reference_contexts": [
            "[Curso 2021:2022 - Master Universitario en Ingenieria Informstica - Soft Computing.pdf]\n5.1. Cronograma de la asignatura *\n\n Duración: 03:00 LM: Actividad del tipo Lección Magistral. 6, Actividad presencial en laboratorio = . 6, Tele-enseñanza = Explicación de los contenidos del Tema 1: Metaheurísticas Duración: 03:00 LM: Actividad del tipo Lección Magistral. 6, Actividades de evaluación = Entrega de la práctica del Tema 1: Metaheurísticas TG: Técnica del tipo Trabajo en Grupo Evaluación continua No presencial Duración: 00:00 BORRADOR. 7, Actividad presencial en aula = Explicación de los contenidos del Tema 2: Sistemas avanzados de planificación Duración: 03:00 LM: Actividad del tipo Lección Magistral. 7, Actividad presencial en laboratorio = . 7, Tele-enseñanza = Explicación de los contenidos del Tema 2: Sistemas avanzados de planificación Duración: 03:00 LM: Actividad del tipo Lección Magistral. 7, Actividades de evaluación = . 8, Actividad presencial en aula = Explicación de los contenidos del Tema 2: Sistemas avanzados de planificación Duración: 03:00 LM: Actividad del tipo Lección Magistral. 8, Actividad presencial en laboratorio = . 8, Tele-enseñanza = Explicación de los contenidos del Tema 2: Sistemas avanzados de planificación Duración: 03:00 LM: Actividad del tipo Lección Magistral. 8, Actividades de evaluación = . 9, Actividad presencial en aula = Explicación de los contenidos del Tema 2: Sistemas avanzados de planificación Duración: 03:00 LM: Actividad del tipo Lección Magistral. 9, Actividad presencial en laboratorio = . 9, Tele-enseñanza = Explicación de los contenidos del Tema 2: Sistemas avanzados de planificación Duración: 03:00 LM: Actividad del tipo Lección Magistral. 9, Actividades de evaluación = . 10, Actividad presencial en aula = Explicación de los contenidos del Tema 2: Sistemas avanzados de planificación Duración: 03:00 LM: Actividad del tipo Lección Magistral. 10, Actividad presencial en laboratorio = . 10, Tele-enseñanza = Explicación de los contenidos del"
        ],
        "source_document": "Soft Computing.pdf",
        "chunk_id": "Curso 2021:2022_Master Universitario en Ingenieria Informstica_Soft Computing.pdf_ch_9",
        "question_type": "factual",
        "topic": "plan_de_estudios",
        "difficulty": "easy",
        "chunk_metadata": {
            "course": "Curso 2021:2022",
            "chunk_index": 9,
            "category": "Máster",
            "degree": "Master Universitario en Ingenieria Informstica",
            "source": "Soft Computing.pdf"
        }
    },
    {
        "sample_id": "62",
        "generation_method": "llm_generated",
        "language": "es",
        "question": "",
        "answer": "",
        "ground_truth": "out_of_scope",
        "contexts": [],
        "reference_contexts": [],
        "source_document": "N/A",
        "chunk_id": "N/A",
        "question_type": "",
        "topic": "otros",
        "difficulty": "easy",
        "chunk_metadata": {
            "category": "Máster",
            "chunk_index": 2,
            "source": "Mineria de Modelos para la Toma de Decisiones.pdf",
            "course": "Curso 2021:2022",
            "degree": "Master Universitario en Ingenieria Informstica"
        }
    },
    {
        "sample_id": "63",
        "generation_method": "llm_generated",
        "language": "es",
        "question": "",
        "answer": "",
        "ground_truth": "",
        "contexts": [],
        "reference_contexts": [
            "[Curso 2021:2022 - Grado en Matematicas e Informatica - Inteligencia Artificial ML.pdf]\n7.2. Criterios de evaluación\nSe ofrecen tres opciones:\n1.- Evaluación continua. Bajo esta modalidad, los alumnos realizarán tres pruebas de evaluación:\n1.1.- Un examen escrito que cubre los contenidos de los temas 1, 2, 3 y 4 en el tramo horario destinado a las\nActividades de Evaluación, Se realizará, aproximadamente, en la semana 12, aunque queda a criterio de Comisión\nde Coordinación que planifica estas actividades. Este examen se evalúa sobre un total máximo de 3 puntos (NO\nSIENDO NECESARIO OBTENER UNA NOTA MÍNIMA EN ESTE EXAMEN).\n1.2.- Los alumnos realizarán una práctica en grupo correspondiente al tema 5, que será presentada en la semana\n16. Este trabajo en grupo se evalúa sobre un total máximo de 4 puntos. Para superar esta prueba, los alumnos\ndeben obtener, al menos, una calificación de 0.5 puntos sobre el total de 4 (ó 1.25 sobre 10).\n1.3.- Coincidiendo con la actividad de evaluación de la modalidad \"solo prueba final\" de la asignatura, se realizará\nun examen que cubre los contenidos de los temas 6 y 7. Este examen se evalúa sobre un total máximo de 3\npuntos, debiendo el alumno conseguir, al menos, una calificación de 0.5 puntos sobre el total de 3 (ó 1.67 sobre\n10).\nEn el caso de que un alumno no supere las mínimas establecidas, tanto para la práctica, como para los temas 6 y\n7, el alumno obtendrá una puntuación máxima de 4 puntos sobre 10 (suspenso) en la asignatura.\nBORRADOR\nPara poder superar la asignatura bajo esta modalidad de evaluación, es necesario obtener una puntuación mayor\no igual a 5 puntos como resultado de la suma de las calificaciones obtenidas en el examen de los temas 1-4, la\npráctica en grupo y, el examen de los temas 6 y 7, (siempre que se superen las notas mínimas establecidas para\nla práctica y el examen escrito de los temas 6 y 7).\n2.- Evaluación bajo el sistema de \"solo prueba final\". Esta modalidad de evaluación es excluyente con respecto a\nla  anterior.  Para  poder  optar  por  este  sistema  de  evaluación,  el  alumno  debe  comunicarlo  al  coordinador  de  la"
        ],
        "source_document": "Inteligencia Artificial ML.pdf",
        "chunk_id": "Curso 2021:2022_Grado en Matematicas e Informatica_Inteligencia Artificial ML.pdf_ch_15",
        "question_type": "factual",
        "topic": "tfm",
        "difficulty": "easy",
        "chunk_metadata": {
            "course": "Curso 2021:2022",
            "category": "Grado",
            "chunk_index": 15,
            "degree": "Grado en Matematicas e Informatica",
            "source": "Inteligencia Artificial ML.pdf"
        }
    },
    {
        "sample_id": "64",
        "generation_method": "llm_generated",
        "language": "es",
        "question": "¿Qué tipo de recurso es Investigación Operativa: Ejercicios y Aplicaciones?",
        "answer": "",
        "ground_truth": "Los recursos mencionados son libros de texto.",
        "contexts": [],
        "reference_contexts": [
            "[Curso 2020:2021 - Grado en Matemática e Informática (ML) - Investigacion Operativa.pdf]\n8.1. Recursos didácticos de la asignatura\n\nA. Mateos, S. Ríos Insua, A. Jiménez y Ángel J. Fernández, Investigación Operativa: Ejercicios y Aplicaciones, Fundación General de la Universidad Politécnica de Madrid, 2006., Tipo = Bibliografía. A. Mateos, S. Ríos Insua, A. Jiménez y Ángel J. Fernández, Investigación Operativa: Ejercicios y Aplicaciones, Fundación General de la Universidad Politécnica de Madrid, 2006., Observaciones = BORRADOR. S. Ríos Insua, A. Mateos, C. Bielza y A. Jiménez (2004), Investigación Operativa: Modelos Determinísticos y Estocásticos, Centro de Estudios Ramón Areces, Madrid., Tipo = Bibliografía. S. Ríos Insua, A. Mateos, C. Bielza y A. Jiménez (2004), Investigación Operativa: Modelos Determinísticos y Estocásticos, Centro de Estudios Ramón Areces, Madrid., Observaciones = . S. Ríos Insua, D. Ríos Insua, A. Mateos, J. Martín y A. Jiménez (2006), Problemas de Investigación Operativa: Programación Lineal y Extensiones, RA-MA., Tipo = Bibliografía. S. Ríos Insua, D. Ríos Insua, A. Mateos, J. Martín y A. Jiménez (2006), Problemas de Investigación Operativa: Programación Lineal y Extensiones, RA-MA., Observaciones = . Kaufmann, A. (1972), Métodos y Modelos de Investigación de Operaciones, Vol. I, II y III, CECSA, México., Tipo = Bibliografía. Kaufmann, A. (1972), Métodos y Modelos de Investigación de Operaciones, Vol. I, II y III, CECSA, México., Observaciones = . H.A. Taha (2004), Investigación de Operaciones, Prentice Hall, México., Tipo = Bibliografía. H.A. Taha (2004), Investigación de Operaciones, Prentice Hall, México., Observaciones = . WinQSB (1998) Decision Support Software for MS/OM, Yih-Long Chang, Wiley, New York., Tipo = Bibliografía. WinQSB (1998) Decision Support Software for MS/OM, Yih-Long Chang, Wiley, New York., Observaciones = . Sitio Moodle de la asignatura, Tipo = Recursos web. Sitio Moodle"
        ],
        "source_document": "Investigacion Operativa.pdf",
        "chunk_id": "Curso 2020:2021_Grado en Matemática e Informática (ML)_Investigacion Operativa.pdf_ch_18",
        "question_type": "factual",
        "topic": "otros",
        "difficulty": "easy",
        "chunk_metadata": {
            "category": "Grado",
            "degree": "Grado en Matemática e Informática (ML)",
            "source": "Investigacion Operativa.pdf",
            "chunk_index": 18,
            "course": "Curso 2020:2021"
        }
    },
    {
        "sample_id": "65",
        "generation_method": "llm_generated",
        "language": "es",
        "question": "¿Cómo se representan las redes neuronales en la asignatura?",
        "answer": "",
        "ground_truth": "La representación de las redes neuronales en la asignatura se hace mediante técnicas específicas que se describen en el tema 2.",
        "contexts": [],
        "reference_contexts": [
            "[Curso 2022:2023 - Master Universitario en Ciencia de Datos itinerario Health - Intelligent Systems.pdf]\n4.2. Temario de la asignatura\n1. Intelligent systems\n2. 1.1. General characterization of intelligent systems\n3. 1.2. Knowledge representation and reasoning\n2. Neural networks\n5. 2.1. Representing neural networks\n6. 2.2. Training neural networks\n3. Ontology engineering\n8. 3.1. Ontologies and ontology design patterns\n9. 3.2. How to develop ontologies\n4. Natural language processing\n11. 4.1. Corpus creation\n12. 4.2. Classic NLP techniques\n13. 4.3. Neural NLP techniques\nBORRADOR"
        ],
        "source_document": "Intelligent Systems.pdf",
        "chunk_id": "Curso 2022:2023_Master Universitario en Ciencia de Datos itinerario Health_Intelligent Systems.pdf_ch_5",
        "question_type": "factual",
        "topic": "tfm",
        "difficulty": "medium",
        "chunk_metadata": {
            "course": "Curso 2022:2023",
            "chunk_index": 5,
            "source": "Intelligent Systems.pdf",
            "category": "Máster",
            "degree": "Master Universitario en Ciencia de Datos itinerario Health"
        }
    },
    {
        "sample_id": "66",
        "generation_method": "llm_generated",
        "language": "es",
        "question": "¿Qué requisito adicional debe cumplir el estudiante para aprobar la asignatura en convocatoria extraordinaria?",
        "answer": "",
        "ground_truth": "out_of_scope",
        "contexts": [],
        "reference_contexts": [],
        "source_document": "N/A",
        "chunk_id": "N/A",
        "question_type": "out_of_scope",
        "topic": "otros",
        "difficulty": "medium",
        "chunk_metadata": {
            "course": "Curso 2024:2025",
            "chunk_index": 12,
            "degree": "Doble Grado en Ingenieria Informática + ADE",
            "source": "Inteligencia Artificial.pdf",
            "category": "Grado"
        }
    },
    {
        "sample_id": "67",
        "generation_method": "llm_generated",
        "language": "es",
        "question": "¿Cuál es el peso del examen final en la evaluación de esta asignatura?",
        "answer": "",
        "ground_truth": "La asignatura se evalúa mediante dos prácticas grupales con peso del 30% cada una y un examen final del 40%.",
        "contexts": [],
        "reference_contexts": [
            "[Curso 2020:2021 - Doble grado Ingeniería Informática y ADE - Programación Declarativa, Lógica y Restricciones.pdf]\nGuía de Aprendizaje\n1. Datos descriptivos....................................................................................................................................................1 = 2. Profesorado.............................................................................................................................................................1. 1. Datos descriptivos....................................................................................................................................................1 = 3. Conocimientos previos recomendados.....................................................................................................................2. 1. Datos descriptivos....................................................................................................................................................1 = 4. Competencias y resultados de aprendizaje..............................................................................................................2. 1. Datos descriptivos....................................................................................................................................................1 = 5. Descripción de la asignatura y temario.....................................................................................................................3. 1. Datos descriptivos....................................................................................................................................................1 = 6. Cronograma.............................................................................................................................................................5. 1. Datos descriptivos....................................................................................................................................................1 = 7. Actividades y criterios de evaluación........................................................................................................................7. 1. Datos descriptivos....................................................................................................................................................1 = 8. Recursos didácticos.................................................................................................................................................9\nBORRADOR"
        ],
        "source_document": "Programación Declarativa, Lógica y Restricciones.pdf",
        "chunk_id": "Curso 2020:2021_Doble grado Ingeniería Informática y ADE_Programación Declarativa, Lógica y Restricciones.pdf_ch_1",
        "question_type": "factual",
        "topic": "plan_de_estudios",
        "difficulty": "easy",
        "chunk_metadata": {
            "degree": "Doble grado Ingeniería Informática y ADE",
            "category": "Grado",
            "source": "Programación Declarativa, Lógica y Restricciones.pdf",
            "course": "Curso 2020:2021",
            "chunk_index": 1
        }
    },
    {
        "sample_id": "68",
        "generation_method": "llm_generated",
        "language": "es",
        "question": "¿Qué modalidades se utilizan para evaluar a los estudiantes?",
        "answer": "",
        "ground_truth": "Se evalúan mediante examen escrito presencial y presentación en grupo presencial.",
        "contexts": [],
        "reference_contexts": [
            "[Curso 2021:2022 - Grado en Ciencia de Datos e Inteligencia Artificial - Computacion Social y Personalizacion.pdf]\n6.1.1. Evaluación continua\n16, Descripción = Evaluación examen. 16, Modalidad = EX: Técnica del tipo Examen Escrito. 16, Tipo = Presencial. 16, Duración = 02:00. 16, Peso en la nota = 40%. 16, Nota mínima = 3 / 10. 16, Competencias evaluadas = CB05 CB04 CB01 CG04 CG06 CG07 CE13 CE17 CE14. 16, Descripción = Evaluación en clase. Trabajo práctico.. 16, Modalidad = PG: Técnica del tipo Presentación en Grupo. 16, Tipo = Presencial. 16, Duración = 02:00. 16, Peso en la nota = 60%. 16, Nota mínima = 3 / 10. 16, Competencias evaluadas = CE11 CE20 CB03 CG01 CB02 CG04 CG02 CG06 CG07 CE13 CE17 CE14"
        ],
        "source_document": "Computacion Social y Personalizacion.pdf",
        "chunk_id": "Curso 2021:2022_Grado en Ciencia de Datos e Inteligencia Artificial_Computacion Social y Personalizacion.pdf_ch_10",
        "question_type": "ambiguous",
        "topic": "profesorado",
        "difficulty": "easy",
        "chunk_metadata": {
            "chunk_index": 10,
            "category": "Grado",
            "course": "Curso 2021:2022",
            "source": "Computacion Social y Personalizacion.pdf",
            "degree": "Grado en Ciencia de Datos e Inteligencia Artificial"
        }
    },
    {
        "sample_id": "69",
        "generation_method": "llm_generated",
        "language": "es",
        "question": "¿Cuántos alumnos forman un grupo de prácticas?",
        "answer": "",
        "ground_truth": "La práctica se realizará en grupos de 4 alumnos.",
        "contexts": [],
        "reference_contexts": [
            "[Curso 2021:2022 - Grado en Ciencia de Datos e Inteligencia Artificial - Probabildiades y Estadistica II.pdf]\n7.2. Criterios de evaluación\nUniversidad Politécnica de Madrid, podrá iniciar el procedimiento disciplinario correspondiente.\nLa práctica se realizará en grupos de 4 alumnos, según el guión que será proporcionado por los profesores. El\ninforme  práctico,  correspondiente  a  las  unidades  didácticas  1  y  2,  será  entregado  en  la  fecha  publicada  en  el\nMoodle a través de la Politécnica Virtual. Para la convocatoria extraordinaria de Julio, la fecha de entrega será la\ndel  examen. El informe se calificará como APTO o NO APTO, siendo imprescindible superarlo para aprobar la\nasignatura. Los criterios para superar la práctica serán fijados por el profesor correspondiente.\nTeoría En  los  exámenes  de  problemas  podrán  utilizarse  unos  formularios  proporcionados  por  los  profesores  de  la asignatura,  que  los  alumnos  ya  habrán  manejado.  La  calificación  será  la  media  ponderada  de  las  pruebas realizadas según los pesos especificados en la tabla de evaluación sumativa. Para realizar esa media ponderada se deberá obtener una nota mayor o igual que 3 en cada una de las partes. Las soluciones de cada examen se publicarán en el Moodle junto con las calificaciones de los alumnos. Informe práctico BORRADOR\nLos alumnos que quieran formar un grupo de prácticas deberán apuntarse a un grupo antes de la fecha publicada\nen el Moodle, a través de la tarea correspondiente habilitada en el Moodle de la asignatura. En el caso de que\nhaya grupos incompletos el profesor podrá juntar grupos, en cuyo caso el profesor informará a los alumnos para\nque se pongan en contacto. Los alumnos que no se hayan apuntado a un grupo antes de la fecha fijada no podrán\nrealizar la práctica hasta la convocatoria de Julio. La recogida de datos se hará a través del Moodle.\nLos grupos que se detecte que se hayan copiado entre sí, deberán repetir las prácticas con otros datos diferentes.\nAdemás, se comunicará al equipo Directivo del centro, que, según los estatutos de la Universidad Politécnica de\nMadrid, podrá iniciar el procedimiento disciplinario correspondiente."
        ],
        "source_document": "Probabildiades y Estadistica II.pdf",
        "chunk_id": "Curso 2021:2022_Grado en Ciencia de Datos e Inteligencia Artificial_Probabildiades y Estadistica II.pdf_ch_15",
        "question_type": "factual",
        "topic": "matricula",
        "difficulty": "medium",
        "chunk_metadata": {
            "source": "Probabildiades y Estadistica II.pdf",
            "category": "Grado",
            "chunk_index": 15,
            "degree": "Grado en Ciencia de Datos e Inteligencia Artificial",
            "course": "Curso 2021:2022"
        }
    },
    {
        "sample_id": "70",
        "generation_method": "llm_generated",
        "language": "es",
        "question": "¿Qué tipo de habilidad se espera que los estudiantes desarrollen en el campo de la inteligencia artificial?",
        "answer": "",
        "ground_truth": "out_of_scope",
        "contexts": [],
        "reference_contexts": [],
        "source_document": "N/A",
        "chunk_id": "N/A",
        "question_type": "out_of_scope",
        "topic": "otros",
        "difficulty": "hard",
        "chunk_metadata": {
            "degree": "Master Universitario en Inteligencia Artificial",
            "chunk_index": 4,
            "course": "Curso 2023:2024",
            "category": "Máster",
            "source": "Ciencia de la Web.pdf"
        }
    },
    {
        "sample_id": "71",
        "generation_method": "llm_generated",
        "language": "es",
        "question": "¿Cuál es la duración de este curso?",
        "answer": "",
        "ground_truth": "El curso tiene una duración de 6 ECTS.",
        "contexts": [],
        "reference_contexts": [
            "[Curso 2022:2023 - Grado en Matematicas e Informatica - Investigacion Operativa.pdf]\n1.1. Datos de la asignatura\nNombre de la asignatura, 1 = 105000124 - Investigacion Operativa. No de créditos, 1 = 6 ECTS. Carácter, 1 = Obligatoria. Curso, 1 = Tercero curso. Semestre, 1 = Quinto semestre. Período de impartición, 1 = Septiembre-Enero. Idioma de impartición, 1 = Castellano. Titulación, 1 = 10ML - Grado en Matematicas e Informática. Centro responsable de la titulación, 1 = 10 - Escuela Tecnica Superior De Ingenieros Informaticos. Curso académico, 1 = 2022-23"
        ],
        "source_document": "Investigacion Operativa.pdf",
        "chunk_id": "Curso 2022:2023_Grado en Matematicas e Informatica_Investigacion Operativa.pdf_ch_2",
        "question_type": "factual",
        "topic": "plan_de_estudios",
        "difficulty": "easy",
        "chunk_metadata": {
            "source": "Investigacion Operativa.pdf",
            "degree": "Grado en Matematicas e Informatica",
            "chunk_index": 2,
            "course": "Curso 2022:2023",
            "category": "Grado"
        }
    },
    {
        "sample_id": "72",
        "generation_method": "llm_generated",
        "language": "es",
        "question": "¿Cómo se evalúa la asignatura en el curso 2020-2021?",
        "answer": "",
        "ground_truth": "La asignatura se evalúa mediante dos prácticas grupales con peso del 30% cada una y un examen final del 40%.",
        "contexts": [],
        "reference_contexts": [
            "[Curso 2020:2021 - MU en Ingeniería Informática - Análisis Inteligente de Datos.pdf]\n4.2. Learning outcomes\n1, Face-to-face classroom activities = Module 1: Lecture Duration: 02:00 Lecture. 1, Face-to-face laboratory activities = . 1, Distant / On-line = Module 1: Lecture Duration: 02:00 Lecture. 1, Assessment activities = Individual Study Other assessment Continuous assessment Not Presential Duration: 02:00. 2, Face-to-face classroom activities = Module 1: Lecture Duration: 01:00 Lecture. 2, Face-to-face laboratory activities = Computer Lab. Module 1. Duration: 01:00 Additional activities. 2, Distant / On-line = Module 1: Lecture Duration: 02:00 Lecture. 2, Assessment activities = Individual Study Other assessment Continuous assessment Not Presential Duration: 02:00. 3, Face-to-face classroom activities = . 3, Face-to-face laboratory activities = Computer Lab. Module 1. Duration: 02:00 Additional activities. 3, Distant / On-line = Module 1: Lecture Duration: 02:00 Lecture. 3, Assessment activities = Individual Study Other assessment Continuous assessment Not Presential Duration: 02:00 Work on Homework 1 Other assessment Continuous assessment Not Presential. 4, Face-to-face classroom activities = DRAFT. 4, Face-to-face laboratory activities = Computer Lab. Module 1. Duration: 02:00 Additional activities. 4, Distant / On-line = Module 1: Lecture Duration: 02:00 Lecture. 4, Assessment activities = Individual Study Other assessment Continuous assessment Not Presential Duration: 02:00 Work on Homework 1 Other assessment Continuous assessment Not Presential Duration: 02:30. 5, Face-to-face classroom activities = Module 2: Lecture Duration: 02:00 Lecture. 5, Face-to-face laboratory activities = . 5, Distant / On-line = Module 1: Lecture Duration: 02:00 Lecture. 5, Assessment activities = Individual Study Other assessment Continuous assessment Not Presential Duration: 02:00 Work on Homework 2 Other assessment Continuous assessment Not Presential Duration: 04:30 Upload Homework 1 Group work Continuous assessment Not Presential Duration: 00:00"
        ],
        "source_document": "Análisis Inteligente de Datos.pdf",
        "chunk_id": "Curso 2020:2021_MU en Ingeniería Informática_Análisis Inteligente de Datos.pdf_ch_4",
        "question_type": "procedural",
        "topic": "plan_de_estudios",
        "difficulty": "hard",
        "chunk_metadata": {
            "degree": "MU en Ingeniería Informática",
            "source": "Análisis Inteligente de Datos.pdf",
            "course": "Curso 2020:2021",
            "chunk_index": 4,
            "category": "Máster"
        }
    },
    {
        "sample_id": "73",
        "generation_method": "llm_generated",
        "language": "es",
        "question": "¿Cómo se coordina el proceso de enseñanza en el plan de estudios del Master Universitario en Ingeniería Informática?",
        "answer": "",
        "ground_truth": "El proceso de coordinación de las enseñanzas se realiza mediante la revisión y aprobación del plan de estudios por parte de la comisión académica.",
        "contexts": [],
        "reference_contexts": [
            "[Curso 2022:2023 - Maser Universitario en Ingenieria Informatica - Datos abiertos y grafos de conocimiento.pdf]\nPROCESO DE COORDINACIÓN DE LAS ENSEÑANZAS PR/CL/001\nANX-PR/CL/001-01 UÍA DE APRENDIZAJE ASI NATURA 103000924 - Datos Abiertos Y Grafos De Conocimiento PLAN DE ESTUDIOS 10AN - Master Universitario En Ingenieria Informatica CURSO ACADÉMICO Y SEMESTRE 2022/23 - Primer semestre BORRADOR"
        ],
        "source_document": "Datos abiertos y grafos de conocimiento.pdf",
        "chunk_id": "Curso 2022:2023_Maser Universitario en Ingenieria Informatica_Datos abiertos y grafos de conocimiento.pdf_ch_0",
        "question_type": "procedural",
        "topic": "plan_de_estudios",
        "difficulty": "medium",
        "chunk_metadata": {
            "source": "Datos abiertos y grafos de conocimiento.pdf",
            "degree": "Maser Universitario en Ingenieria Informatica",
            "category": "Grado",
            "chunk_index": 0,
            "course": "Curso 2022:2023"
        }
    },
    {
        "sample_id": "74",
        "generation_method": "llm_generated",
        "language": "es",
        "question": "Comparar los créditos de la asignatura Robots Autónomos con respecto a otras materias del curso.",
        "answer": "",
        "ground_truth": "La asignatura 'Robots Autónomos' tiene 5 ECTS, mientras que otras asignaturas pueden tener diferentes números de créditos según su contenido y complejidad.",
        "contexts": [],
        "reference_contexts": [
            "[Curso 2021:2022 - Master Universitario en Inteligencia Artificial - Robots Autonomos.pdf]\n1.1. Datos de la asignatura\nNombre de la asignatura, 1 = 103000370 - Robots Autonomos. No de créditos, 1 = 5 ECTS. Carácter, 1 = Optativa. Curso, 1 = Primer curso. Semestre, 1 = Primer semestre. Período de impartición, 1 = Septiembre-Enero. Idioma de impartición, 1 = Castellano. Titulación, 1 = 10AJ - Master Universitario en Inteligencia Artificial. Centro responsable de la titulación, 1 = 10 - Escuela Tecnica Superior De Ingenieros Informaticos. Curso académico, 1 = 2021-22"
        ],
        "source_document": "Robots Autonomos.pdf",
        "chunk_id": "Curso 2021:2022_Master Universitario en Inteligencia Artificial_Robots Autonomos.pdf_ch_2",
        "question_type": "comparative",
        "topic": "plan_de_estudios",
        "difficulty": "medium",
        "chunk_metadata": {
            "degree": "Master Universitario en Inteligencia Artificial",
            "source": "Robots Autonomos.pdf",
            "category": "Máster",
            "chunk_index": 2,
            "course": "Curso 2021:2022"
        }
    },
    {
        "sample_id": "75",
        "generation_method": "llm_generated",
        "language": "es",
        "question": "¿Cuál es el método más importante para comunicarse con los estudiantes en la impartición de la asignatura en modo online?",
        "answer": "",
        "ground_truth": "Se utilizarán emails, sistemas de teleconferencia y horarios de tutorías para resolver dudas y responder consultas.",
        "contexts": [],
        "reference_contexts": [
            "[Curso 2020:2021 - Doble grado Ingeniería Informática y ADE - Lenguajes Formales Autómatas y Computabilidad.pdf]\n8. Otra información\n8.1. Otra información sobre la asignatura Para  la  impartición  en  modo  online  de  la  asignatura,  se  hará  uso,  si  así  fuese  necesario,de  todos  los  medios disponibles de la UPM facilitados por el GATE (Moodle, Teams, Zoom, Collaborate, etc) Se responderán emails y se resolverán dudas y se usarán para ello, si es necesario, sistemas de teleconferencia en los horarios de tutorías. BORRADOR"
        ],
        "source_document": "Lenguajes Formales Autómatas y Computabilidad.pdf",
        "chunk_id": "Curso 2020:2021_Doble grado Ingeniería Informática y ADE_Lenguajes Formales Autómatas y Computabilidad.pdf_ch_21",
        "question_type": "comparative",
        "topic": "profesorado",
        "difficulty": "hard",
        "chunk_metadata": {
            "chunk_index": 21,
            "category": "Grado",
            "source": "Lenguajes Formales Autómatas y Computabilidad.pdf",
            "course": "Curso 2020:2021",
            "degree": "Doble grado Ingeniería Informática y ADE"
        }
    },
    {
        "sample_id": "76",
        "generation_method": "llm_generated",
        "language": "es",
        "question": "¿Cómo se evalúa la asignatura Ciencia de la Web en el curso académico 2021-22?",
        "answer": "",
        "ground_truth": "Para evaluar la asignatura Ciencia de la Web, se deben realizar dos prácticas grupales con un peso del 30% cada una y un examen final que contribuye al 40%",
        "contexts": [],
        "reference_contexts": [
            "[Curso 2021:2022 - Master Universitario en Inteligencia Artificial - Ciencia de la Web.pdf]\n1.1. Datos de la asignatura\nNombre de la asignatura, 1 = 103000720 - Ciencia de la Web. No de créditos, 1 = 5 ECTS. Carácter, 1 = Optativa. Curso, 1 = Primer curso. Semestre, 1 = Primer semestre. Período de impartición, 1 = Septiembre-Enero. Idioma de impartición, 1 = Castellano. Titulación, 1 = 10AJ - Master Universitario en Inteligencia Artificial. Centro responsable de la titulación, 1 = 10 - Escuela Tecnica Superior De Ingenieros Informaticos. Curso académico, 1 = 2021-22"
        ],
        "source_document": "Ciencia de la Web.pdf",
        "chunk_id": "Curso 2021:2022_Master Universitario en Inteligencia Artificial_Ciencia de la Web.pdf_ch_2",
        "question_type": "procedural",
        "topic": "tfm",
        "difficulty": "medium",
        "chunk_metadata": {
            "source": "Ciencia de la Web.pdf",
            "course": "Curso 2021:2022",
            "category": "Máster",
            "degree": "Master Universitario en Inteligencia Artificial",
            "chunk_index": 2
        }
    },
    {
        "sample_id": "77",
        "generation_method": "llm_generated",
        "language": "es",
        "question": "¿Cómo se denominan los proyectos prácticos mencionados en la tabla de actividades y criterios de evaluación?",
        "answer": "",
        "ground_truth": "Se refieren a temas específicos o son una tarea general?",
        "contexts": [],
        "reference_contexts": [
            "[Curso 2021:2022 - Master Universitario en Biologia Computacional - Aprendizaje Automatico.pdf]\n5.2. Syllabus\n 02:00\n13, 1 = Ejercicios Duration: 02:00. 14, 1 = Ejercicios Duration: 02:00. 15, 1 = Ejercicios Duration: 02:00. 16, 1 = Ejercicios Duration: 02:00. 17, 1 = \nDepending on the programme study plan, total values will be calculated according to the ECTS credit unit as 26/27 hours of student face-to-face contact and independent study time. * The schedule is based on an a priori planning of the subject; it might be modified during the academic year, especially considering the COVID19 evolution. DRAFT VERSIO\n9, Description = Proyecto práctico tema 3. 9, Modality = . 9, Type = Face-to-face. 9, Duration = 02:00. 9, Weight = 70%. 9, Minimum grade = 5 / 10. 9, Evaluated skills = CE08 CE04 CE01 CG05 CE09 CG02. 12, Description = Proyecto práctico tema 4. 12, Modality = . 12, Type = Face-to-face. 12, Duration = 02:00. 12, Weight = 30%. 12, Minimum grade = 5 / 10. 12, Evaluated skills = CE08 CE04 CE01 CG05 CE09 CG02\n17, Description = Proyecto práctico temas 3 y 4. 17, Type = Face-to-face. 17, Duration = 02:00. 17, Weight = 100%. 17, Minimum grade = 5 / 10. 17, Evaluated skills = CE08 CE04 CE01 CG05 CE09 CG02\nDescription, 1 = Modality. Description, 2 = Type. Description, 3 = Duration. Description, 4 = Weight. Description, 5 = Minimum grade. Description, 6 = Evaluated skills\n7. Activities and assessment criteria 7.1. Assessment activities 7.1.1. Continuous assessment 7.1.2. Final examination 7.1.3. Referred (re-sit) examination Minimum DRAFT VERSIO"
        ],
        "source_document": "Aprendizaje Automatico.pdf",
        "chunk_id": "Curso 2021:2022_Master Universitario en Biologia Computacional_Aprendizaje Automatico.pdf_ch_7",
        "question_type": "ambiguous",
        "topic": "tfm",
        "difficulty": "hard",
        "chunk_metadata": {
            "category": "Máster",
            "degree": "Master Universitario en Biologia Computacional",
            "source": "Aprendizaje Automatico.pdf",
            "chunk_index": 7,
            "course": "Curso 2021:2022"
        }
    },
    {
        "sample_id": "78",
        "generation_method": "llm_generated",
        "language": "es",
        "question": "¿Cuál es la principal diferencia en duración entre las actividades de laboratorio presenciales y distantes durante el módulo 5?",
        "answer": "",
        "ground_truth": "Las actividades de laboratorio presenciales tienen una duración de 02:00 horas, mientras que las distantes también tienen 02:00 horas.",
        "contexts": [],
        "reference_contexts": [
            "[Curso 2020:2021 - Grado en Ingeneiría Informática - Web Semántica Linked Data y Grafos de Conocimiento .pdf]\n4.2. Learning outcomes\n\n1, Face-to-face classroom activities = . 1, Face-to-face laboratory activities = Temas 1.1 y 1.2 Duration: 02:00 Laboratory assignments Tema 2.1 Duration: 02:00 Laboratory assignments. 1, Distant / On-line = Temas 1.1 y 1.2 Duration: 02:00 Laboratory assignments Tema 2.1 Duration: 02:00 Laboratory assignments. 1, Assessment activities = . 2, Face-to-face classroom activities = . 2, Face-to-face laboratory activities = Tema 2.2 Duration: 02:00 Laboratory assignments Tema 2.2 Duration: 02:00 Laboratory assignments. 2, Distant / On-line = Tema 2.2 Duration: 02:00 Laboratory assignments Tema 2.2 Duration: 02:00 Laboratory assignments. 2, Assessment activities = . 3, Face-to-face classroom activities = . 3, Face-to-face laboratory activities = Tema 2.3 Duration: 02:00 Laboratory assignments Tema 2.4 Duration: 02:00. 3, Distant / On-line = Tema 2.3 Duration: 02:00 Laboratory assignments Tema 2.4 Duration: 02:00. 3, Assessment activities = Test sobre SPARQL / SPARQL test Problem-solving test Continuous assessment Not Presential Duration: 01:00. 4, Face-to-face classroom activities = . 4, Face-to-face laboratory activities = Tema 2.4 Duration: 02:00 Laboratory assignments Tema 2.4 Duration: 02:00 Laboratory assignments. 4, Distant / On-line = Tema 2.4 Duration: 02:00 Laboratory assignments Tema 2.4 Duration: 02:00 Laboratory assignments. 4, Assessment activities = . 5, Face-to-face classroom activities = DRAFT. 5, Face-to-face laboratory activities = Tema 2.4 Duration: 02:00 Laboratory assignments Tema 2.4 Duration: 02:00 Laboratory assignments. 5, Distant / On-line = Tema 2.4 Duration: 02:00 Laboratory assignments Tema 2.4 Duration: 02:00 Laboratory assignments. 5, Assessment activities = Creación y publicación de datos a partir de fuentes de datos heterogéneas / Creation and publication of Linked Data and knowledge graphs from heterogeneous data sources Group work Continuous assessment Not Presential Duration: 15:00. 6, Face-to-face classroom activities = . 6,"
        ],
        "source_document": "Web Semántica Linked Data y Grafos de Conocimiento .pdf",
        "chunk_id": "Curso 2020:2021_Grado en Ingeneiría Informática_Web Semántica Linked Data y Grafos de Conocimiento .pdf_ch_5",
        "question_type": "comparative",
        "topic": "plan_de_estudios",
        "difficulty": "medium",
        "chunk_metadata": {
            "degree": "Grado en Ingeneiría Informática",
            "category": "Grado",
            "source": "Web Semántica Linked Data y Grafos de Conocimiento .pdf",
            "course": "Curso 2020:2021",
            "chunk_index": 5
        }
    },
    {
        "sample_id": "79",
        "generation_method": "llm_generated",
        "language": "es",
        "question": "¿Qué es el correo electrónico del coordinador/a de la asignatura?",
        "answer": "",
        "ground_truth": "El correo electrónico del coordinador/a es oscar.corcho@upm.es.",
        "contexts": [],
        "reference_contexts": [
            "[Curso 2023:2024 - Grado en Ciencia de Datos e Inteligencia Artificial - Inteligencia Artificial y Ciencia Abierta en Ingenieria de Software Cientifico.pdf]\n2.1. Profesorado implicado en la docencia\nOscar Corcho Garcia (Coordinador/a), Despacho = . Oscar Corcho Garcia (Coordinador/a), Correo electrónico = oscar.corcho@upm.es. Oscar Corcho Garcia (Coordinador/a), Horario de tutorías * = - -\nBORRADOR\n* Las horas de tutoría son orientativas y pueden sufrir modificaciones. Se deberá confirmar los horarios de tutorías con el profesorado."
        ],
        "source_document": "Inteligencia Artificial y Ciencia Abierta en Ingenieria de Software Cientifico.pdf",
        "chunk_id": "Curso 2023:2024_Grado en Ciencia de Datos e Inteligencia Artificial_Inteligencia Artificial y Ciencia Abierta en Ingenieria de Software Cientifico.pdf_ch_3",
        "question_type": "factual",
        "topic": "profesorado",
        "difficulty": "easy",
        "chunk_metadata": {
            "source": "Inteligencia Artificial y Ciencia Abierta en Ingenieria de Software Cientifico.pdf",
            "degree": "Grado en Ciencia de Datos e Inteligencia Artificial",
            "category": "Grado",
            "chunk_index": 3,
            "course": "Curso 2023:2024"
        }
    },
    {
        "sample_id": "80",
        "generation_method": "llm_generated",
        "language": "es",
        "question": "¿Qué actividades se consideran fundamentales para el aprendizaje efectivo en esta asignatura?",
        "answer": "",
        "ground_truth": "Las prácticas grupales y el examen final desempeñan un papel crucial en la evaluación de los estudiantes.",
        "contexts": [],
        "reference_contexts": [
            "[Curso 2022:2023 - Grado en Ciencia de Datos e Inteligencia Artificial - Inteligencia Artifificial.pdf]\n6.1. Cronograma de la asignatura *\n Magistral. 9, Actividad presencial en laboratorio = . 9, Actividades de evaluación = . 10, Actividad presencial en aula = Temas 3 y 4. Teoría y ejercicios Duración: 04:00 LM: Actividad del tipo Lección Magistral. 10, Actividad presencial en laboratorio = . 10, Actividades de evaluación = . 11, Actividad presencial en aula = Tema 4. Teoría y ejercicios Duración: 04:00 LM: Actividad del tipo Lección Magistral. 11, Actividad presencial en laboratorio = . 11, Actividades de evaluación = . 12, Actividad presencial en aula = Tema 4 . Teoría y ejercicios Duración: 04:00 LM: Actividad del tipo Lección Magistral. 12, Actividad presencial en laboratorio = . 12, Actividades de evaluación = . 13, Actividad presencial en aula = Tema 5. Teoría y ejercicios Duración: 04:00 LM: Actividad del tipo Lección Magistral. 13, Actividad presencial en laboratorio = . 13, Actividades de evaluación = "
        ],
        "source_document": "Inteligencia Artifificial.pdf",
        "chunk_id": "Curso 2022:2023_Grado en Ciencia de Datos e Inteligencia Artificial_Inteligencia Artifificial.pdf_ch_9",
        "question_type": "ambiguous",
        "topic": "profesorado",
        "difficulty": "medium",
        "chunk_metadata": {
            "chunk_index": 9,
            "category": "Grado",
            "source": "Inteligencia Artifificial.pdf",
            "degree": "Grado en Ciencia de Datos e Inteligencia Artificial",
            "course": "Curso 2022:2023"
        }
    },
    {
        "sample_id": "81",
        "generation_method": "llm_generated",
        "language": "es",
        "question": "¿Cómo se evalúa la asignatura de Vision por Computador en el Master Universitario en Inteligencia Artificial?",
        "answer": "",
        "ground_truth": "La evaluación de la asignatura se realiza mediante dos prácticas grupales con un peso del 30% cada una y un examen final con un peso del 40%. ",
        "contexts": [],
        "reference_contexts": [
            "[Curso 2022:2023 - Master Universitario en Inteligencia Artificial - Vision por Computador.pdf]\n8.1. Recursos didácticos de la asignatura\nD. Forsyth, J. Ponce. Computer Vision. A modern approach. Pearson., Tipo = Bibliografía. D. Forsyth, J. Ponce. Computer Vision. A modern approach. Pearson., Observaciones = Libro de texto. R. Szeliski. Computer vision: Algorithms and applications. Springer, 2021., Tipo = Bibliografía. R. Szeliski. Computer vision: Algorithms and applications. Springer, 2021., Observaciones = Libro de texto.. https://moodle.upm.es/titulaciones/ofi ciales/login, Tipo = Recursos web. https://moodle.upm.es/titulaciones/ofi ciales/login, Observaciones = Documentación de la asignatura en el Aula Virtual de la UPM. Ian Goodfellow, Yoshua Bengio, Aaron Courville. Deep Learning. MIT Press. 2016, Tipo = Bibliografía. Ian Goodfellow, Yoshua Bengio, Aaron Courville. Deep Learning. MIT Press. 2016, Observaciones = Libro sobre aprendizaje profundo."
        ],
        "source_document": "Vision por Computador.pdf",
        "chunk_id": "Curso 2022:2023_Master Universitario en Inteligencia Artificial_Vision por Computador.pdf_ch_14",
        "question_type": "procedural",
        "topic": "tfm",
        "difficulty": "hard",
        "chunk_metadata": {
            "source": "Vision por Computador.pdf",
            "degree": "Master Universitario en Inteligencia Artificial",
            "chunk_index": 14,
            "course": "Curso 2022:2023",
            "category": "Máster"
        }
    },
    {
        "sample_id": "82",
        "generation_method": "llm_generated",
        "language": "es",
        "question": "¿Cuántos alumnos forman un grupo de prácticas?",
        "answer": "",
        "ground_truth": "La práctica se realizará en grupos de 4 alumnos.",
        "contexts": [],
        "reference_contexts": [
            "[Curso 2023:2024 - Grado en Ingenieria Informatica - Probabilidades y Estadistica I.pdf]\nTeoría\nInforme práctico La práctica se realizará en grupos de 4 alumnos, según el guion que será proporcionado por los profesores. El informe práctico se entregará a través de Moodle en la fecha publicada en dicha plataforma. Para la prueba global y la convocatoria extraordinaria de julio, las fechas de entrega serán las de los exámenes correspondientes. Los  alumnos  que  quieran  formar  un  grupo  de  prácticas  deberán  comunicárselo  al  profesor  antes  de  la  fecha publicada  en  el  Moodle.  En  el  caso  de  que  el  alumno  no  forme  parte  de  un  grupo,  el  profesor  le  pondrá  en contacto con otros compañeros para formar un grupo. Los alumnos que no se pongan en contacto con su profesor para  formar  un  grupo  antes  de  la  fecha  fijada  no  podrán  realizar  la  práctica  hasta  la  convocatoria  de  julio.  La recogida de datos se hará a través del Moodle. Los grupos que se detecte que se hayan copiado entre sí, deberán repetir las prácticas con otros datos diferentes. Además, se comunicará al equipo Directivo del centro, que, según los estatutos de la Universidad Politécnica de Madrid, podrá iniciar el procedimiento disciplinario correspondiente. Prueba global y convocatoria extraordinaria Tanto en la prueba global como en la convocatoria extraordinaria se realizarán las mismas pruebas de evaluación que las realizadas durante la evaluación progresiva (exámenes de teoría e informe práctico). Solo los alumnos que hayan suspendido alguna de dichas pruebas de evaluación (con una nota menor que 5) podrán presentarse a dicha prueba; es decir, los alumnos no pueden presentarse a subir nota en una prueba ya aprobada. El informe práctico deberá haber sido entregado en la fecha publicadas en el Moodle y según las normas indicadas en el apartado anterior. BORRADOR\nLos  alumnos  que  hayan  aprobado  la  asignatura  durante  las  pruebas  de  evaluación  progresiva  no  podrán presentarse a la prueba global o a la convocatoria extraordinaria."
        ],
        "source_document": "Probabilidades y Estadistica I.pdf",
        "chunk_id": "Curso 2023:2024_Grado en Ingenieria Informatica_Probabilidades y Estadistica I.pdf_ch_15",
        "question_type": "factual",
        "topic": "plan_de_estudios",
        "difficulty": "easy",
        "chunk_metadata": {
            "degree": "Grado en Ingenieria Informatica",
            "course": "Curso 2023:2024",
            "chunk_index": 15,
            "category": "Grado",
            "source": "Probabilidades y Estadistica I.pdf"
        }
    },
    {
        "sample_id": "83",
        "generation_method": "llm_generated",
        "language": "es",
        "question": "¿Qué duración tiene la actividad del tipo Prácticas de Laboratorio?",
        "answer": "",
        "ground_truth": "La asignatura se evalúa mediante dos prácticas grupales con peso del 30% cada una y un examen final del 40%",
        "contexts": [],
        "reference_contexts": [
            "[Curso 2020:2021 - Grado en Ingeniería Biomédica - Sistemas de Información Biomédica.pdf]\n5.1. Cronograma de la asignatura *\n Magistral. 13, 3 = . 14, 1 = Tema 8 Duración: 02:30 PL: Actividad del tipo Prácticas de Laboratorio. 14, 2 = Según la recomendaciones de la universidad, las clases presenciales podrán ser sustituidas por tele enseñanza Duración: 00:00 LM: Actividad del tipo Lección Magistral BORRADOR. 14, 3 = Presentación de trabajos en grupo TG: Técnica del tipo Trabajo en Grupo Evaluación continua Presencial Duración: 02:30. 15, 1 = . 15, 2 = . 15, 3 = . 16, 1 = . 16, 2 = . 16, 3 = . 17, 1 = . 17, 2 = . 17, 3 = Examen final, en casos especiales justificados EX: Técnica del tipo Examen Escrito Evaluación sólo prueba final Presencial Duración: 01:00\nPara el cálculo de los valores totales, se estima que por cada crédito ECTS el alumno dedicará dependiendo del plan de estudios, entre 26 y 27 horas de trabajo presencial y no presencial.\n* El cronograma sigue una planificación teórica de la asignatura y puede sufrir modificaciones durante el curso derivadas de la situación creada por la COVID-19."
        ],
        "source_document": "Sistemas de Información Biomédica.pdf",
        "chunk_id": "Curso 2020:2021_Grado en Ingeniería Biomédica_Sistemas de Información Biomédica.pdf_ch_10",
        "question_type": "factual",
        "topic": "plan_de_estudios",
        "difficulty": "easy",
        "chunk_metadata": {
            "category": "Grado",
            "course": "Curso 2020:2021",
            "chunk_index": 10,
            "source": "Sistemas de Información Biomédica.pdf",
            "degree": "Grado en Ingeniería Biomédica"
        }
    },
    {
        "sample_id": "84",
        "generation_method": "llm_generated",
        "language": "es",
        "question": "",
        "answer": "",
        "ground_truth": "",
        "contexts": [],
        "reference_contexts": [
            "[Curso 2021:2022 - Master Universitario en Ciencia de Datos - Recuperacion, Extracción e Integracion de la Informacion.pdf]\n4. Brief description of the subject and syllabus\n\n1, Description = Estudio autónomo. 1, Modality = . 1, Type = No Presential. 1, Duration = 04:00. 1, Weight = %. 1, Minimum grade = 3 / 10. 1, Evaluated skills = . 1, Description = Estudio autónomo. 1, Modality = . 1, Type = No Presential. 1, Duration = 04:00. 1, Weight = %. 1, Minimum grade = 3 / 10. 1, Evaluated skills = . 2, Description = Estudio autónomo. 2, Modality = . 2, Type = No Presential. 2, Duration = 04:00. 2, Weight = %. 2, Minimum grade = 3 / 10. 2, Evaluated skills = . 2, Description = Estudio autónomo. 2, Modality = . 2, Type = No Presential. 2, Duration = 05:00. 2, Weight = %. 2, Minimum grade = 3 / 10. 2, Evaluated skills = . 3, Description = Entrega trabajo individual. 3, Modality = . 3, Type = No Presential. 3, Duration = 06:00. 3, Weight = 25%. 3, Minimum grade = 3 / 10. 3, Evaluated skills = CG07. 3, Description = Estudio autónomo. 3, Modality = . 3, Type = No Presential. 3, Duration = 05:00. 3, Weight = %. 3, Minimum grade = 3 / 10. 3, Evaluated skills = . 4, Description = Estudio autónomo. 4, Modality = . 4, Type = No Presential. 4, Duration = 04:00. 4, Weight = %. 4, Minimum grade = 3 / 10. 4, Evaluated skills = . 4, Description = Estudio autónomo. 4, Modality = . 4, Type = No Presential. 4, Duration = 04:00. 4, Weight = %. 4, Minimum grade = 3 / 10. 4, Evaluated skills = . 5, Description = Entrega trabajo en grupo. 5, Modality = . 5, Type = No Presential. 5, Duration = 06:00. 5, Weight = 25%. 5, Minimum grade = 3 / 10. 5, Evaluated skills"
        ],
        "source_document": "Recuperacion, Extracción e Integracion de la Informacion.pdf",
        "chunk_id": "Curso 2021:2022_Master Universitario en Ciencia de Datos_Recuperacion, Extracción e Integracion de la Informacion.pdf_ch_7",
        "question_type": "factual",
        "topic": "plan_de_estudios",
        "difficulty": "medium",
        "chunk_metadata": {
            "category": "Máster",
            "degree": "Master Universitario en Ciencia de Datos",
            "course": "Curso 2021:2022",
            "source": "Recuperacion, Extracción e Integracion de la Informacion.pdf",
            "chunk_index": 7
        }
    },
    {
        "sample_id": "85",
        "generation_method": "llm_generated",
        "language": "es",
        "question": "¿Cuál es el correo electrónico del coordinador de la asignatura?",
        "answer": "",
        "ground_truth": "El correo electrónico del coordinador de la asignatura es juan.fdezpozo.salamanca@upm.es.",
        "contexts": [],
        "reference_contexts": [
            "[Curso 2022:2023 - Maser Universitario en Ingenieria Informatica - Minería de Modelos para la Toma de Decisiones.pdf]\n2.1. Profesorado implicado en la docencia\nJuan Antonio Fdez Del Pozo De Salamanca (Coordinador/a), Despacho = 2101. Juan Antonio Fdez Del Pozo De Salamanca (Coordinador/a), Correo electrónico = juan.fdezpozo.salamanca@u pm.es. Juan Antonio Fdez Del Pozo De Salamanca (Coordinador/a), Horario de tutorías * = X - 11:00 - 14:00 V - 11:00 - 14:00. Alfonso Mateos Caballero, Despacho = 2110. Alfonso Mateos Caballero, Correo electrónico = alfonso.mateos@upm.es. Alfonso Mateos Caballero, Horario de tutorías * = M - 10:00 - 11:00 M - 13:00 - 14:00 X - 10:00 - 14:00\nBORRADOR\nArminda Moreno Diaz, 1 = 2112. Arminda Moreno Diaz, 2 = arminda.moreno@upm.es. Arminda Moreno Diaz, 3 = L - 12:00 - 14:00 X - 12:00 - 14:00\n- CB7 - Que los estudiantes sepan aplicar los conocimientos adquiridos y su capacidad de resolución de problemas en entornos nuevos o poco conocidos dentro de contextos más amplios (o multidisciplinares) relacionados con su área de estudio\n* Las horas de tutoría son orientativas y pueden sufrir modificaciones. Se deberá confirmar los horarios de tutorías con el profesorado. 3. Conocimientos previos recomendados 3.1. Asignaturas previas que se recomienda haber cursado - TÉcnicas De OptimizaciÓn - Data Visualization - Analisis Inteligente De Datos 3.2. Otros conocimientos previos recomendados para cursar la asignatura El plan de estudios Master Universitario en Ingenieria Informatica no tiene definidos otros conocimientos previos para esta asignatura. 4. Competencias y resultados de aprendizaje 4.1. Competencias BORRADOR"
        ],
        "source_document": "Minería de Modelos para la Toma de Decisiones.pdf",
        "chunk_id": "Curso 2022:2023_Maser Universitario en Ingenieria Informatica_Minería de Modelos para la Toma de Decisiones.pdf_ch_3",
        "question_type": "factual",
        "topic": "profesorado",
        "difficulty": "easy",
        "chunk_metadata": {
            "category": "Grado",
            "course": "Curso 2022:2023",
            "chunk_index": 3,
            "source": "Minería de Modelos para la Toma de Decisiones.pdf",
            "degree": "Maser Universitario en Ingenieria Informatica"
        }
    },
    {
        "sample_id": "86",
        "generation_method": "llm_generated",
        "language": "es",
        "question": "¿Qué competencias lingüísticas comunicativas se deben obtener según el plan de estudios?",
        "answer": "",
        "ground_truth": "La asignatura requiere la obtención de las competencias lingüísticas comunicativas habladas y escritas en entornos académicos/profesionales nacionales/internacionales.",
        "contexts": [],
        "reference_contexts": [
            "[Curso 2022:2023 - Grado en Ingeniería Informática - Minería de Datos.pdf]\n3. Conocimientos previos recomendados\nCe 12/16 - Conocer los campos de aplicación de la informática, y tener una apreciación de la necesidad de poseer unos conocimientos técnicos profundos en ciertas áreas de aplicación; apreciación del grado de esta necesidad en, por lo menos, una situación. Ce 14/15 - Conocer el software, el hardware y las aplicaciones existentes en el mercado, así como el uso de sus elementos, y capacidad para familiarizarse con nuevas aplicaciones informáticas. Ce 17 - Conocer los temas informáticos avanzados de modo que permita a los alumnos vislumbrar y entender las fronteras  de  la  disciplina,  por  medio  de  la  inclusión  de  experiencias  de  aprendizaje  que  dirigen  a  los  alumnos desde los temas elementales a los temas avanzados o los temas de los que se nutren los novísimos desarrollos. Ce 44 - Conocimiento de tecnologías punteras relevantes y su aplicación. 4.2. Resultados del aprendizaje RA277 - Dado un problema real elegir la tecnología informática existente en el mercado mas apropiada para su solución y diseñar su desarrollo e integración, analizando la viabilidad de su solución, lo que se puede y no se puede conseguir a través del estado actual de desarrollo de la tecnología usada, y lo que se espera que avance en el futuro. RA278 - Desarrollar la solución matemática y algorítmica mas apropiada a un problema informático que requiera un tratamiento especialmente complejo, analizando y exponiendo su viabilidad. RA280  -  Obtención  de  las  competencias  lingüísticas  comunicativas  (comprensión,  expresión,  etc.)  habladas  y escritas en entornos académicos/profesionales nacionales/internacionales. RA281  -  Obtención  de  las  técnicas  necesarias  para  la  realización  de  un  informe  o  memoria  sobre  un  trabajo realizado en un entorno socio-lingüístico nacional/internacional. BORRADOR"
        ],
        "source_document": "Minería de Datos.pdf",
        "chunk_id": "Curso 2022:2023_Grado en Ingeniería Informática_Minería de Datos.pdf_ch_5",
        "question_type": "factual",
        "topic": "otros",
        "difficulty": "easy",
        "chunk_metadata": {
            "degree": "Grado en Ingeniería Informática",
            "category": "Grado",
            "source": "Minería de Datos.pdf",
            "course": "Curso 2022:2023",
            "chunk_index": 5
        }
    },
    {
        "sample_id": "87",
        "generation_method": "llm_generated",
        "language": "es",
        "question": "¿Cómo se relacionan los métodos analíticos y de modelización con la formalización y especificación de problemas reales en informática?",
        "answer": "",
        "ground_truth": "Los estudiantes deben saber elegir y usar los métodos analíticos y de modelización relevantes para describir una solución de forma abstracta, lo que se relaciona con la capacidad de formalizar y especificar problemas reales cuya solución requiere el uso de la informática.",
        "contexts": [],
        "reference_contexts": [
            "[Curso 2020:2021 - Grado en Matemática e Informática (ML) - Lenguajes Formales, Automatas y Computabilidad.pdf]\n2.1. Profesorado implicado en la docencia\n* Las horas de tutoría son orientativas y pueden sufrir modificaciones. Se deberá confirmar los horarios de tutorías con el profesorado. 3. Competencias y resultados de aprendizaje 3.1. Competencias CE07 - Conocer los cimientos esenciales y fundacionales de la informática, subrayando los aspectos esenciales de la disciplina que permanecen inalterables ante el cambio tecnológico. CE08 - Formalización y especificación de problemas reales cuya solución requiere el uso de la informática. CE09 - Capacidad de elegir y usar los métodos analíticos y de modelización relevantes, y de describir una solución de forma abstracta. 3.2. Resultados del aprendizaje RA26 - Adquirir destreza en la aplicación de los diferentes métodos de demostración. RA27 - Distinguir y reconocer las distintas clases de lenguajes y sus autómatas asociados según la jerarquía de Chomsky. RA25 - Modelar mediante procedimientos finitos conjuntos y lenguajes infinitos. BORRADOR\nRA28  -  Conocer  modelos  de  cómputo  universales  así  como  los  límites  de  lo  que  puede  o  no  ser  computado mediante un algoritmo."
        ],
        "source_document": "Lenguajes Formales, Automatas y Computabilidad.pdf",
        "chunk_id": "Curso 2020:2021_Grado en Matemática e Informática (ML)_Lenguajes Formales, Automatas y Computabilidad.pdf_ch_4",
        "question_type": "comparative",
        "topic": "tfm",
        "difficulty": "medium",
        "chunk_metadata": {
            "chunk_index": 4,
            "category": "Grado",
            "degree": "Grado en Matemática e Informática (ML)",
            "course": "Curso 2020:2021",
            "source": "Lenguajes Formales, Automatas y Computabilidad.pdf"
        }
    },
    {
        "sample_id": "88",
        "generation_method": "llm_generated",
        "language": "es",
        "question": "¿Cómo se calcula la nota final de las prácticas en este curso?",
        "answer": "",
        "ground_truth": "La nota final de las prácticas se calcula como la media de las notas de las prácticas.",
        "contexts": [],
        "reference_contexts": [
            "[Curso 2020:2021 - Doble grado Ingeniería Informática y ADE - Programación Declarativa, Lógica y Restricciones.pdf]\n7.2. Criterios de evaluación\nEvaluación contínua: Se realizarán varias prácticas durante el curso, individualmente, y un examen individual de evaluación continua. Los estudiantes que no quieran realizar la evaluación continua deberán solicitarlo al coordinador de la asignatura en las primeras 4 semanas de clase. Exámenes / Calificación: La nota de prácticas será la media de las notas de las prácticas. Si se han aprobado las prácticas con garantía de autenticidad y el examen individual de evaluación continua, la nota final será la media de ambas. Evaluación extraordinaria: Sólo se puede aprobar por examen final. En este caso no hay prácticas. 8. Recursos didácticos 8.1. Recursos didácticos de la asignatura BORRADOR\n``The Art of Prolog'' (Second edition), Sterling & Shapiro, MIT Press, 1994., Tipo = Bibliografía. ``The Art of Prolog'' (Second edition), Sterling & Shapiro, MIT Press, 1994., Observaciones = . ``From Logic Programming to Prolog'', K. Apt, Prentice-Hall, 1997., Tipo = Bibliografía. ``From Logic Programming to Prolog'', K. Apt, Prentice-Hall, 1997., Observaciones = . ``Prolog Programming for Artificial Intelligence'', I. Bratko, Addison- Wesley Ltd. 1990 (2nd edition); 2000 (3rd edition)., Tipo = Bibliografía. ``Prolog Programming for Artificial Intelligence'', I. Bratko, Addison- Wesley Ltd. 1990 (2nd edition); 2000 (3rd edition)., Observaciones = \n[Powered by TCPDF (www.tcpdf.org)](http://www.tcpdf.org/)"
        ],
        "source_document": "Programación Declarativa, Lógica y Restricciones.pdf",
        "chunk_id": "Curso 2020:2021_Doble grado Ingeniería Informática y ADE_Programación Declarativa, Lógica y Restricciones.pdf_ch_19",
        "question_type": "factual",
        "topic": "plan_de_estudios",
        "difficulty": "medium",
        "chunk_metadata": {
            "degree": "Doble grado Ingeniería Informática y ADE",
            "course": "Curso 2020:2021",
            "chunk_index": 19,
            "category": "Grado",
            "source": "Programación Declarativa, Lógica y Restricciones.pdf"
        }
    },
    {
        "sample_id": "89",
        "generation_method": "llm_generated",
        "language": "es",
        "question": "¿Cómo se accede al material didáctico de la asignatura?",
        "answer": "",
        "ground_truth": "Se puede acceder al material didáctico de la asignatura a través del campus virtual Moodle.",
        "contexts": [],
        "reference_contexts": [
            "[Curso 2022:2023 - Grado en Ingeniería Informática - Computabilidad- Fundamentos y Aplicaciones.pdf]\n8.1. Recursos didácticos de la asignatura\nMaterial didáctico de la asignatura, disponible en Moodle., Tipo = Bibliografía. Material didáctico de la asignatura, disponible en Moodle., Observaciones = <br />. H. Lewis, C. H. Papadimitriou. Elements of the Theory of Computation. Prentice Hall, 1997., Tipo = Bibliografía. H. Lewis, C. H. Papadimitriou. Elements of the Theory of Computation. Prentice Hall, 1997., Observaciones = . N.J. Cutland. Computabilility. Cambridge University Press, 1980., Tipo = Bibliografía. N.J. Cutland. Computabilility. Cambridge University Press, 1980., Observaciones = . S. B. Cooper. Computability Theory. Chapman & Hall/CRC, 2004., Tipo = Bibliografía. S. B. Cooper. Computability Theory. Chapman & Hall/CRC, 2004., Observaciones = . H, Rogers, Theory of Recursive Functions and Effective Computability. McGraw-Hill, 1967., Tipo = Bibliografía. H, Rogers, Theory of Recursive Functions and Effective Computability. McGraw-Hill, 1967., Observaciones = BORRADOR. G. S. Boolos, R. C. Jeffrey. Computability and Logic, 3rd ed. Cambridge University Press, 1994., Tipo = Bibliografía. G. S. Boolos, R. C. Jeffrey. Computability and Logic, 3rd ed. Cambridge University Press, 1994., Observaciones = . H. Simon. Explaining the Ineffable. Proc., 14th IJCAI, 1995., Tipo = Bibliografía. H. Simon. Explaining the Ineffable. Proc., 14th IJCAI, 1995., Observaciones = . The Interproc Analyzer, Tipo = Recursos web. The Interproc Analyzer, Observaciones = http://pop- art.inrialpes.fr/interproc/interprocweb.cgi. D. Zanardini. Teoría de la Computabilidad - de los resultados clásicos al día a día de la Informática. Administracióndigital S.L., Tipo = Bibliografía. D. Zanardini. Teoría de la Computabilidad - de los resultados clásicos al día a día de la Informática. Administracióndigital S.L., Observaciones = \n[Powered by TCPDF (www.tcpdf.org)](http://www.tcpdf.org/)"
        ],
        "source_document": "Computabilidad- Fundamentos y Aplicaciones.pdf",
        "chunk_id": "Curso 2022:2023_Grado en Ingeniería Informática_Computabilidad- Fundamentos y Aplicaciones.pdf_ch_17",
        "question_type": "factual",
        "topic": "plan_de_estudios",
        "difficulty": "easy",
        "chunk_metadata": {
            "source": "Computabilidad- Fundamentos y Aplicaciones.pdf",
            "degree": "Grado en Ingeniería Informática",
            "course": "Curso 2022:2023",
            "category": "Grado",
            "chunk_index": 17
        }
    },
    {
        "sample_id": "90",
        "generation_method": "llm_generated",
        "language": "es",
        "question": "¿Cuáles son los requisitos para la presentación del proyecto final?",
        "answer": "",
        "ground_truth": "out_of_scope",
        "contexts": [],
        "reference_contexts": [],
        "source_document": "N/A",
        "chunk_id": "N/A",
        "question_type": "out_of_scope",
        "topic": "tfm",
        "difficulty": "hard",
        "chunk_metadata": {
            "chunk_index": 6,
            "course": "Curso 2021:2022",
            "category": "Máster",
            "degree": "Master Universitario en Ingenieria Informstica",
            "source": "Recuperacion e Integracion de Informacion.pdf"
        }
    },
    {
        "sample_id": "91",
        "generation_method": "llm_generated",
        "language": "es",
        "question": "¿Qué título del artículo de González-Pachón y Romero es el año del que se tratan?",
        "answer": "",
        "ground_truth": "El año del que trata el artículo de González-Pachón y Romero es 2009.",
        "contexts": [],
        "reference_contexts": [
            "[Curso 2021:2022 - Master Universitario en Inteligencia Artificial - Ciencia de la Web.pdf]\n8.1. Recursos didácticos de la asignatura\nArtículo3, 1 = Bibliografía. Artículo3, 2 = González-Pachón, J; Romero, C. (2009) Aggregation of Ordinal and Cardinal Preferences: A Framework Based on Distance Functions, Journal of Multi-criteria Decision Analysis 15: 79-85.. Artículo4, 1 = Bibliografía. Artículo4, 2 = Adomavicius, G.; Tuzhilin, A. (June 2005). \"Toward the Next Generation of Recommender Systems: A Survey of the State-of-the-Art and Possible Extensions\". IEEE Transactions on Knowledge and Data Engineering 17 (6): 734?749. doi:10.1109/TKDE.2005.99."
        ],
        "source_document": "Ciencia de la Web.pdf",
        "chunk_id": "Curso 2021:2022_Master Universitario en Inteligencia Artificial_Ciencia de la Web.pdf_ch_15",
        "question_type": "factual",
        "topic": "otros",
        "difficulty": "easy",
        "chunk_metadata": {
            "chunk_index": 15,
            "course": "Curso 2021:2022",
            "category": "Máster",
            "source": "Ciencia de la Web.pdf",
            "degree": "Master Universitario en Inteligencia Artificial"
        }
    },
    {
        "sample_id": "92",
        "generation_method": "llm_generated",
        "language": "es",
        "question": "¿Cuál es la diferencia en duración entre las prácticas individuales evaluadas al principio y al final del curso?",
        "answer": "",
        "ground_truth": "Las prácticas individuales al principio duran 02:00, mientras que las del final duran 03:00",
        "contexts": [],
        "reference_contexts": [
            "[Curso 2021:2022 - Grado en Ingenieria Informatica  -  Programacion Declarativa- Logica y Restricciones.pdf]\n6.1. Cronograma de la asignatura *\n 7, Actividad presencial en aula = 3.3 y 3.4 Duración: 02:00 LM: Actividad del tipo Lección Magistral. 7, Actividad presencial en laboratorio = Clase práctica (opcional) Duración: 01:00 PL: Actividad del tipo Prácticas de Laboratorio. 7, Actividades de evaluación = Elaboración de las prácticas TI: Técnica del tipo Trabajo Individual Evaluación continua No presencial Duración: 02:00. 8, Actividad presencial en aula = . 8, Actividad presencial en laboratorio = Clase práctica Duración: 02:00 PL: Actividad del tipo Prácticas de Laboratorio. 8, Actividades de evaluación = Elaboración de las prácticas TI: Técnica del tipo Trabajo Individual Evaluación continua No presencial Duración: 03:00. 9, Actividad presencial en aula = 3.5 Duración: 02:00 LM: Actividad del tipo Lección Magistral. 9, Actividad presencial en laboratorio = . 9, Actividades de evaluación = Elaboración de las prácticas TI: Técnica del tipo Trabajo Individual Evaluación continua No presencial Duración: 03:00"
        ],
        "source_document": " Programacion Declarativa- Logica y Restricciones.pdf",
        "chunk_id": "Curso 2021:2022_Grado en Ingenieria Informatica _ Programacion Declarativa- Logica y Restricciones.pdf_ch_7",
        "question_type": "comparative",
        "topic": "plan_de_estudios",
        "difficulty": "medium",
        "chunk_metadata": {
            "course": "Curso 2021:2022",
            "degree": "Grado en Ingenieria Informatica ",
            "category": "Grado",
            "source": " Programacion Declarativa- Logica y Restricciones.pdf",
            "chunk_index": 7
        }
    },
    {
        "sample_id": "93",
        "generation_method": "llm_generated",
        "language": "es",
        "question": "¿Cuántos minutos dura el examen?",
        "answer": "",
        "ground_truth": "El examen tiene una duración de 02:00 horas, lo que equivale a 120 minutos.",
        "contexts": [],
        "reference_contexts": [
            "[Curso 2023:2024 - Grado en Ciencia de Datos e Inteligencia Artificial - Web Semantica, Linked Data y Grafos de Conocimiento.pdf]\n7.1.3. Evaluación convocatoria extraordinaria\nExamen / Exam, Modalidad = EX: Técnica del tipo Examen Escrito. Examen / Exam, Tipo = Presencial. Examen / Exam, Duración = 02:00. Examen / Exam, Peso en la nota = 100%. Examen / Exam, Nota mínima = 5 / 10. Examen / Exam, Competencias evaluadas = CB01 CB02 CB03 CB04 CB05 CG01 CG02 CG04 CG06 CG07 CE11 CE14\nBORRADOR"
        ],
        "source_document": "Web Semantica, Linked Data y Grafos de Conocimiento.pdf",
        "chunk_id": "Curso 2023:2024_Grado en Ciencia de Datos e Inteligencia Artificial_Web Semantica, Linked Data y Grafos de Conocimiento.pdf_ch_15",
        "question_type": "factual",
        "topic": "plan_de_estudios",
        "difficulty": "easy",
        "chunk_metadata": {
            "category": "Grado",
            "course": "Curso 2023:2024",
            "source": "Web Semantica, Linked Data y Grafos de Conocimiento.pdf",
            "degree": "Grado en Ciencia de Datos e Inteligencia Artificial",
            "chunk_index": 15
        }
    },
    {
        "sample_id": "94",
        "generation_method": "llm_generated",
        "language": "es",
        "question": "¿Cómo se utilizarán los recursos didácticos de la asignatura en el curso?",
        "answer": "",
        "ground_truth": "La asignatura utiliza recursos web para apoyar las clases.",
        "contexts": [],
        "reference_contexts": [
            "[Curso 2022:2023 - Master Universitario en Ciencia de Datos itinerario Health - Graph Analysis And Social Networks.pdf]\n7.1. Recursos didácticos de la asignatura\nNombre, 1 = Tipo. Slides, 1 = Recursos web\nBORRADOR"
        ],
        "source_document": "Graph Analysis And Social Networks.pdf",
        "chunk_id": "Curso 2022:2023_Master Universitario en Ciencia de Datos itinerario Health_Graph Analysis And Social Networks.pdf_ch_14",
        "question_type": "procedural",
        "topic": "tfm",
        "difficulty": "medium",
        "chunk_metadata": {
            "category": "Máster",
            "degree": "Master Universitario en Ciencia de Datos itinerario Health",
            "source": "Graph Analysis And Social Networks.pdf",
            "course": "Curso 2022:2023",
            "chunk_index": 14
        }
    },
    {
        "sample_id": "95",
        "generation_method": "llm_generated",
        "language": "es",
        "question": "La situación sanitaria causada por la pandemia COVID-19 que se prevé para el semestre en cuestión, ¿permite utilizar el aforo completo de las aulas?",
        "answer": "",
        "ground_truth": "La asignatura se impartirá con un uso máximo del 100% de capacidad en las aulas.",
        "contexts": [],
        "reference_contexts": [
            "[Curso 2021:2022 - Grado en Matematicas e Informatica - Probabilidades y Estadistica II.pdf]\n8.1. Recursos didácticos de la asignatura\n Ejercicios de Estadística. 3ª ed. ICE ediciones, 1 = Bibliografía. Ríos, S. (1977). Ejercicios de Estadística. 3ª ed. ICE ediciones, 2 = . Rodríguez Muñíz, L. J., Tomeo Perucha, V., Uña Juárez, I. (2011) Métodos Estadísticos para, 1 = Bibliografía. Rodríguez Muñíz, L. J., Tomeo Perucha, V., Uña Juárez, I. (2011) Métodos Estadísticos para, 2 = Ingeniería. Editorial Garceta.\n[Powered by TCPDF (www.tcpdf.org)](http://www.tcpdf.org/)\nSitio Moodle de la asignatura (http:// moodle.upm.es/titulaciones/oficiales/), 1 = Recursos web. Sitio Moodle de la asignatura (http:// moodle.upm.es/titulaciones/oficiales/), 2 = La comunicación con los alumnos se realizará vía moodle, por lo que deberá revisarse periódicamente.. Laboratorio: Sala de ordenadores asignada, 1 = Equipamiento. Laboratorio: Sala de ordenadores asignada, 2 = . Aula asignada, 1 = Equipamiento. Aula asignada, 2 = . Sala de trabajo en grupo, 1 = Equipamiento. Sala de trabajo en grupo, 2 = \nSi las condiciones sanitarias no permitieran usar el aforo completo de las aulas, se pasará a una modalidad de presencialidad mixta por turnos, como el planteado en asignaturas de primer semestre, sin necesidad de modificar esta guía.\n9. Otra información 9.1. Otra información sobre la asignatura Se prevé que la situación sanitaria causada por la pandemia COVID-19 haya mejorado lo suficiente como para permitir utilizar el aforo completo de las aulas. Por ello se ha planificado la docencia de este semestre en modo presencial. Si la situación lo permitiese el examen de la unidad didáctica 1 se realizaría de modo presencial. BORRADOR"
        ],
        "source_document": "Probabilidades y Estadistica II.pdf",
        "chunk_id": "Curso 2021:2022_Grado en Matematicas e Informatica_Probabilidades y Estadistica II.pdf_ch_22",
        "question_type": "factual",
        "topic": "otros",
        "difficulty": "medium",
        "chunk_metadata": {
            "degree": "Grado en Matematicas e Informatica",
            "source": "Probabilidades y Estadistica II.pdf",
            "category": "Grado",
            "chunk_index": 22,
            "course": "Curso 2021:2022"
        }
    },
    {
        "sample_id": "96",
        "generation_method": "llm_generated",
        "language": "es",
        "question": "¿Cuál es la habilidad de aprendizaje que los estudiantes deben poseer para poder continuar estudiando de manera autodirigida o autónoma?",
        "answer": "",
        "ground_truth": "Los estudiantes deben poseer las habilidades de aprendizaje que les permitan continuar estudiendo de un modo que habrá de ser en gran medida autodirigido o autónomo.",
        "contexts": [],
        "reference_contexts": [
            "[Curso 2023:2024 - Master Universitario en Innovacion Digital - Information Retrieval Extraction and Integration.pdf]\n2.1. Profesorado implicado en la docencia\n* Las horas de tutoría son orientativas y pueden sufrir modificaciones. Se deberá confirmar los horarios de tutorías con el profesorado. 3. Competencias y resultados de aprendizaje 3.1. Competencias CB07  -  Que  los  estudiantes  sepan  aplicar  los  conocimientos  adquiridos  y  su  capacidad  de  resolución  de problemas  en  entornos  nuevos  o  poco  conocidos  dentro  de  contextos  más  amplios  (o  multidisciplinares) relacionados con su área de estudio CB10 - Que los estudiantes posean las habilidades de aprendizaje que les permitan continuar estudiando de un modo que habrá de ser en gran medida autodirigido o autónomo. CE-CD06 - Capacidad para extraer, integrar y consultar datos heterogéneos en diferentes escenarios CG01 - Que los estudiantes sean capaces de predecir y controlar la evolución de situaciones complejas mediante el  desarrollo  de  nuevas  e  innovadoras  metodologías  de  trabajo  adaptadas  al  ámbito  científico/investigador, tecnológico o profesional concreto, en general multidisciplinar, en el que se desarrolle su actividad. BORRADOR"
        ],
        "source_document": "Information Retrieval Extraction and Integration.pdf",
        "chunk_id": "Curso 2023:2024_Master Universitario en Innovacion Digital_Information Retrieval Extraction and Integration.pdf_ch_4",
        "question_type": "factual",
        "topic": "plan_de_estudios",
        "difficulty": "easy",
        "chunk_metadata": {
            "source": "Information Retrieval Extraction and Integration.pdf",
            "category": "Máster",
            "degree": "Master Universitario en Innovacion Digital",
            "course": "Curso 2023:2024",
            "chunk_index": 4
        }
    },
    {
        "sample_id": "97",
        "generation_method": "llm_generated",
        "language": "es",
        "question": "¿Cuál es el peso de la práctica grupal en la evaluación de la asignatura?",
        "answer": "",
        "ground_truth": "La práctica grupal cuenta con un peso del 30% en la evaluación.",
        "contexts": [],
        "reference_contexts": [
            "[Curso 2023:2024 - Grado en Ingenieria Informatica - Computabilidad- Fundamentos y Aplicaciones.pdf]\n9.1. Otra información sobre la asignatura\nBORRADOR"
        ],
        "source_document": "Computabilidad- Fundamentos y Aplicaciones.pdf",
        "chunk_id": "Curso 2023:2024_Grado en Ingenieria Informatica_Computabilidad- Fundamentos y Aplicaciones.pdf_ch_18",
        "question_type": "factual",
        "topic": "tfm",
        "difficulty": "easy",
        "chunk_metadata": {
            "category": "Grado",
            "degree": "Grado en Ingenieria Informatica",
            "source": "Computabilidad- Fundamentos y Aplicaciones.pdf",
            "course": "Curso 2023:2024",
            "chunk_index": 18
        }
    },
    {
        "sample_id": "98",
        "generation_method": "llm_generated",
        "language": "es",
        "question": "¿Cómo se evalúa la asignatura en el curso 2022-2023?",
        "answer": "",
        "ground_truth": "La asignatura se evalúa mediante dos prácticas grupales con peso del 30% cada una y un examen final del 40%",
        "contexts": [],
        "reference_contexts": [
            "[Curso 2022:2023 - Doble Grado Ingenieria Informatica y ADE - Lenguajes Formales, Automatas y Computabilidad.pdf]\n5.1. Cronograma de la asignatura *\n1, Actividad presencial en aula = Tema 1 Duración: 02:00 LM: Actividad del tipo Lección Magistral Prácticas Duración: 01:00 PL: Actividad del tipo Prácticas de Laboratorio. 1, Actividad presencial en laboratorio = . 1, Tele-enseñanza = . 1, Actividades de evaluación = . 2, Actividad presencial en aula = Tema 1 Duración: 02:00 LM: Actividad del tipo Lección Magistral Prácticas Duración: 01:00 PL: Actividad del tipo Prácticas de. 2, Actividad presencial en laboratorio = . 2, Tele-enseñanza = . 2, Actividades de evaluación = . 3, Actividad presencial en aula = Tema 2 Duración: 02:00 LM: Actividad del tipo Lección Magistral Prácticas Duración: 01:00 PL: Actividad del tipo Prácticas de Laboratorio. 3, Actividad presencial en laboratorio = BORRADOR. 3, Tele-enseñanza = . 3, Actividades de evaluación = . 4, Actividad presencial en aula = Tema 2 Duración: 02:00 LM: Actividad del tipo Lección Magistral Prácticas Duración: 01:00 PL: Actividad del tipo Prácticas de Laboratorio Tutoría Duración: 01:00 OT: Otras actividades formativas. 4, Actividad presencial en laboratorio = . 4, Tele-enseñanza = . 4, Actividades de evaluación = . 5, Actividad presencial en aula = Tema 3 Duración: 02:00 LM: Actividad del tipo Lección Magistral Prácticas Duración: 01:00 PL: Actividad del tipo Prácticas de Laboratorio. 5, Actividad presencial en laboratorio = . 5, Tele-enseñanza = . 5, Actividades de evaluación = "
        ],
        "source_document": "Lenguajes Formales, Automatas y Computabilidad.pdf",
        "chunk_id": "Curso 2022:2023_Doble Grado Ingenieria Informatica y ADE_Lenguajes Formales, Automatas y Computabilidad.pdf_ch_7",
        "question_type": "procedural",
        "topic": "plan_de_estudios",
        "difficulty": "hard",
        "chunk_metadata": {
            "chunk_index": 7,
            "category": "Grado",
            "degree": "Doble Grado Ingenieria Informatica y ADE",
            "course": "Curso 2022:2023",
            "source": "Lenguajes Formales, Automatas y Computabilidad.pdf"
        }
    },
    {
        "sample_id": "99",
        "generation_method": "llm_generated",
        "language": "es",
        "question": "¿Cuántos ECTS tiene el curso de Biología Programable?",
        "answer": "",
        "ground_truth": "La asignatura corresponde a 5 ECTS.",
        "contexts": [],
        "reference_contexts": [
            "[Curso 2023:2024 - Master Universitario en Inteligencia Artificial - Biología Programable- Computación con Adn e Ingeniería de Biocircuitos.pdf]\nIndex\n1. Description...............................................................................................................................................................1 = 2. Faculty.....................................................................................................................................................................1. 1. Description...............................................................................................................................................................1 = 3. Skills and learning outcomes ...................................................................................................................................2. 1. Description...............................................................................................................................................................1 = 4. Brief description of the subject and syllabus.............................................................................................................3. 1. Description...............................................................................................................................................................1 = 5. Schedule..................................................................................................................................................................6. 1. Description...............................................................................................................................................................1 = 6. Activities and assessment criteria............................................................................................................................9. 1. Description...............................................................................................................................................................1 = 7.Teachingresources.................................................................................................................................................12\nLearning guide DRAFT VERSIO\nPR/CL/001\nCOORDINATION PROCESS OF\nLEARNIN  ACTIVITIES\nANX-PR/CL/001-01\nLEARNIN   UIDE\nE.T.S. de Ingenieros\nInformaticos\nName of the subject, 1 = 103000363 - Programmable Biology: Dna Computing Amd Biocircuits Engineering. No of credits, 1 = 5 ECTS. Type, 1 = Optional. Academic year ot the programme, 1 = First year. Semester of tuition, 1 = Semester 1. Tuition period, 1 = September-January. Tuition languages, 1 = English. Degree programme, 1 = 10AJ - Master Universitario en Inteligencia Artificial. Centre, 1 = 10 - Escuela Tecnica Superior De Ingenieros Informaticos. Academic year, 1 = 2023-24\nAlfonso Vicente Rodriguez- Paton Aradas (Subject coordinator), Office/Room = 2106. Alfonso Vicente Rodriguez- Paton Aradas (Subject coordinator), Email = alfonso.rodriguez- paton@upm.es. Alfonso Vicente Rodriguez- Paton Aradas (Subject coordinator), Tutoring hours * = M - 17:00 - 19:00\n1. Description 1.1. Subject details 2. Faculty 2.1. Faculty members with subject teaching role DRAFT VERSIO"
        ],
        "source_document": "Biología Programable- Computación con Adn e Ingeniería de Biocircuitos.pdf",
        "chunk_id": "Curso 2023:2024_Master Universitario en Inteligencia Artificial_Biología Programable- Computación con Adn e Ingeniería de Biocircuitos.pdf_ch_1",
        "question_type": "factual",
        "topic": "plan_de_estudios",
        "difficulty": "easy",
        "chunk_metadata": {
            "course": "Curso 2023:2024",
            "chunk_index": 1,
            "source": "Biología Programable- Computación con Adn e Ingeniería de Biocircuitos.pdf",
            "degree": "Master Universitario en Inteligencia Artificial",
            "category": "Máster"
        }
    },
    {
        "sample_id": "100",
        "generation_method": "llm_generated",
        "language": "es",
        "question": "¿Qué sigue después de la descripción teórica y aplicada en el curso?",
        "answer": "",
        "ground_truth": "Se procederá a la aplicación práctica de los métodos y técnicas explicados.",
        "contexts": [],
        "reference_contexts": [
            "[Curso 2020:2021 - MU Ciencia de Datos - Análisis Estadístico de Datos.pdf]\nIndex\nCG08  -  Capacidad  de  pensamiento  de  forma  creativa  para  desarrollar  aproximaciones  y  métodos  nuevos  y originales CG14 - Capacidad de trabajar y comunicarse también en contextos internacionales CGI02 - Comprender el procedimiento, valor y límites del método científico en el campo de la Informática, siendo capaz  de  identificar,  localizar  y  obtener  datos  requeridos  en  un  trabajo  de  investigación,  de  diseñar  y  guiar investigaciones  analíticas,  de  modelado  y  experimentales,  así  como  de  evaluar  datos  de  una  manera  crítica  y extraer conclusiones 4.2. Learning outcomes RA1 - Conocer y aplicar las principales técnicas para explorar, describir y analizar datos multivariantes. RA3 - Aplicar la metodología apropiada para el ajuste de series temporales. RA2 - Conocer y aplicar técnicas de reducción de dimensionalidad y modelización de datos multivariantes. * The Learning Guides should reflect the Skills and Learning Outcomes in the same way as indicated in the Degree Verification Memory. For this reason, they have not been translated into English and appear in Spanish. 5. Brief description of the subject and syllabus 5.1. Brief description of the subject The  course  is  intended  to  be  a  non-exhaustive  survey  of  techinques  to  convert  multivariate  data  into  useful information so that good decisions can be made. The perspective is twofold, theorical and applied, covering topics such as: exploratory data analysis, statistical summaries and graphical representations, dimensionality reduction, regression techniques and time series analysis. There will be an emphasis on hands-on application of the theory and methods throughout, with extensive use of R.The course is taught in three modules which are broken down in topics below and properly referenced in the timeline. DRAFT VERSIO"
        ],
        "source_document": "Análisis Estadístico de Datos.pdf",
        "chunk_id": "Curso 2020:2021_MU Ciencia de Datos_Análisis Estadístico de Datos.pdf_ch_3",
        "question_type": "procedural",
        "topic": "plan_de_estudios",
        "difficulty": "easy",
        "chunk_metadata": {
            "category": "Máster",
            "course": "Curso 2020:2021",
            "chunk_index": 3,
            "degree": "MU Ciencia de Datos",
            "source": "Análisis Estadístico de Datos.pdf"
        }
    }
]